,id,name,type,display_type,activity_type_display_name,private,bike_id,athlete_gear_id,start_date,start_date_local_raw,start_time,start_day,distance,distance_raw,long_unit,short_unit,moving_time,moving_time_raw,elapsed_time,elapsed_time_raw,trainer,static_map,has_latlng,commute,elevation_gain,elevation_unit,elevation_gain_raw,description,activity_url,activity_url_for_twitter,twitter_msg,is_new,is_changing_type,suffer_score,calories,workout_type,flagged,hide_power,hide_heartrate,leaderboard_opt_out,visibility,start_date_local,exer_start_time,act_type_perc_time,elapsed_time_raw_hrs,moving_time_raw_hrs,distance_raw_km
0,4747286929,Morning Activity,AlpineSki,Alpine Ski,Alpine Ski,False,,,"Sat, 2/6/2021",1612605178,2021-02-06T16:52:58+0000,Sat,17.23,17238.0,kilometers,km,3:17:12,11832,5:46:28,20788,False,https://d3o5xota0a1fcr.cloudfront.net/v6/maps/Q3A4ZMSNSVGCKLIY54VSRUGS6X5ST6V6M6DL3NR5YOXVW7O6E7KB56EQTCRISIIWYLY5ALNYT4GFNML6IIYAVUDXKRA2QFAE,True,False,"1,220",m,1220.0,,https://www.strava.com/activities/4747286929,https://www.strava.com/activities/4747286929?utm_content=1464505&utm_medium=referral&utm_source=twitter,went for a 17.2 kilometer Alpine Ski.,True,False,,3342.0,,False,False,False,False,everyone,2021-02-06 09:52:58,1900-01-01 09:51:58-00:01,0.0012450108022996082,5.774444444444445,3.2866666666666666,17.238
1,4713874507,Lunch Activity,NordicSki,Nordic Ski,Nordic Ski,False,,,"Sun, 1/31/2021",1612095043,2021-01-31T19:10:43+0000,Sun,14.47,14469.0,kilometers,km,55:28,3328,59:15,3555,False,https://d3o5xota0a1fcr.cloudfront.net/v6/maps/YSBSVFNMT4IA4XVG3WMDCFV24UBBXPBQGIJJZMLTZDAN2SLIHD4SBNB3G4YFD4TJWENLGGMHUYNOY5XV6J6TH7Y6DOCLMIIA,True,False,179,m,179.0,,https://www.strava.com/activities/4713874507,https://www.strava.com/activities/4713874507?utm_content=1464505&utm_medium=referral&utm_source=twitter,went for a 14.4 kilometer Nordic Ski.,True,False,,784.0,,False,False,False,False,everyone,2021-01-31 12:10:43,1900-01-01 12:09:43-00:01,0.00035018559415594117,0.9875,0.9244444444444444,14.469
2,4701021399,Morning Run,Run,Run,Run,False,,,"Fri, 1/29/2021",1611914545,2021-01-29T17:02:25+0000,Fri,10.15,10154.0,kilometers,km,50:18,3018,53:41,3221,False,https://d3o5xota0a1fcr.cloudfront.net/v6/maps/SMJ6SYZOCUVDD22OKKI2N2YNEGSDZUKKN4SJG4ATEM3LMS4Z4JHKASOJ7L6LJYGPUJKCXGYFIX7AXHDSWX64NOW45IKTPOHT,True,False,69,m,69.0,,https://www.strava.com/activities/4701021399,https://www.strava.com/activities/4701021399?utm_content=1464505&utm_medium=referral&utm_source=twitter,went for a 10.1 kilometer Run.,True,False,,791.0,,False,False,False,False,everyone,2021-01-29 10:02:25,1900-01-01 10:01:25-00:01,0.0003175661427772327,0.8947222222222222,0.8383333333333334,10.154
3,4701018710,Morning Run,Run,Run,Run,False,,,"Thu, 1/28/2021",1611828259,2021-01-28T17:04:19+0000,Thu,7.88,7879.0,kilometers,km,37:33,2253,44:54,2694,False,https://d3o5xota0a1fcr.cloudfront.net/v6/maps/OTKPMVF65FTLBEUBY2DD2BWLVY7RV3DD6WZFRBCCJOKYJFK7HONZ7M3D2D6HI532RROL6P5FKSE23SXUKKIEBOQZWIG47ZJG,True,False,19,m,19.0,,https://www.strava.com/activities/4701018710,https://www.strava.com/activities/4701018710?utm_content=1464505&utm_medium=referral&utm_source=twitter,went for a 7.8 kilometer Run.,True,False,,782.0,,False,False,False,False,everyone,2021-01-28 10:04:19,1900-01-01 10:03:19-00:01,0.00023706975469751668,0.7483333333333333,0.6258333333333334,7.879
4,4685704460,Morning Run,Run,Run,Run,False,,,"Tue, 1/26/2021",1611656560,2021-01-26T17:22:40+0000,Tue,10.02,10024.0,kilometers,km,48:17,2897,51:38,3098,False,https://d3o5xota0a1fcr.cloudfront.net/v6/maps/FAAZXVMAOA3PEBFJ4MBHVFPG327US4EF2UHXZ7BFSCP7K56KUDZLPWNQPPHH3P3U52LBRI4X6AZWGKDRN7UWX5LXXIPWQ22L,True,False,54,m,54.0,,https://www.strava.com/activities/4685704460,https://www.strava.com/activities/4685704460?utm_content=1464505&utm_medium=referral&utm_source=twitter,went for a 10.0 kilometer Run.,True,False,,943.0,,False,False,False,False,everyone,2021-01-26 10:22:40,1900-01-01 10:21:40-00:01,0.0003048340343358659,0.8605555555555555,0.8047222222222222,10.024
5,4676079794,Lunch Run,Run,Run,Run,False,,,"Sun, 1/24/2021",1611486966,2021-01-24T18:16:06+0000,Sun,9.94,9948.0,kilometers,km,54:00,3240,57:36,3456,False,https://d3o5xota0a1fcr.cloudfront.net/v6/maps/Q4BKS6ZQBPVEIZXOF4LNLGE2OD7HD3GXZZ2IH5RSPMJBR5QN5YKFWPA7E6LUG5IHBE3L4WTKGZKWE2EA42FMARY3OBO3WCTS,True,False,220,m,220.0,,https://www.strava.com/activities/4676079794,https://www.strava.com/activities/4676079794?utm_content=1464505&utm_medium=referral&utm_source=twitter,went for a 9.9 kilometer Run.,True,False,,1018.0,,False,False,False,False,everyone,2021-01-24 11:16:06,1900-01-01 11:15:06-00:01,0.0003409258789258562,0.96,0.9,9.948
6,4676077663,Morning Activity,AlpineSki,Alpine Ski,Alpine Ski,False,,,"Fri, 1/22/2021",1611309362,2021-01-22T16:56:02+0000,Fri,46.76,46761.0,kilometers,km,2:48:40,10120,5:05:29,18329,False,https://d3o5xota0a1fcr.cloudfront.net/v6/maps/WJ44XZWQY3NOTATKYRS6MQQW5NLFYLIF56X5BWUNLZN2CWDLJVSHTUZ2GSECRD7CNNFH2AFGVYNIDMPKXYGCJKVK4YJF6KYK,True,False,"4,287",m,4287.42,,https://www.strava.com/activities/4676077663,https://www.strava.com/activities/4676077663?utm_content=1464505&utm_medium=referral&utm_source=twitter,went for a 46.7 kilometer Alpine Ski.,True,False,,1208.0,,False,False,False,False,everyone,2021-01-22 09:56:02,1900-01-01 09:55:02-00:01,0.001064867251459773,5.091388888888889,2.811111111111111,46.761
7,4648027998,Morning Run,Run,Run,Run,False,,,"Tue, 1/19/2021",1611050513,2021-01-19T17:01:53+0000,Tue,5.5,5505.0,kilometers,km,25:41,1541,27:59,1679,False,https://d3o5xota0a1fcr.cloudfront.net/v6/maps/NN657R3PWT64FDFTGVBQKEPLY4JHNQGMY7ARQJ5JXFWLN3LPOTG57JUI4I43VT3BMPEIAYZH464ZG2YYRYT4CR67NMJZLQAE,True,False,34,m,34.0,,https://www.strava.com/activities/4648027998,https://www.strava.com/activities/4648027998?utm_content=1464505&utm_medium=referral&utm_source=twitter,went for a 5.5 kilometer Run.,True,False,,563.0,,False,False,False,False,everyone,2021-01-19 10:01:53,1900-01-01 10:00:53-00:01,0.00016215024056319272,0.4663888888888889,0.4280555555555556,5.505
8,4638182806,Lunch Run,Run,Run,Run,False,,,"Sun, 1/17/2021",1610882873,2021-01-17T18:27:53+0000,Sun,8.49,8497.0,kilometers,km,44:40,2680,45:10,2710,False,https://d3o5xota0a1fcr.cloudfront.net/v6/maps/UMJUVXDNVCTKFIVN6QBEH35RI374E7VOLDTL57S5KXZXNJXCNB4RNSEBYZ4A5QEIZJ7GWEESF6UDAVYVRLESUBZ2AV7ZYOVK,True,False,47,m,47.0,,https://www.strava.com/activities/4638182806,https://www.strava.com/activities/4638182806?utm_content=1464505&utm_medium=referral&utm_source=twitter,went for a 8.4 kilometer Run.,True,False,,728.0,,False,False,False,False,everyone,2021-01-17 11:27:53,1900-01-01 11:26:53-00:01,0.00028200041837076996,0.7527777777777778,0.7444444444444445,8.497
10,4579032900,Morning Run,Run,Run,Run,False,,,"Wed, 1/6/2021",1609927508,2021-01-06T17:05:08+0000,Wed,8.35,8355.0,kilometers,km,43:12,2592,48:03,2883,False,https://d3o5xota0a1fcr.cloudfront.net/v6/maps/GZBGWIXTKX3PJIYQQSZO5URJYSVHY4APACSSX3AWGVBNH3CSADGJMQ65Y5Z5LOJ5YOJI42BFLMTTE7KW4WRMOFSDJN6FEQ6G,True,False,111,m,111.0,,https://www.strava.com/activities/4579032900,https://www.strava.com/activities/4579032900?utm_content=1464505&utm_medium=referral&utm_source=twitter,went for a 8.3 kilometer Run.,True,False,,942.0,,False,False,False,False,everyone,2021-01-06 10:05:08,1900-01-01 10:04:08-00:01,0.00027274070314068494,0.8008333333333333,0.72,8.355
11,4569184553,Night Run,Run,Run,Run,False,,,"Mon, 1/4/2021",1609797999,2021-01-05T05:06:39+0000,Mon,6.22,6221.0,kilometers,km,29:40,1780,30:51,1851,False,https://d3o5xota0a1fcr.cloudfront.net/v6/maps/SMNIRCOO5W4SIWXXPVUJUDBQAKPAUHJVYYPDIH6TJR3SJDOVTBAVVA3FZRFQGBDMZP36CWL74CIRWVZCP4WXXF7RFRCGJU7L,True,False,19,m,19.0,,https://www.strava.com/activities/4569184553,https://www.strava.com/activities/4569184553?utm_content=1464505&utm_medium=referral&utm_source=twitter,went for a 6.2 kilometer Run.,True,False,,590.0,,False,False,False,False,everyone,2021-01-04 22:06:39,1900-01-01 22:05:39-00:01,0.0001872987853358099,0.5141666666666667,0.49444444444444446,6.221
12,4557384427,Morning Activity,AlpineSki,Alpine Ski,Alpine Ski,False,,,"Sat, 1/2/2021",1609577388,2021-01-02T15:49:48+0000,Sat,59.32,59324.0,kilometers,km,4:30:07,16207,7:04:21,25461,False,https://d3o5xota0a1fcr.cloudfront.net/v6/maps/ZBVRCBEDS2VIGT7SVKNKA5YYSCPRCNU5RXYVLNJQBFR6AH2I23XLVJKH2C2CS2IIDOYJ2LVY6M3E64VURWR7GXMLIBZ4ZGYP,True,False,"6,561",m,6561.42,,https://www.strava.com/activities/4557384427,https://www.strava.com/activities/4557384427?utm_content=1464505&utm_medium=referral&utm_source=twitter,went for a 59.3 kilometer Alpine Ski.,True,False,,1545.0,,False,False,False,False,everyone,2021-01-02 08:49:48,1900-01-01 08:48:48-00:01,0.0017053659628862195,7.0725,4.501944444444445,59.324
13,4546936493,Lunch Run,Run,Run,Run,False,,,"Thu, 12/31/2020",1609418221,2020-12-31T19:37:01+0000,Thu,6.67,6672.0,kilometers,km,1:26:30,5190,1:31:24,5484,False,https://d3o5xota0a1fcr.cloudfront.net/v6/maps/IJVNNSHZ6N6N66BSPWGJ2XTVX3ROWWLOPP75KNXGYINHOAATDDPO376ID3YGMDCEJSJQOQWFNRZUHPJEIMNWKEONDR2ICTDS,True,False,3,m,3.0,,https://www.strava.com/activities/4546936493,https://www.strava.com/activities/4546936493?utm_content=1464505&utm_medium=referral&utm_source=twitter,went for a 6.6 kilometer Run.,True,False,,834.0,,False,False,False,False,everyone,2020-12-31 12:37:01,1900-01-01 12:36:01-00:01,0.000546112750501603,1.5233333333333334,1.4416666666666667,6.672
14,4536355851,Lunch Activity,NordicSki,Nordic Ski,Nordic Ski,False,,,"Tue, 12/29/2020",1609242943,2020-12-29T18:55:43+0000,Tue,19.07,19073.0,kilometers,km,1:30:57,5457,2:24:41,8681,False,https://d3o5xota0a1fcr.cloudfront.net/v6/maps/NUZLWIMHFJIITFCGHQUPNL36VRG5KK2C3HXHYGXK2P5UPJVTUPJU75K2AJOWDQCC2WY7RNTBNL2SQBSZJD23TN3HHJFTXEDD,True,False,244,m,244.0,,https://www.strava.com/activities/4536355851,https://www.strava.com/activities/4536355851?utm_content=1464505&utm_medium=referral&utm_source=twitter,went for a 19.0 kilometer Nordic Ski.,True,False,,215.0,,False,False,False,False,everyone,2020-12-29 11:55:43,1900-01-01 11:54:43-00:01,0.0005742075683019745,2.411388888888889,1.5158333333333334,19.073
16,4493460403,Lunch Activity,NordicSki,Nordic Ski,Nordic Ski,False,,,"Sat, 12/19/2020",1608376441,2020-12-19T18:14:01+0000,Sat,6.32,6321.0,kilometers,km,28:56,1736,43:26,2606,False,https://d3o5xota0a1fcr.cloudfront.net/v6/maps/CTKP64GPJYVRIN2I6WQUQWVJOC5ORQTIF2ZPCD2WKOB5OO7JWO4T4AHAOHFZ3UQUPW2BJFK4657YZDSYVKG3NMH57CE54TTC,True,False,85,m,85.0,,https://www.strava.com/activities/4493460403,https://www.strava.com/activities/4493460403?utm_content=1464505&utm_medium=referral&utm_source=twitter,went for a 6.3 kilometer Nordic Ski.,True,False,,314.0,,False,False,False,False,everyone,2020-12-19 11:14:01,1900-01-01 11:13:01-00:01,0.0001826689277207674,0.7238888888888889,0.4822222222222222,6.321
17,4485678571,Morning Run,Run,Run,Run,False,,,"Thu, 12/17/2020",1608200473,2020-12-17T17:21:13+0000,Thu,9.17,9171.0,kilometers,km,54:08,3248,1:00:58,3658,False,https://d3o5xota0a1fcr.cloudfront.net/v6/maps/TV6GH74FN7YUE2QP7LN6XS6SBTXY3ODYELKGRNSZZAH4AU7JKOI752Z3YMSOSS47H6GXTWZYNXZWTURZONVCTQYYXYS5NAUG,True,False,132,m,132.0,,https://www.strava.com/activities/4485678571,https://www.strava.com/activities/4485678571?utm_content=1464505&utm_medium=referral&utm_source=twitter,went for a 9.1 kilometer Run.,True,False,,902.0,,False,False,False,False,everyone,2020-12-17 10:21:13,1900-01-01 10:20:13-00:01,0.00034176767121950027,1.0161111111111112,0.9022222222222223,9.171
18,4478276378,Evening Ride,Ride,Ride,Ride,False,,,"Tue, 12/15/2020",1608055618,2020-12-16T02:06:58+0000,Tue,0.0,0.0,kilometers,km,1:04:43,3883,1:04:43,3883,True,,False,False,0,m,0.0,,https://www.strava.com/activities/4478276378,https://www.strava.com/activities/4478276378?utm_content=1464505&utm_medium=referral&utm_source=twitter,went for a 0 kilometer Ride.,True,False,,846.0,,False,False,False,False,everyone,2020-12-15 18:06:58,1900-01-01 18:05:58-00:01,0.0004085849345274999,1.0786111111111112,1.0786111111111112,0.0
19,4469971487,Evening Ride,Ride,Ride,Ride,False,,,"Sun, 12/13/2020",1607884475,2020-12-14T02:34:35+0000,Sun,0.0,0.0,kilometers,km,1:03:22,3802,1:03:22,3802,True,,False,False,0,m,0.0,,https://www.strava.com/activities/4469971487,https://www.strava.com/activities/4469971487?utm_content=1464505&utm_medium=referral&utm_source=twitter,went for a 0 kilometer Ride.,True,False,,865.0,,False,False,False,False,everyone,2020-12-13 18:34:35,1900-01-01 18:33:35-00:01,0.0004000617875543535,1.056111111111111,1.056111111111111,0.0
20,4235128879,Afternoon Ride,Ride,Ride,Ride,False,,,"Sat, 10/24/2020",1603551167,2020-10-24T01:52:47+0000,Sat,21.59,21592.0,kilometers,km,1:09:39,4179,2:10:10,7810,False,https://d3o5xota0a1fcr.cloudfront.net/v6/maps/NLPV4BK5Q3I66O23F4NCOCXRZUFPNCXIEC3RXDXRSQF7CYWFYPPY7PBEILS3KLJWJPNYG2R4JDBMV4UJTJ6FGTTQJ2ISSSA6,True,False,205,m,205.0,,https://www.strava.com/activities/4235128879,https://www.strava.com/activities/4235128879?utm_content=1464505&utm_medium=referral&utm_source=twitter,went for a 21.5 kilometer Ride.,True,False,,1266.0,,False,False,False,False,everyone,2020-10-24 14:52:47,1900-01-01 14:51:47-00:01,0.0004397312493923312,2.1694444444444443,1.1608333333333334,21.592
21,4223321822,Evening Ride,Ride,Ride,Ride,False,,,"Wed, 10/21/2020",1603307496,2020-10-21T06:11:36+0000,Wed,17.36,17367.0,kilometers,km,36:00,2160,38:35,2315,False,https://d3o5xota0a1fcr.cloudfront.net/v6/maps/FBG7ORL6YLZMSUHYXMUI5DMHXYVDKPDBNTBBJHI6TOYIV6KYWOFAHZMGB2DCYSKV6YBH3T3JGX4V5RRL56MSS2FCR53D6ORP,True,False,193,m,193.0,,https://www.strava.com/activities/4223321822,https://www.strava.com/activities/4223321822?utm_content=1464505&utm_medium=referral&utm_source=twitter,went for a 17.3 kilometer Ride.,True,False,,479.0,,False,False,False,False,everyone,2020-10-21 19:11:36,1900-01-01 19:10:36-00:01,0.00022728391928390413,0.6430555555555556,0.6,17.367
22,4209473818,Afternoon Ride,Ride,Ride,Ride,False,,,"Sun, 10/18/2020",1603028879,2020-10-18T00:47:59+0000,Sun,74.89,74895.0,kilometers,km,2:34:41,9281,3:03:29,11009,False,https://d3o5xota0a1fcr.cloudfront.net/v6/maps/ZCTQA7CIP7WZO7TWS4KL5CPQO7KCZST6FZMFCWUB4IW7TUQZLISH7TZBZN6LSTZ7CUCWHBQQ5DYXT2RHCQ3PUQH5U4QISYQC,True,False,838,m,838.0,,https://www.strava.com/activities/4209473818,https://www.strava.com/activities/4209473818?utm_content=1464505&utm_medium=referral&utm_source=twitter,went for a 74.8 kilometer Ride.,True,False,,1953.0,,False,False,False,False,everyone,2020-10-18 13:47:59,1900-01-01 13:46:59-00:01,0.000976584284663849,3.0580555555555557,2.5780555555555558,74.895
23,4204615801,Afternoon Ride,Ride,Ride,Ride,False,,,"Sat, 10/17/2020",1602941731,2020-10-17T00:35:31+0000,Sat,33.4,33407.0,kilometers,km,2:32:29,9149,2:54:33,10473,False,https://d3o5xota0a1fcr.cloudfront.net/v6/maps/WZQZHLATXRIHLP6LRYZCZ7J2MLWNSF46R4BQZQEXZZD54EYTDFA3PZ4A5HMGIWRG7GUNE3FITCVWQ2FWZVSFFJPSHFPSBT4A,True,False,"1,414",m,1414.0,,https://www.strava.com/activities/4204615801,https://www.strava.com/activities/4204615801?utm_content=1464505&utm_medium=referral&utm_source=twitter,went for a 33.4 kilometer Ride.,True,False,,2513.0,,False,False,False,False,everyone,2020-10-17 13:35:31,1900-01-01 13:34:31-00:01,0.0009626947118187217,2.9091666666666667,2.5413888888888887,33.407
24,4191102269,Morning Ride,Ride,Ride,Ride,False,,,"Wed, 10/14/2020",1602655310,2020-10-13T17:01:50+0000,Wed,42.52,42527.0,kilometers,km,1:30:52,5452,2:20:58,8458,False,https://d3o5xota0a1fcr.cloudfront.net/v6/maps/AEEZLBW5Y5TEFUQPZVNCSERHAVHSS7H5J7J6W3BDQ5VNQO56ZUQWXV774AGJMIWHX6QWSVROCWXUAWYSAPGE5HYWQTWCKVFG,True,False,356,m,356.0,,https://www.strava.com/activities/4191102269,https://www.strava.com/activities/4191102269?utm_content=1464505&utm_medium=referral&utm_source=twitter,went for a 42.5 kilometer Ride.,True,False,,1324.0,,False,False,False,False,everyone,2020-10-14 06:01:50,1900-01-01 06:00:50-00:01,0.0005736814481184469,2.3494444444444444,1.5144444444444445,42.527
25,4188768586,Night Activity,WeightTraining,Weight Training,Workout,False,,,"Mon, 10/12/2020",1602538147,2020-10-13T04:29:07+0000,Mon,0.0,0.0,kilometers,km,2:23:55,8635,2:23:55,8635,True,,False,False,0,m,0.0,,https://www.strava.com/activities/4188768586,https://www.strava.com/activities/4188768586?utm_content=1464505&utm_medium=referral&utm_source=twitter,went for a 0 kilometer Weight Training.,True,False,,1156.0,30,False,False,False,False,everyone,2020-10-12 21:29:07,1900-01-01 21:28:07-00:01,0.0009086095569520889,2.3986111111111112,2.3986111111111112,0.0
26,4178748301,Afternoon Ride,Ride,Ride,Ride,False,,,"Sun, 10/11/2020",1602422077,2020-10-11T00:14:37+0000,Sun,36.19,36197.0,kilometers,km,2:03:13,7393,2:18:23,8303,False,https://d3o5xota0a1fcr.cloudfront.net/v6/maps/DGEG6KMN7QRPRB6FHYGSDAGUUIGS737BV2A6S2GVJJFX6U2J7OB4RU4UCE3X7E7UV7QJZJUAWUFPWOZ2CF5WECINKFU7J4MD,True,False,892,m,892.0,,https://www.strava.com/activities/4178748301,https://www.strava.com/activities/4178748301?utm_content=1464505&utm_medium=referral&utm_source=twitter,went for a 36.1 kilometer Ride.,True,False,,1550.0,,False,False,False,False,everyone,2020-10-11 13:14:37,1900-01-01 13:13:37-00:01,0.0007779213033638441,2.306388888888889,2.053611111111111,36.197
27,4173546532,Morning Ride,Ride,Ride,Ride,False,,,"Sat, 10/10/2020",1602316536,2020-10-09T18:55:36+0000,Sat,94.88,94886.3,kilometers,km,3:15:00,11700,3:40:38,13238,False,https://d3o5xota0a1fcr.cloudfront.net/v6/maps/QBMZ5RGDVVJ4ADWECV7LYC4FQFRHEK6YP26LUBLIG5VWGAWKDLKUATIEOZK7ENPIURWFJOL32XGEZ72BABMQPH7Z5KN7MZF7,True,False,868,m,867.543,,https://www.strava.com/activities/4173546532,https://www.strava.com/activities/4173546532?utm_content=1464505&utm_medium=referral&utm_source=twitter,went for a 94.8 kilometer Ride.,False,False,,2971.787841796875,10,False,False,False,False,everyone,2020-10-10 07:55:36,1900-01-01 07:54:36-00:01,0.0012311212294544808,3.6772222222222224,3.25,94.8863
28,4164815543,"Group Ride Three-peat Complete, Oof",Ride,Ride,Ride,False,,,"Thu, 10/8/2020",1602137194,2020-10-07T17:06:34+0000,Thu,48.17,48171.0,kilometers,km,1:34:46,5686,2:21:21,8481,False,https://d3o5xota0a1fcr.cloudfront.net/v6/maps/OD27TZ7SVI4NU6FAI2GOAJC6ZHFHATEELBD3NMFKXPSZIKYWCWCEM2TYFAYUEKXRANCJ6BUKIKGJNFUVUUIPZO4NYKFGA5IS,True,False,442,m,442.0,,https://www.strava.com/activities/4164815543,https://www.strava.com/activities/4164815543?utm_content=1464505&utm_medium=referral&utm_source=twitter,went for a 48.1 kilometer Ride.,True,False,,1357.0,10,False,False,False,False,everyone,2020-10-08 06:06:34,1900-01-01 06:05:34-00:01,0.0005983038727075366,2.3558333333333334,1.5794444444444444,48.171
29,4160340697,Morning Ride,Ride,Ride,Ride,False,,,"Wed, 10/7/2020",1602050741,2020-10-06T17:05:41+0000,Wed,41.27,41277.0,kilometers,km,1:25:43,5143,2:03:53,7433,False,https://d3o5xota0a1fcr.cloudfront.net/v6/maps/XZSNVOXP4ZIWCU5C2M2JHYBAUFP4MSJNAYJO5JNWGXZALRII2ODY2FFDV3KDH5HJXNDKXOOPZJN5HLAMO7YBCINDX7NRJS2L,True,False,381,m,381.0,,https://www.strava.com/activities/4160340697,https://www.strava.com/activities/4160340697?utm_content=1464505&utm_medium=referral&utm_source=twitter,went for a 41.2 kilometer Ride.,True,False,,1230.0,,False,False,False,False,everyone,2020-10-07 06:05:41,1900-01-01 06:04:41-00:01,0.000541167220776444,2.064722222222222,1.428611111111111,41.277
30,4155660155,Morning Ride,Ride,Ride,Ride,False,,,"Tue, 10/6/2020",1601964430,2020-10-05T17:07:10+0000,Tue,47.53,47536.0,kilometers,km,1:30:14,5414,1:40:34,6034,False,https://d3o5xota0a1fcr.cloudfront.net/v6/maps/MFEL65KBJ2TFVOXM3MJLZKJVHLVHVKRW6UKULGJRQ6YO4SS4KX7QAGRXMOWR62AP2HEIQWV4DFGE4KOR65IQHYKYDCT3VZTM,True,False,394,m,394.0,,https://www.strava.com/activities/4155660155,https://www.strava.com/activities/4155660155?utm_content=1464505&utm_medium=referral&utm_source=twitter,went for a 47.5 kilometer Ride.,True,False,,1208.0,,False,False,False,False,everyone,2020-10-06 06:07:10,1900-01-01 06:06:10-00:01,0.0005696829347236375,1.676111111111111,1.5038888888888888,47.536
31,4155643524,Lunch Ride,Ride,Ride,Ride,False,,,"Sun, 10/4/2020",1601815833,2020-10-03T23:50:33+0000,Sun,22.44,22444.0,kilometers,km,49:15,2955,52:48,3168,False,https://d3o5xota0a1fcr.cloudfront.net/v6/maps/PZ2VHB4FQ6U3UGUG3G2OFMQAKWLXWN6CBM52WX2776FIQL6PDOFT6CT3BHJQIMQNQDTX2NXGTJKNNSX5IRZ3ZWQAUGCVSMI5,True,False,195,m,195.0,,https://www.strava.com/activities/4155643524,https://www.strava.com/activities/4155643524?utm_content=1464505&utm_medium=referral&utm_source=twitter,went for a 22.4 kilometer Ride.,True,False,,561.0,,False,False,False,False,everyone,2020-10-04 12:50:33,1900-01-01 12:49:33-00:01,0.0003109370284647855,0.88,0.8208333333333333,22.444
32,4155641723,Morning Ride,Ride,Ride,Ride,False,,,"Sat, 10/3/2020",1601711535,2020-10-02T18:52:15+0000,Sat,90.51,90510.0,kilometers,km,2:54:53,10493,3:21:47,12107,False,https://d3o5xota0a1fcr.cloudfront.net/v6/maps/HXWNK7PHTSANDF2TN36XSMITGVOXZK4T57U3ASYBEZU4GXX2HIWHBWCXYM757F62SBD4G6YNVBN5XF55ARSS6RQE4UQGZJOD,True,False,756,m,756.0,,https://www.strava.com/activities/4155641723,https://www.strava.com/activities/4155641723?utm_content=1464505&utm_medium=referral&utm_source=twitter,went for a 90.5 kilometer Ride.,True,False,,2317.0,,False,False,False,False,everyone,2020-10-03 07:52:15,1900-01-01 07:51:15-00:01,0.0011041158171509287,3.3630555555555555,2.914722222222222,90.51
33,4134543766,Morning Ride,Ride,Ride,Ride,False,,,"Thu, 10/1/2020",1601532419,2020-09-30T17:06:59+0000,Thu,48.14,48146.0,kilometers,km,1:35:18,5718,1:40:01,6001,False,https://d3o5xota0a1fcr.cloudfront.net/v6/maps/GMY4ZGLHDX2LHPZVVXFBFK7P4Q26P7RE3Y7ZD7VW2WLXBC4VB4OAPA6SPXAPAKTB3KRZZWWRD46MJEJY2LLR4SPDUO72N72F,True,False,482,m,482.0,,https://www.strava.com/activities/4134543766,https://www.strava.com/activities/4134543766?utm_content=1464505&utm_medium=referral&utm_source=twitter,went for a 48.1 kilometer Ride.,True,False,,1254.0,,False,False,False,False,everyone,2020-10-01 06:06:59,1900-01-01 06:05:59-00:01,0.0006016710418821129,1.6669444444444443,1.5883333333333334,48.146
34,4134533613,Afternoon Ride,Ride,Ride,Ride,False,,,"Wed, 9/30/2020",1601486399,2020-09-30T04:19:59+0000,Wed,14.1,14105.0,kilometers,km,32:13,1933,50:06,3006,False,https://d3o5xota0a1fcr.cloudfront.net/v6/maps/HFBJQ3DEWU5MU4NEFS5U7WYMMG2LJHIII3BMMKZNOSOXBDOOG4LBSVDI537H2KZGJ3X7ZNUGCIIKYITSLVUTB4NECBG6DDN2,True,False,165,m,165.0,,https://www.strava.com/activities/4134533613,https://www.strava.com/activities/4134533613?utm_content=1464505&utm_medium=referral&utm_source=twitter,went for a 14.1 kilometer Ride.,True,False,,568.0,,False,False,False,False,everyone,2020-09-30 17:19:59,1900-01-01 17:18:59-00:01,0.00020339806295175308,0.835,0.5369444444444444,14.105
35,4119746266,Afternoon Activity,WeightTraining,Weight Training,Workout,False,,,"Sat, 9/26/2020",1601132072,2020-09-26T21:54:32+0000,Sat,0.0,0.0,kilometers,km,2:47:50,10070,2:47:50,10070,True,,False,False,0,m,0.0,,https://www.strava.com/activities/4119746266,https://www.strava.com/activities/4119746266?utm_content=1464505&utm_medium=referral&utm_source=twitter,went for a 0 kilometer Weight Training.,True,False,,1081.0,30,False,False,False,False,everyone,2020-09-26 14:54:32,1900-01-01 14:53:32-00:01,0.0010596060496244975,2.797222222222222,2.797222222222222,0.0
36,4112485835,Lunch Ride,Ride,Ride,Ride,False,,,"Sat, 9/26/2020",1601124378,2020-09-26T00:46:18+0000,Sat,30.43,30438.0,kilometers,km,2:13:45,8025,2:28:48,8928,False,https://d3o5xota0a1fcr.cloudfront.net/v6/maps/LSOW4BJPNTLCC224PHKMNSXDMRARC6MTLYSHCPIGE7DTWNJSFULSQFX46MNGSZKERR6U4HZJWFJIGZQ4DQ67ORRKJPN7XOVB,True,False,"1,277",m,1277.0,,https://www.strava.com/activities/4112485835,https://www.strava.com/activities/4112485835?utm_content=1464505&utm_medium=referral&utm_source=twitter,went for a 30.4 kilometer Ride.,True,False,,2121.0,,False,False,False,False,everyone,2020-09-26 12:46:18,1900-01-01 12:45:18-00:01,0.0008444228945617272,2.48,2.2291666666666665,30.438
37,4110238985,Afternoon Ride,Ride,Ride,Ride,False,,,"Fri, 9/25/2020",1601054390,2020-09-25T05:19:50+0000,Fri,18.84,18844.0,kilometers,km,54:06,3246,1:28:00,5280,False,https://d3o5xota0a1fcr.cloudfront.net/v6/maps/XKUC72E4WP3NI45DNJB6MTRYOYL7LT45X4YD7SIBYE2WKDGGTE32SQQTJL5JQBHLY25W6A7MGCR4JMUEGVNRMDSVY7M53IOC,True,False,199,m,199.0,,https://www.strava.com/activities/4110238985,https://www.strava.com/activities/4110238985?utm_content=1464505&utm_medium=referral&utm_source=twitter,went for a 18.8 kilometer Ride.,True,False,,918.0,,False,False,False,False,everyone,2020-09-25 17:19:50,1900-01-01 17:18:50-00:01,0.00034155722314608926,1.4666666666666666,0.9016666666666666,18.844
38,4101569899,Night Activity,WeightTraining,Weight Training,Workout,False,,,"Tue, 9/22/2020",1600816657,2020-09-23T06:17:37+0000,Tue,0.0,0.0,kilometers,km,1:30:34,5434,1:30:34,5434,True,,False,False,0,m,0.0,,https://www.strava.com/activities/4101569899,https://www.strava.com/activities/4101569899?utm_content=1464505&utm_medium=referral&utm_source=twitter,went for a 0 kilometer Weight Training.,True,False,,635.0,30,False,False,False,False,everyone,2020-09-22 23:17:37,1900-01-01 23:16:37-00:01,0.0005717874154577477,1.5094444444444444,1.5094444444444444,0.0
39,4094341133,Morning Ride,Ride,Ride,Ride,False,,,"Tue, 9/22/2020",1600756580,2020-09-21T18:36:20+0000,Tue,30.63,30631.0,kilometers,km,1:03:41,3821,1:25:41,5141,False,https://d3o5xota0a1fcr.cloudfront.net/v6/maps/4ZHXRR3WZ3HMKZMIFBRVDMILZ67BUZY2JRV5C6HMCCC3CTJ4VOBUWBCLKIQBMOO5K7REDQBQOMAV2TJR6HZ2CVB3CE6HXON7,True,False,296,m,296.0,,https://www.strava.com/activities/4094341133,https://www.strava.com/activities/4094341133?utm_content=1464505&utm_medium=referral&utm_source=twitter,went for a 30.6 kilometer Ride.,True,False,,918.0,,False,False,False,False,everyone,2020-09-22 06:36:20,1900-01-01 06:35:20-00:01,0.0004020610442517582,1.4280555555555556,1.061388888888889,30.631
40,4459617818,Lunch Run,Run,Run,Run,False,,,"Fri, 12/11/2020",1607686935,2020-12-11T18:42:15+0000,Fri,6.34,6346.0,kilometers,km,30:27,1827,31:29,1889,False,https://d3o5xota0a1fcr.cloudfront.net/v6/maps/GR3E37JAOPSE3RPMRRM2MAM5HLZOVEKDQPUDH37RY35DD6QTQXREWBF4NCP7NYFICOVHG42FG3O7QOY4WRSQKCK57IF62P6L,True,False,31,m,31.0,,https://www.strava.com/activities/4459617818,https://www.strava.com/activities/4459617818?utm_content=1464505&utm_medium=referral&utm_source=twitter,went for a 6.3 kilometer Run.,True,False,,802.0,,False,False,False,False,everyone,2020-12-11 11:42:15,1900-01-01 11:41:15-00:01,0.0001922443150609689,0.5247222222222222,0.5075,6.346
41,4425639665,Night Activity,WeightTraining,Weight Training,Workout,False,,,"Wed, 12/2/2020",1606953523,2020-12-03T07:58:43+0000,Wed,0.0,0.0,kilometers,km,1:02:35,3755,1:02:35,3755,True,,False,False,0,m,0.0,,https://www.strava.com/activities/4425639665,https://www.strava.com/activities/4425639665?utm_content=1464505&utm_medium=referral&utm_source=twitter,went for a 0 kilometer Weight Training.,True,False,,532.0,30,False,False,False,False,everyone,2020-12-02 23:58:43,1900-01-01 23:57:43-00:01,0.00039511625782919445,1.0430555555555556,1.0430555555555556,0.0
42,4416614985,Afternoon Ride,Ride,Ride,Ride,False,,,"Tue, 12/1/2020",1606843785,2020-12-01T04:29:45+0000,Tue,7.07,7073.0,kilometers,km,37:39,2259,1:36:03,5763,False,https://d3o5xota0a1fcr.cloudfront.net/v6/maps/2DFBVCMMRRCTCADXNIZGJ2M6UKH3MYQA4INION4NNPMKKPJS7XZUO6D7MZEETY2IBJCLCBCK73XOCD2SQYO5UVUFQTQB3MP5,True,False,214,m,214.0,,https://www.strava.com/activities/4416614985,https://www.strava.com/activities/4416614985?utm_content=1464505&utm_medium=referral&utm_source=twitter,went for a 7.0 kilometer Ride.,True,False,,649.0,,False,False,False,False,everyone,2020-12-01 17:29:45,1900-01-01 17:28:45-00:01,0.00023770109891774974,1.6008333333333333,0.6275,7.073
43,4414587717,Night Activity,WeightTraining,Weight Training,Workout,False,,,"Sun, 11/29/2020",1606690915,2020-11-30T07:01:55+0000,Sun,0.0,0.0,kilometers,km,1:29:06,5346,1:29:06,5346,True,,False,False,0,m,0.0,,https://www.strava.com/activities/4414587717,https://www.strava.com/activities/4414587717?utm_content=1464505&utm_medium=referral&utm_source=twitter,went for a 0 kilometer Weight Training.,True,False,,706.0,30,False,False,False,False,everyone,2020-11-29 23:01:55,1900-01-01 23:00:55-00:01,0.0005625277002276627,1.485,1.485,0.0
44,4399874692,Morning Ride,Ride,Ride,Ride,False,,,"Sat, 11/28/2020",1606559933,2020-11-27T21:38:53+0000,Sat,82.86,82863.0,kilometers,km,3:33:48,12828,3:48:08,13688,False,https://d3o5xota0a1fcr.cloudfront.net/v6/maps/RNTLPZHFG6IWRPNLCHM7HCA6ZE42GE7G4PKPLXUQFPW4C2Z25WQMDKV32TGEKQW636Z3YIL4IJBCDC2UBZTI37VWGQYNWO3Z,True,False,"1,677",m,1677.0,,https://www.strava.com/activities/4399874692,https://www.strava.com/activities/4399874692?utm_content=1464505&utm_medium=referral&utm_source=twitter,went for a 82.8 kilometer Ride.,True,False,,3018.0,,False,False,False,False,everyone,2020-11-28 10:38:53,1900-01-01 10:37:53-00:01,0.0013498139428582974,3.8022222222222224,3.5633333333333335,82.863
45,4399863566,Morning Run,Run,Run,Run,False,,,"Sun, 11/22/2020",1606035767,2020-11-21T20:02:47+0000,Sun,10.9,10907.0,kilometers,km,2:03:41,7421,2:59:49,10789,False,https://d3o5xota0a1fcr.cloudfront.net/v6/maps/5FGBXFFRZLNQPWPVJS6OIIBTAMIRSZLRMQFPOQDU6RJE7WEGBBTA3CE4NQYUDYLT557VSVRIOJJNAPGMUCYEC37BSEHFR2H2,True,False,173,m,173.0,,https://www.strava.com/activities/4399863566,https://www.strava.com/activities/4399863566?utm_content=1464505&utm_medium=referral&utm_source=twitter,went for a 10.9 kilometer Run.,True,False,,2266.0,,False,False,False,False,everyone,2020-11-22 09:02:47,1900-01-01 09:01:47-00:01,0.0007808675763915984,2.9969444444444444,2.0613888888888887,10.907
46,4399860871,Morning Run,Run,Run,Run,False,,,"Sat, 11/21/2020",1605954336,2020-11-20T21:25:36+0000,Sat,19.63,19634.0,kilometers,km,6:12:06,22326,6:16:39,22599,False,https://d3o5xota0a1fcr.cloudfront.net/v6/maps/GK4GC5I74NSUWGFEKVZRHKNL2PFRSYKWZ4NX7JGTPU2YFLIO2VTCNJQ5EK4L7KVMMX4WYY4NYYHLJ6VIJ5D6XKGACVQBGQRN,True,False,"1,234",m,1234.0,,https://www.strava.com/activities/4399860871,https://www.strava.com/activities/4399860871?utm_content=1464505&utm_medium=referral&utm_source=twitter,went for a 19.6 kilometer Run.,True,False,,3062.0,,False,False,False,False,everyone,2020-11-21 10:25:36,1900-01-01 10:24:36-00:01,0.0023492318434872425,6.2775,6.201666666666667,19.634
47,4358730647,Evening Ride,Ride,Ride,Ride,False,,,"Thu, 11/19/2020",1605812510,2020-11-19T06:01:50+0000,Thu,21.41,21409.0,kilometers,km,42:54,2574,47:01,2821,False,https://d3o5xota0a1fcr.cloudfront.net/v6/maps/ZTS3AG2GSL5M3BU6QBIERX4I3YVS5C62WB537NT22NOK5QSN37LMAQ6RBEFVSKKT23TCOBYMX3RE7F4KLH5GNQA3OQVRI7LE,True,False,246,m,246.0,,https://www.strava.com/activities/4358730647,https://www.strava.com/activities/4358730647?utm_content=1464505&utm_medium=referral&utm_source=twitter,went for a 21.4 kilometer Ride.,True,False,,259.0,,False,False,False,False,everyone,2020-11-19 19:01:50,1900-01-01 19:00:50-00:01,0.00027084667047998576,0.7836111111111111,0.715,21.409
48,4341666244,Lunch Ride,Ride,Ride,Ride,False,,,"Sun, 11/15/2020",1605443359,2020-11-14T23:29:19+0000,Sun,16.51,16509.0,kilometers,km,31:01,1861,32:57,1977,False,https://d3o5xota0a1fcr.cloudfront.net/v6/maps/C4JHTSTKU27WH4KXOBDAVZTH6UO2OIPI2GWLP6O4EZG465LTKN6KUADYT75KCHZPMF7KKJBBJF2CWAI2T5IK2UFUY7OIZQUB,True,False,205,m,205.0,,https://www.strava.com/activities/4341666244,https://www.strava.com/activities/4341666244?utm_content=1464505&utm_medium=referral&utm_source=twitter,went for a 16.5 kilometer Ride.,True,False,,484.0,,False,False,False,False,everyone,2020-11-15 12:29:19,1900-01-01 12:28:19-00:01,0.0001958219323089563,0.5491666666666667,0.5169444444444444,16.509
49,4333907736,Lunch Ride,Ride,Ride,Ride,False,,,"Sat, 11/14/2020",1605354825,2020-11-13T22:53:45+0000,Sat,35.72,35729.0,kilometers,km,1:24:48,5088,1:49:15,6555,False,https://d3o5xota0a1fcr.cloudfront.net/v6/maps/HH5XLOAK42MDE3H3LN36W5ARQ5PTPDSCLDASICAQMKIL54HM7JBB74JJFOAD2MTXYU7DVCTWOTAGRR3WZBFXUNEYKC7T3RP7,True,False,434,m,434.0,,https://www.strava.com/activities/4333907736,https://www.strava.com/activities/4333907736?utm_content=1464505&utm_medium=referral&utm_source=twitter,went for a 35.7 kilometer Ride.,True,False,,1051.0,,False,False,False,False,everyone,2020-11-14 11:53:45,1900-01-01 11:52:45-00:01,0.0005353798987576408,1.8208333333333333,1.4133333333333333,35.729
50,4328680062,Morning Ride,Ride,Ride,Ride,False,,,"Fri, 11/13/2020",1605244792,2020-11-12T16:19:52+0000,Fri,71.76,71765.0,kilometers,km,2:26:23,8783,3:20:43,12043,False,https://d3o5xota0a1fcr.cloudfront.net/v6/maps/3BQBUVXGSRQCXZPWDHRFBTWIE6UNQ7M74PWUYEH3AVZMXBHUYDQKB5OFFVZ3FT6LN4XEUILMGZ6EIZFRQHR2WFPKD5UV4K5R,True,False,"1,013",m,1013.0,,https://www.strava.com/activities/4328680062,https://www.strava.com/activities/4328680062?utm_content=1464505&utm_medium=referral&utm_source=twitter,went for a 71.7 kilometer Ride.,True,False,,2150.0,,False,False,False,False,everyone,2020-11-13 05:19:52,1900-01-01 05:18:52-00:01,0.0009241827143845046,3.3452777777777776,2.439722222222222,71.765
51,4326817819,Afternoon Ride,Ride,Ride,Ride,False,,,"Thu, 11/12/2020",1605202754,2020-11-12T04:39:14+0000,Thu,19.85,19850.0,kilometers,km,1:35:35,5735,2:41:27,9687,False,https://d3o5xota0a1fcr.cloudfront.net/v6/maps/Y7L3JSQPAAA45LEOHXLSAMFXJFG4LZV7WJICOMDVVZMBFUCNFSJURQ4KKVQMCVHQCGMCCRWVA2CKVZ2L7WO7JCULUI2VWLN6,True,False,774,m,774.0,,https://www.strava.com/activities/4326817819,https://www.strava.com/activities/4326817819?utm_content=1464505&utm_medium=referral&utm_source=twitter,went for a 19.8 kilometer Ride.,True,False,,1317.0,,False,False,False,False,everyone,2020-11-12 17:39:14,1900-01-01 17:38:14-00:01,0.0006034598505061066,2.6908333333333334,1.5930555555555554,19.85
52,4320890393,Evening Activity,WeightTraining,Weight Training,Workout,False,,,"Tue, 11/10/2020",1605041952,2020-11-11T04:59:12+0000,Tue,0.0,0.0,kilometers,km,1:27:36,5256,1:27:36,5256,True,,False,False,0,m,0.0,,https://www.strava.com/activities/4320890393,https://www.strava.com/activities/4320890393?utm_content=1464505&utm_medium=referral&utm_source=twitter,went for a 0 kilometer Weight Training.,True,False,,812.0,30,False,False,False,False,everyone,2020-11-10 20:59:12,1900-01-01 20:58:12-00:01,0.0005530575369241667,1.46,1.46,0.0
53,4313797156,Evening Ride,Ride,Ride,Ride,False,,,"Mon, 11/9/2020",1604948438,2020-11-09T06:00:38+0000,Mon,10.09,10091.0,kilometers,km,40:21,2421,1:02:42,3762,False,https://d3o5xota0a1fcr.cloudfront.net/v6/maps/LXTVY2WRD3RNSC5QTF43FAAUV5ZS6BDIKQEJRA6ISA7U54V7CL63YSWF5QXZCXAY2X2F44S4S6OMECGNDSNG3WY73RLCWE3K,True,False,298,m,298.0,,https://www.strava.com/activities/4313797156,https://www.strava.com/activities/4313797156?utm_content=1464505&utm_medium=referral&utm_source=twitter,went for a 10.0 kilometer Ride.,True,False,,417.0,,True,False,False,False,everyone,2020-11-09 19:00:38,1900-01-01 18:59:38-00:01,0.00025474739286404256,1.045,0.6725,10.091
54,4308925883,Morning Run,Run,Run,Run,False,,,"Sat, 11/7/2020",1604744027,2020-11-06T21:13:47+0000,Sat,15.55,15551.0,kilometers,km,2:55:40,10540,5:06:56,18416,False,https://d3o5xota0a1fcr.cloudfront.net/v6/maps/ISF4XLQVZ76KQKBJMYWOJL2FSXOILQYLVHQ4T7XM6U7SBMOO6ITNU43HQYOTMUL6S3776FJPVPJ7BJHTXVTFMRAZYU7A62FQ,True,False,746,m,746.0,,https://www.strava.com/activities/4308925883,https://www.strava.com/activities/4308925883?utm_content=1464505&utm_medium=referral&utm_source=twitter,went for a 15.5 kilometer Run.,True,False,,2413.0,,False,False,False,False,everyone,2020-11-07 10:13:47,1900-01-01 10:12:47-00:01,0.0011090613468760877,5.115555555555556,2.9277777777777776,15.551
55,4295464252,Night Activity,WeightTraining,Weight Training,Workout,False,,,"Thu, 11/5/2020",1604610695,2020-11-06T05:11:35+0000,Thu,0.0,0.0,kilometers,km,1:05:50,3950,1:05:50,3950,True,,False,False,0,m,0.0,,https://www.strava.com/activities/4295464252,https://www.strava.com/activities/4295464252?utm_content=1464505&utm_medium=referral&utm_source=twitter,went for a 0 kilometer Weight Training.,True,False,,598.0,30,False,False,False,False,everyone,2020-11-05 21:11:35,1900-01-01 21:10:35-00:01,0.00041563494498676913,1.0972222222222223,1.0972222222222223,0.0
56,4279894343,Afternoon Ride,Ride,Ride,Ride,False,,,"Tue, 11/3/2020",1604423813,2020-11-03T04:16:53+0000,Tue,6.54,6540.0,kilometers,km,6:53,413,2:18:52,8332,False,https://d3o5xota0a1fcr.cloudfront.net/v6/maps/F6M3ZJXKI2ES4E4PW2HNOV4TDZJSYXLCPIZXK3TFZMOJLIKXMXYWRAABIFTHJ3HLMSQX7LFBBYZWKURH473T6G4DO6HTR6HI,True,False,279,m,279.0,,https://www.strava.com/activities/4279894343,https://www.strava.com/activities/4279894343?utm_content=1464505&utm_medium=referral&utm_source=twitter,went for a 6.5 kilometer Ride.,True,False,,418.0,,True,False,False,False,everyone,2020-11-03 17:16:53,1900-01-01 17:15:53-00:01,4.3457527159376116e-05,2.3144444444444443,0.11472222222222223,6.54
57,4270514324,Afternoon Ride,Ride,Ride,Ride,False,,,"Sun, 11/1/2020",1604238724,2020-11-01T00:52:04+0000,Sun,22.83,22838.0,kilometers,km,48:53,2933,1:09:33,4173,False,https://d3o5xota0a1fcr.cloudfront.net/v6/maps/N3CZB67WGVQBHPWHNTEYT2MU6AZ7HPQCWQDG4KA6BLJXYV27OGSJZJXTE345F6U4DXGYCOYQDOPXYYJUVMVKZ65334OT2JXP,True,False,199,m,199.0,,https://www.strava.com/activities/4270514324,https://www.strava.com/activities/4270514324?utm_content=1464505&utm_medium=referral&utm_source=twitter,went for a 22.8 kilometer Ride.,True,False,,278.0,,False,False,False,False,everyone,2020-11-01 13:52:04,1900-01-01 13:51:04-00:01,0.00030862209965726425,1.1591666666666667,0.8147222222222222,22.838
58,4264157965,Lunch Run,Run,Run,Run,False,,,"Sat, 10/31/2020",1604145670,2020-10-30T23:01:10+0000,Sat,6.53,6531.0,kilometers,km,33:09,1989,35:42,2142,False,https://d3o5xota0a1fcr.cloudfront.net/v6/maps/PTUT2VROC6VHOTKNB63M6425VUPUQ7ZRV6UD5CPURT5VQW7YHK7EV3QK4BGNTBM2SYGO5KN273LJQRZZXO3MJSE7I2YFAB77,True,False,118,m,118.0,,https://www.strava.com/activities/4264157965,https://www.strava.com/activities/4264157965?utm_content=1464505&utm_medium=referral&utm_source=twitter,went for a 6.5 kilometer Run.,True,False,,386.0,,False,False,False,False,everyone,2020-10-31 12:01:10,1900-01-01 12:00:10-00:01,0.00020929060900726172,0.595,0.5525,6.531
59,4239709026,"Whaka 91.5? Don’t know where the trails went ",Ride,Ride,Ride,False,,,"Sun, 10/25/2020",1603612078,2020-10-24T18:47:58+0000,Sun,91.48,91488.0,kilometers,km,5:56:30,21390,5:57:35,21455,False,https://d3o5xota0a1fcr.cloudfront.net/v6/maps/L3FUD3VOKWV2IO6HINPPIYKH5WWGQY4SP7O5AXIWAGSBXYLB2WP3L7TWN7KNMBIU7CHK3U7NOFY7JPUQKGB243T5LOOJZGBP,True,False,"2,622",m,2622.0,,https://www.strava.com/activities/4239709026,https://www.strava.com/activities/4239709026?utm_content=1464505&utm_medium=referral&utm_source=twitter,went for a 91.4 kilometer Ride.,True,False,,4859.0,10,False,False,False,False,everyone,2020-10-25 07:47:58,1900-01-01 07:46:58-00:01,0.002250742145130884,5.959722222222222,5.941666666666666,91.488
60,3610837065,Lunch Ride,Ride,Ride,Ride,False,,,"Sun, 6/14/2020",1592139285,2020-06-14T00:54:45+0000,Sun,21.25,21255.0,kilometers,km,49:10,2950,1:08:07,4087,False,https://d3o5xota0a1fcr.cloudfront.net/v6/maps/BNKXXRELYPIP5P7PW2IHLREIZRJ77U2ZF7HU5GS3LZTSQFUWVVNNWIHNVXYXJ7RRY2KQMSPVCPHH4NA5XQ74KVHDT2XVYUWK,True,False,429,m,429.0,,https://www.strava.com/activities/3610837065,https://www.strava.com/activities/3610837065?utm_content=1464505&utm_medium=referral&utm_source=twitter,went for a 21.2 kilometer Ride.,True,False,,847.0,,False,False,False,False,everyone,2020-06-14 12:54:45,1900-01-01 12:53:45-00:01,0.00031041090828125794,1.1352777777777778,0.8194444444444444,21.255
61,3622254652,Lunch Activity,WeightTraining,Weight Training,Workout,False,,,"Sun, 6/14/2020",1592137111,2020-06-14T19:18:31+0000,Sun,0.0,0.0,kilometers,km,1:41:40,6100,1:41:40,6100,True,,False,False,0,m,0.0,,https://www.strava.com/activities/3622254652,https://www.strava.com/activities/3622254652?utm_content=1464505&utm_medium=referral&utm_source=twitter,went for a 0 kilometer Weight Training.,True,False,,597.0,30,False,False,False,False,everyone,2020-06-14 12:18:31,1900-01-01 12:17:31-00:01,0.0006418666239036182,1.6944444444444444,1.6944444444444444,0.0
62,3605508623,"MJ Inspired Three-peat ",Run,Run,Run,False,,,"Sat, 6/13/2020",1592051438,2020-06-13T00:30:38+0000,Sat,10.53,10538.0,kilometers,km,1:18:41,4721,1:34:02,5642,False,https://d3o5xota0a1fcr.cloudfront.net/v6/maps/DYU6UKTRJ56CKUOBKZCIKF7TO5PVL364FQWR2ENN6AYCOK7ZI4OJF2VGTT7Q5YMO7BKWEWFEMUBXF2ZZSYFHAA6VU4Z3HLWT,True,False,661,m,661.0,,https://www.strava.com/activities/3605508623,https://www.strava.com/activities/3605508623?utm_content=1464505&utm_medium=referral&utm_source=twitter,went for a 10.5 kilometer Run.,True,False,,1349.0,0,False,False,False,False,everyone,2020-06-13 12:30:38,1900-01-01 12:29:38-00:01,0.0004967626772867182,1.5672222222222223,1.311388888888889,10.538
63,3598458999,Night Activity,WeightTraining,Weight Training,Workout,False,,,"Wed, 6/10/2020",1591829951,2020-06-11T05:59:11+0000,Wed,0.0,0.0,kilometers,km,1:21:37,4897,1:21:37,4897,True,,False,False,0,m,0.0,,https://www.strava.com/activities/3598458999,https://www.strava.com/activities/3598458999?utm_content=1464505&utm_medium=referral&utm_source=twitter,went for a 0 kilometer Weight Training.,True,False,,693.0,30,False,False,False,False,everyone,2020-06-10 22:59:11,1900-01-01 22:58:11-00:01,0.0005152821077468882,1.3602777777777777,1.3602777777777777,0.0
64,3586671015,Night Run,Run,Run,Run,False,,,"Mon, 6/8/2020",1591659295,2020-06-09T06:34:55+0000,Mon,10.17,10170.0,kilometers,km,54:43,3283,1:00:40,3640,True,,False,False,0,m,0.0,,https://www.strava.com/activities/3586671015,https://www.strava.com/activities/3586671015?utm_content=1464505&utm_medium=referral&utm_source=twitter,went for a 10.1 kilometer Run.,True,False,,878.0,,False,False,False,False,everyone,2020-06-08 23:34:55,1900-01-01 23:33:55-00:01,0.0003454505125041932,1.011111111111111,0.9119444444444444,10.17
65,3581630292,Night Activity,WeightTraining,Weight Training,Workout,False,,,"Sun, 6/7/2020",1591568305,2020-06-08T05:18:25+0000,Sun,0.0,0.0,kilometers,km,1:24:41,5081,1:24:41,5081,True,,False,False,0,m,0.0,,https://www.strava.com/activities/3581630292,https://www.strava.com/activities/3581630292?utm_content=1464505&utm_medium=referral&utm_source=twitter,went for a 0 kilometer Weight Training.,True,False,,649.0,30,False,False,False,False,everyone,2020-06-07 22:18:25,1900-01-01 22:17:25-00:01,0.0005346433305007022,1.4113888888888888,1.4113888888888888,0.0
66,3575310634,Hardest 3hr 3km ride 🤷‍♂️ Thanks Suunto,Ride,Ride,Ride,False,,,"Sun, 6/7/2020",1591525922,2020-06-06T22:32:02+0000,Sun,2.98,2984.0,kilometers,km,18:14,1094,3:28:27,12507,False,https://d3o5xota0a1fcr.cloudfront.net/v6/maps/4KKXGFNPJ3ONGNXT6CPRY2TVND6GNMDFLEYMLYEHKBU4KJX64B3DEJQVAV46UFHYN4GNIC4VJG5JVJVTIKNPWR76EATLBLDR,True,False,926,m,926.0,,https://www.strava.com/activities/3575310634,https://www.strava.com/activities/3575310634?utm_content=1464505&utm_medium=referral&utm_source=twitter,went for a 2.9 kilometer Ride.,True,False,,1209.0,10,False,False,False,False,everyone,2020-06-07 10:32:02,1900-01-01 10:31:02-00:01,0.00011511509615582923,3.4741666666666666,0.3038888888888889,2.984
67,3573628334,Morning Ride,Ride,Ride,Ride,False,,,"Sat, 6/6/2020",1591430364,2020-06-05T19:59:24+0000,Sat,55.35,55354.0,kilometers,km,2:20:21,8421,3:12:45,11565,False,https://d3o5xota0a1fcr.cloudfront.net/v6/maps/Z6GPCT6C3FSVIQEXL5AEP2OALTNVD2RF7I5WPOGDZ5QXXWTXJZYORYROG5O6ITRDNNMPM6QQDFO5KDFSY2PP3M2DSZUGYNFA,True,False,492,m,492.0,,https://www.strava.com/activities/3573628334,https://www.strava.com/activities/3573628334?utm_content=1464505&utm_medium=referral&utm_source=twitter,went for a 55.3 kilometer Ride.,True,False,,1628.0,,False,False,False,False,everyone,2020-06-06 07:59:24,1900-01-01 07:58:24-00:01,0.0008860916130971096,3.2125,2.339166666666667,55.354
68,3568952924,Night Activity,WeightTraining,Weight Training,Workout,False,,,"Thu, 6/4/2020",1591309733,2020-06-05T05:28:53+0000,Thu,0.0,0.0,kilometers,km,1:26:06,5166,1:26:06,5166,True,,False,False,0,m,0.0,,https://www.strava.com/activities/3568952924,https://www.strava.com/activities/3568952924?utm_content=1464505&utm_medium=referral&utm_source=twitter,went for a 0 kilometer Weight Training.,True,False,,730.0,30,False,False,False,False,everyone,2020-06-04 22:28:53,1900-01-01 22:27:53-00:01,0.0005435873736206707,1.435,1.435,0.0
69,3561886583,Evening Run,Run,Run,Run,False,,,"Thu, 6/4/2020",1591303279,2020-06-04T08:41:19+0000,Thu,4.38,4383.0,kilometers,km,22:06,1326,22:12,1332,False,https://d3o5xota0a1fcr.cloudfront.net/v6/maps/5O2Y6GBZFUHOLWRN7SSB3X2NFFPM2J56UFGSPGETTNRCR36DGKBDU5V454OQVDILFQJVOAAVIXSAQD6LWQNZUDVPHKLZIJA2,True,False,99,m,99.0,,https://www.strava.com/activities/3561886583,https://www.strava.com/activities/3561886583?utm_content=1464505&utm_medium=referral&utm_source=twitter,went for a 4.3 kilometer Run.,True,False,,369.0,,False,False,False,False,everyone,2020-06-04 20:41:19,1900-01-01 20:40:19-00:01,0.0001395270726715078,0.37,0.36833333333333335,4.383
70,3546719005,Afternoon Ride,Ride,Ride,Ride,False,,,"Mon, 6/1/2020",1591021742,2020-06-01T02:29:02+0000,Mon,35.48,35480.0,kilometers,km,1:27:12,5232,1:38:03,5883,False,https://d3o5xota0a1fcr.cloudfront.net/v6/maps/RAVGR3U6P3XYQNBCPL3VBEZHKODPWGZJT2H7PFWXRRP4RPPJM4JGMCQQE7FBRWTPCJHMU23ZIAU3YASI3QSAFIN22GPCYA5U,True,False,693,m,693.0,,https://www.strava.com/activities/3546719005,https://www.strava.com/activities/3546719005?utm_content=1464505&utm_medium=referral&utm_source=twitter,went for a 35.4 kilometer Ride.,True,False,,1379.0,,False,False,False,False,everyone,2020-06-01 14:29:02,1900-01-01 14:28:02-00:01,0.0005505321600432345,1.6341666666666668,1.4533333333333334,35.48
71,3539121531,Morning Run,Run,Run,Run,False,,,"Sun, 5/31/2020",1590922727,2020-05-30T22:58:47+0000,Sun,25.18,25179.0,kilometers,km,2:59:27,10767,3:36:21,12981,False,https://d3o5xota0a1fcr.cloudfront.net/v6/maps/AN6IG34L2QYQOP4PXF34672DPW2QCR4DYF2NAEJUS2XXYVLSLPUIOTKDP2XNTTRJXPAJJ3NNGU43YQJFJ6CBMFX5PSM4FONV,True,False,951,m,951.0,,https://www.strava.com/activities/3539121531,https://www.strava.com/activities/3539121531?utm_content=1464505&utm_medium=referral&utm_source=twitter,went for a 25.1 kilometer Run.,True,False,,2857.0,0,False,False,False,False,everyone,2020-05-31 10:58:47,1900-01-01 10:57:47-00:01,0.0011329472032082387,3.6058333333333334,2.9908333333333332,25.179
72,3527428322,Lunch Activity,WeightTraining,Weight Training,Workout,False,,,"Wed, 5/27/2020",1590581620,2020-05-27T19:13:40+0000,Wed,0.0,0.0,kilometers,km,1:31:34,5494,1:31:34,5494,True,,False,False,0,m,0.0,,https://www.strava.com/activities/3527428322,https://www.strava.com/activities/3527428322?utm_content=1464505&utm_medium=referral&utm_source=twitter,went for a 0 kilometer Weight Training.,True,False,,1199.0,30,False,False,False,False,everyone,2020-05-27 12:13:40,1900-01-01 12:12:40-00:01,0.0005781008576600784,1.5261111111111112,1.5261111111111112,0.0
73,3512319229,Lunch Run,Run,Run,Run,False,,,"Tue, 5/26/2020",1590497902,2020-05-26T00:58:22+0000,Tue,9.26,9265.0,kilometers,km,46:21,2781,50:55,3055,False,https://d3o5xota0a1fcr.cloudfront.net/v6/maps/XDRKCPY76CXBYPXA5MQN24RY2OSZXN4CHDHO4NJNRFSQJR6CSLQGERZ5QM4OC2ADFBJFLK7Z5V3A2X6NNALYCQITPYR3KQ7K,True,False,113,m,113.0,,https://www.strava.com/activities/3512319229,https://www.strava.com/activities/3512319229?utm_content=1464505&utm_medium=referral&utm_source=twitter,went for a 9.2 kilometer Run.,True,False,,826.0,,False,False,False,False,everyone,2020-05-26 12:58:22,1900-01-01 12:57:22-00:01,0.00029262804607802656,0.8486111111111111,0.7725,9.265
74,3514244875,Night Activity,WeightTraining,Weight Training,Workout,False,,,"Tue, 5/26/2020",1590457969,2020-05-26T08:52:49+0000,Tue,0.0,0.0,kilometers,km,1:14:08,4448,1:14:08,4448,True,,False,False,0,m,0.0,,https://www.strava.com/activities/3514244875,https://www.strava.com/activities/3514244875?utm_content=1464505&utm_medium=referral&utm_source=twitter,went for a 0 kilometer Weight Training.,True,False,,578.0,30,False,False,False,False,everyone,2020-05-26 01:52:49,1900-01-01 01:51:49-00:01,0.0004680365152661137,1.2355555555555555,1.2355555555555555,0.0
75,3501066939,Lunch Run,Run,Run,Run,False,,,"Sun, 5/24/2020",1590321090,2020-05-23T23:51:30+0000,Sun,11.46,11461.0,kilometers,km,53:18,3198,57:42,3462,False,https://d3o5xota0a1fcr.cloudfront.net/v6/maps/P3VHNZOGIQBIRCZHHCS4EXQTMCJIWVB6KLLPYSHHSX65ERQSWGQTVV2WW3LMGBXJIKUKOTTDQMGCT4UEPQKPULNNPZBYG5UP,True,False,181,m,181.0,,https://www.strava.com/activities/3501066939,https://www.strava.com/activities/3501066939?utm_content=1464505&utm_medium=referral&utm_source=twitter,went for a 11.4 kilometer Run.,True,False,,991.0,,False,False,False,False,everyone,2020-05-24 11:51:30,1900-01-01 11:50:30-00:01,0.0003365064693842247,0.9616666666666667,0.8883333333333333,11.461
76,3496006674,Morning Ride,Ride,Ride,Ride,False,,,"Sat, 5/23/2020",1590227994,2020-05-22T21:59:54+0000,Sat,88.38,88379.0,kilometers,km,3:06:26,11186,3:27:17,12437,False,https://d3o5xota0a1fcr.cloudfront.net/v6/maps/UIFKQFEBFCNKGKTBSISNH4TM5HLMW4F7UGS7ZLKJFHOKDUBUNWLYRAB627OCRWCTRQI7HXH7LG2JVDQF46QH5OPS4WSR2IY7,True,False,"1,004",m,1004.0,,https://www.strava.com/activities/3496006674,https://www.strava.com/activities/3496006674?utm_content=1464505&utm_medium=referral&utm_source=twitter,went for a 88.3 kilometer Ride.,True,False,,2364.0,10,False,False,False,False,everyone,2020-05-23 09:59:54,1900-01-01 09:58:54-00:01,0.001177036074587848,3.4547222222222222,3.107222222222222,88.379
77,3492670988,Night Activity,WeightTraining,Weight Training,Workout,False,,,"Fri, 5/22/2020",1590105613,2020-05-22T07:00:13+0000,Fri,0.0,0.0,kilometers,km,1:36:34,5794,1:36:34,5794,True,,False,False,0,m,0.0,,https://www.strava.com/activities/3492670988,https://www.strava.com/activities/3492670988?utm_content=1464505&utm_medium=referral&utm_source=twitter,went for a 0 kilometer Weight Training.,True,False,,793.0,30,False,False,False,False,everyone,2020-05-22 00:00:13,1899-12-31 23:59:13-00:01,0.0006096680686717318,1.6094444444444445,1.6094444444444445,0.0
78,3486808325,Evening Run,Run,Run,Run,False,,,"Thu, 5/21/2020",1590093046,2020-05-21T08:30:46+0000,Thu,10.42,10420.0,kilometers,km,49:47,2987,52:28,3148,False,https://d3o5xota0a1fcr.cloudfront.net/v6/maps/YETIDSJ7HXTOJ37KCPB574KFBLT7H4LA7B7SV2RD2TRWFYNO27KP3AGFVH6AOJB7N7X5OCZ66A7ABRNQANLKIK5WQSMJ3A2Q,True,False,117,m,117.0,,https://www.strava.com/activities/3486808325,https://www.strava.com/activities/3486808325?utm_content=1464505&utm_medium=referral&utm_source=twitter,went for a 10.4 kilometer Run.,True,False,,874.0,,False,False,False,False,everyone,2020-05-21 20:30:46,1900-01-01 20:29:46-00:01,0.00031430419763936186,0.8744444444444445,0.8297222222222222,10.42
79,3479183853,Morning Run,Run,Run,Run,False,,,"Wed, 5/20/2020",1589960824,2020-05-19T19:47:04+0000,Wed,4.77,4770.0,kilometers,km,22:11,1331,22:24,1344,False,https://d3o5xota0a1fcr.cloudfront.net/v6/maps/7DDLNIFYZXT2EXMIDTGD3WUT76PRRTBHLI6NJZ2342E2EOE42ZVM5CMCUXRL6J2RXI3BJ5BC7K7N65CVYVXROFYQ36L2UVAU,True,False,63,m,63.0,,https://www.strava.com/activities/3479183853,https://www.strava.com/activities/3479183853?utm_content=1464505&utm_medium=referral&utm_source=twitter,went for a 4.7 kilometer Run.,True,False,,427.0,,False,False,False,False,everyone,2020-05-20 07:47:04,1900-01-01 07:46:04-00:01,0.00014005319285503536,0.37333333333333335,0.36972222222222223,4.77
80,3861966019,Night Activity,WeightTraining,Weight Training,Workout,False,,,"Tue, 8/4/2020",1596502169,2020-08-04T07:49:29+0000,Tue,0.0,0.0,kilometers,km,1:15:10,4510,1:15:10,4510,True,,False,False,0,m,0.0,,https://www.strava.com/activities/3861966019,https://www.strava.com/activities/3861966019?utm_content=1464505&utm_medium=referral&utm_source=twitter,went for a 0 kilometer Weight Training.,True,False,,588.0,30,False,False,False,False,everyone,2020-08-04 00:49:29,1900-01-01 00:48:29-00:01,0.00047456040554185537,1.2527777777777778,1.2527777777777778,0.0
81,3845892002,Lunch Ride,Ride,Ride,Ride,False,,,"Sat, 8/1/2020",1596280055,2020-07-31T23:07:35+0000,Sat,60.56,60566.0,kilometers,km,2:13:19,7999,2:29:34,8974,False,https://d3o5xota0a1fcr.cloudfront.net/v6/maps/4UY542EHR7PESZJYSFND4RVZ4P5RK2VDUVQZLO6N6XILAA65FHJV5JVS64FUREBE2AH24723RJCOZPHASTWRA4XY6DACNMPI,True,False,883,m,883.0,,https://www.strava.com/activities/3845892002,https://www.strava.com/activities/3845892002?utm_content=1464505&utm_medium=referral&utm_source=twitter,went for a 60.5 kilometer Ride.,True,False,,1346.0,,False,False,False,False,everyone,2020-08-01 11:07:35,1900-01-01 11:06:35-00:01,0.0008416870696073839,2.492777777777778,2.2219444444444445,60.566
82,3825505190,Morning Run,Run,Run,Run,False,,,"Tue, 7/28/2020",1595924303,2020-07-27T20:18:23+0000,Tue,7.38,7379.0,kilometers,km,4:27:25,16045,4:32:53,16373,False,https://d3o5xota0a1fcr.cloudfront.net/v6/maps/7OWGECW2LVDMIR37XTRDF6HO5DUKXDN23OJCYKK5RMDIWE4ISPK75F6MS5HV4PPDKE77DQQAZOZH3DJKRFLSXMJ7H2VAV6PA,True,False,714,m,714.0,,https://www.strava.com/activities/3825505190,https://www.strava.com/activities/3825505190?utm_content=1464505&utm_medium=referral&utm_source=twitter,went for a 7.3 kilometer Run.,True,False,,1630.0,,False,False,False,False,everyone,2020-07-28 08:18:23,1900-01-01 08:17:23-00:01,0.0016883196689399269,4.548055555555556,4.456944444444445,7.379
83,3809845390,Lunch Run,Run,Run,Run,False,,,"Sat, 7/25/2020",1595679582,2020-07-25T00:19:42+0000,Sat,5.46,5465.0,kilometers,km,1:06:13,3973,1:18:38,4718,False,https://d3o5xota0a1fcr.cloudfront.net/v6/maps/FBX37APXGMNFWEA7KWWY6ZHECTGEF67FJQAZANGSXDUWV3JNURYCX3HAWLUJJ44SD6ZBC35LIDMQUCZ7J4SCAX23JQ2KOM3O,True,False,399,m,399.0,,https://www.strava.com/activities/3809845390,https://www.strava.com/activities/3809845390?utm_content=1464505&utm_medium=referral&utm_source=twitter,went for a 5.4 kilometer Run.,True,False,,704.0,,False,False,False,False,everyone,2020-07-25 12:19:42,1900-01-01 12:18:42-00:01,0.0004180550978309959,1.3105555555555555,1.103611111111111,5.465
84,3795428006,Night Activity,WeightTraining,Weight Training,Workout,False,,,"Tue, 7/21/2020",1595289765,2020-07-21T07:02:45+0000,Tue,0.0,0.0,kilometers,km,2:20:29,8429,2:20:29,8429,True,,False,False,0,m,0.0,,https://www.strava.com/activities/3795428006,https://www.strava.com/activities/3795428006?utm_content=1464505&utm_medium=referral&utm_source=twitter,went for a 0 kilometer Weight Training.,True,False,,625.0,30,False,False,False,False,everyone,2020-07-21 00:02:45,1900-01-01 00:01:45-00:01,0.0008869334053907536,2.341388888888889,2.341388888888889,0.0
85,3782692850,Morning Run,Run,Run,Run,False,,,"Sun, 7/19/2020",1595149245,2020-07-18T21:00:45+0000,Sun,20.54,20542.0,kilometers,km,1:53:04,6784,1:53:09,6789,False,https://d3o5xota0a1fcr.cloudfront.net/v6/maps/NZIEWQSAHWZM5BWFWABM74MXUAS2AQCIXQKL4CDCZVUQNO5C3WD63MKMQTGV5ARMM5FOCBPP32LEIHJP2KXDNAKWKHUU6G2U,True,False,470,m,470.0,,https://www.strava.com/activities/3782692850,https://www.strava.com/activities/3782692850?utm_content=1464505&utm_medium=referral&utm_source=twitter,went for a 20.5 kilometer Run.,True,False,,2152.0,,False,False,False,False,everyone,2020-07-19 09:00:45,1900-01-01 08:59:45-00:01,0.0007138398650101878,1.8858333333333333,1.8844444444444444,20.542
86,3781003961,Afternoon Ride,Ride,Ride,Ride,False,,,"Sat, 7/18/2020",1595080154,2020-07-18T01:49:14+0000,Sat,14.78,14782.0,kilometers,km,33:13,1993,36:03,2163,False,https://d3o5xota0a1fcr.cloudfront.net/v6/maps/2GL5TW6VWI4HJT44XZRMBO6N3TPI2QBJULKAVDN3SLMKVTCQSRWSVRA736TIWCKI5HWD5ZOHD7HEUIYHM5FKKQW73DCILP6J,True,False,148,m,148.0,,https://www.strava.com/activities/3781003961,https://www.strava.com/activities/3781003961?utm_content=1464505&utm_medium=referral&utm_source=twitter,went for a 14.7 kilometer Ride.,True,False,,254.0,,False,False,False,False,everyone,2020-07-18 13:49:14,1900-01-01 13:48:14-00:01,0.00020971150515408378,0.6008333333333333,0.5536111111111112,14.782
87,3759523014,Tuesday Tune Up,Run,Run,Run,False,,,"Tue, 7/14/2020",1594752629,2020-07-14T06:50:29+0000,Tue,9.32,9325.0,kilometers,km,45:41,2741,50:30,3030,False,https://d3o5xota0a1fcr.cloudfront.net/v6/maps/R2D5SGDQ6DU6OPD6I66VATF5G2TZEWOTXHID7XR5L4DQLXLU2H7P3IZFPDGIHXY6MWATXC4DRHVZFJT7FK6AM6WZ55M6N4NH,True,False,227,m,227.0,,https://www.strava.com/activities/3759523014,https://www.strava.com/activities/3759523014?utm_content=1464505&utm_medium=referral&utm_source=twitter,went for a 9.3 kilometer Run.,True,False,,1017.0,0,False,False,False,False,everyone,2020-07-14 18:50:29,1900-01-01 18:49:29-00:01,0.00028841908460980613,0.8416666666666667,0.7613888888888889,9.325
88,3748880995,Afternoon Ride,Ride,Ride,Ride,False,,,"Sun, 7/12/2020",1594560608,2020-07-12T01:30:08+0000,Sun,44.5,44508.0,kilometers,km,1:36:49,5809,1:46:09,6369,False,https://d3o5xota0a1fcr.cloudfront.net/v6/maps/XJI6CIWLMMCYH6JT35WFGOSE5J5KM2ATBLI6FFFJVZHYBUMLZCNXI45SSYKMZE2IMYMDD553WUXSVHNO4FBRUCP35BCZVZYN,True,False,442,m,442.0,,https://www.strava.com/activities/3748880995,https://www.strava.com/activities/3748880995?utm_content=1464505&utm_medium=referral&utm_source=twitter,went for a 44.5 kilometer Ride.,True,False,,1221.0,,False,False,False,False,everyone,2020-07-12 13:30:08,1900-01-01 13:29:08-00:01,0.0006112464292223145,1.7691666666666668,1.613611111111111,44.508
89,3744188324,Lunch Run,Run,Run,Run,False,,,"Sat, 7/11/2020",1594469835,2020-07-11T00:17:15+0000,Sat,17.02,17028.0,kilometers,km,1:19:27,4767,1:29:23,5363,False,https://d3o5xota0a1fcr.cloudfront.net/v6/maps/IMRP73WRW2YO77CZMMSOHNI4FZCPEY5CMOFUGMNP2NB36OPGKGNJTK2AH75GKH4WY5YGK5PRIGYTSRFQMOYBYZWRIOJDIXDD,True,False,131,m,131.0,,https://www.strava.com/activities/3744188324,https://www.strava.com/activities/3744188324?utm_content=1464505&utm_medium=referral&utm_source=twitter,went for a 17.0 kilometer Run.,True,False,,1355.0,,False,False,False,False,everyone,2020-07-11 12:17:15,1900-01-01 12:16:15-00:01,0.0005016029829751717,1.4897222222222222,1.3241666666666667,17.028
90,3714883904,Morning Ride,Ride,Ride,Ride,False,,,"Sun, 7/5/2020",1593944336,2020-07-04T22:18:56+0000,Sun,42.14,42140.0,kilometers,km,1:36:09,5769,2:17:57,8277,False,https://d3o5xota0a1fcr.cloudfront.net/v6/maps/WJIWEQVNSMELGLKPYX5DSPKLFZ5FXQAUGDJU6XFDMLH5LESP7R24RK7I6G3YPWTB5OSPGJ5ZOWOTUC4WCL6VEU5TLLLQ6YVD,True,False,527,m,527.0,,https://www.strava.com/activities/3714883904,https://www.strava.com/activities/3714883904?utm_content=1464505&utm_medium=referral&utm_source=twitter,went for a 42.1 kilometer Ride.,True,False,,708.0,,False,False,False,False,everyone,2020-07-05 10:18:56,1900-01-01 10:17:56-00:01,0.000607037467754094,2.299166666666667,1.6025,42.14
91,3710157456,Afternoon Ride,Ride,Ride,Ride,False,,,"Sat, 7/4/2020",1593882269,2020-07-04T05:04:29+0000,Sat,15.63,15637.0,kilometers,km,37:00,2220,44:20,2660,False,https://d3o5xota0a1fcr.cloudfront.net/v6/maps/YQPN7OUKCS44IVKE2VBCLSSBQL7JT5Y4GW3ZLLCZSZ3YTP6LPK4XBYPSKL7GUHZKKUNBM7NXV5LJRMF64PGWGEUS2VB44T5I,True,False,212,m,212.0,,https://www.strava.com/activities/3710157456,https://www.strava.com/activities/3710157456?utm_content=1464505&utm_medium=referral&utm_source=twitter,went for a 15.6 kilometer Ride.,True,False,,323.0,,False,False,False,False,everyone,2020-07-04 17:04:29,1900-01-01 17:03:29-00:01,0.0002335973614862348,0.7388888888888889,0.6166666666666667,15.637
92,3687120509,Night Activity,WeightTraining,Weight Training,Workout,False,,,"Sun, 6/28/2020",1593387816,2020-06-29T06:43:36+0000,Sun,0.0,0.0,kilometers,km,1:31:19,5479,1:31:19,5479,True,,False,False,0,m,0.0,,https://www.strava.com/activities/3687120509,https://www.strava.com/activities/3687120509?utm_content=1464505&utm_medium=referral&utm_source=twitter,went for a 0 kilometer Weight Training.,True,False,,724.0,30,False,False,False,False,everyone,2020-06-28 23:43:36,1900-01-01 23:42:36-00:01,0.0005765224971094957,1.5219444444444445,1.5219444444444445,0.0
93,3685726030,Afternoon Ride,Ride,Ride,Ride,False,,,"Sun, 6/28/2020",1593363043,2020-06-28T04:50:43+0000,Sun,19.81,19814.0,kilometers,km,40:44,2444,42:39,2559,False,https://d3o5xota0a1fcr.cloudfront.net/v6/maps/IRM2SXCPFRWPCOM3HXASBGDSEDDH5W7SD2IV4SKOE3PEGTJIO2QR6ARQ5SXG7WQYPAVIWPW7T2CFNWNKFLZ364MRUVM5B6NS,True,False,771,m,771.0,,https://www.strava.com/activities/3685726030,https://www.strava.com/activities/3685726030?utm_content=1464505&utm_medium=referral&utm_source=twitter,went for a 19.8 kilometer Ride.,True,False,,270.0,,False,False,False,False,everyone,2020-06-28 16:50:43,1900-01-01 16:49:43-00:01,0.0002571675457082693,0.7108333333333333,0.6788888888888889,19.814
94,3662770192,Night Activity,WeightTraining,Weight Training,Workout,False,,,"Tue, 6/23/2020",1592952533,2020-06-24T05:48:53+0000,Tue,0.0,0.0,kilometers,km,1:48:53,6533,1:48:53,6533,True,,False,False,0,m,0.0,,https://www.strava.com/activities/3662770192,https://www.strava.com/activities/3662770192?utm_content=1464505&utm_medium=referral&utm_source=twitter,went for a 0 kilometer Weight Training.,True,False,,875.0,30,False,False,False,False,everyone,2020-06-23 22:48:53,1900-01-01 22:47:53-00:01,0.0006874286317971045,1.8147222222222221,1.8147222222222221,0.0
95,3657399757,Evening Run,Run,Run,Run,False,,,"Tue, 6/23/2020",1592938174,2020-06-23T06:49:34+0000,Tue,14.02,14027.0,kilometers,km,1:06:22,3982,1:19:13,4753,False,https://d3o5xota0a1fcr.cloudfront.net/v6/maps/DJNSIHJX55DL6L76WYJNF4ACVESYZMFA5EHJVJGCNT6TZCWHLYBBIWHTFM3JBKPCDSGWXG4A6CVKGOZVZG4LXTKUMAVOUWVI,True,False,146,m,146.0,,https://www.strava.com/activities/3657399757,https://www.strava.com/activities/3657399757?utm_content=1464505&utm_medium=referral&utm_source=twitter,went for a 14.0 kilometer Run.,True,False,,1146.0,,False,False,False,False,everyone,2020-06-23 18:49:34,1900-01-01 18:48:34-00:01,0.0004190021141613455,1.3202777777777779,1.106111111111111,14.027
96,3651841577,Afternoon Activity,WeightTraining,Weight Training,Workout,False,,,"Sat, 6/20/2020",1592672249,2020-06-20T23:57:29+0000,Sat,0.0,0.0,kilometers,km,1:40:18,6018,1:40:18,6018,True,,False,False,0,m,0.0,,https://www.strava.com/activities/3651841577,https://www.strava.com/activities/3651841577?utm_content=1464505&utm_medium=referral&utm_source=twitter,went for a 0 kilometer Weight Training.,True,False,,696.0,30,False,False,False,False,everyone,2020-06-20 16:57:29,1900-01-01 16:56:29-00:01,0.0006332382528937662,1.6716666666666666,1.6716666666666666,0.0
97,3640825242,Lunch Run,Run,Run,Run,False,,,"Sat, 6/20/2020",1592654374,2020-06-19T23:59:34+0000,Sat,17.1,17108.0,kilometers,km,1:19:40,4780,1:26:10,5170,False,https://d3o5xota0a1fcr.cloudfront.net/v6/maps/JQ25UM2MN3THCHKPT52KJCO6HUIV32O2J6MYFGRD552SIORQRXVMJZB5H5LKFYYCN3OMVZZTVTB6EAN4N7MX7U2HJFSERX7B,True,False,257,m,257.0,,https://www.strava.com/activities/3640825242,https://www.strava.com/activities/3640825242?utm_content=1464505&utm_medium=referral&utm_source=twitter,went for a 17.1 kilometer Run.,True,False,,1402.0,,False,False,False,False,everyone,2020-06-20 11:59:34,1900-01-01 11:58:34-00:01,0.0005029708954523434,1.4361111111111111,1.3277777777777777,17.108
98,3622264558,Evening Run,Run,Run,Run,False,,,"Tue, 6/16/2020",1592331494,2020-06-16T06:18:14+0000,Tue,11.0,11005.0,kilometers,km,49:35,2975,55:08,3308,False,https://d3o5xota0a1fcr.cloudfront.net/v6/maps/K5Z52ULVXSVVUPL24B2VX6WQNPU4L7Q4PVDTE242CQV465CFGNCNP54OT6YDV73WPDMH6OOHZNWE2W57YHSTVMODNLEAD723,True,False,120,m,120.0,,https://www.strava.com/activities/3622264558,https://www.strava.com/activities/3622264558?utm_content=1464505&utm_medium=referral&utm_source=twitter,went for a 11.0 kilometer Run.,True,False,,892.0,,False,False,False,False,everyone,2020-06-16 18:18:14,1900-01-01 18:17:14-00:01,0.00031304150919889574,0.9188888888888889,0.8263888888888888,11.005
99,3627983612,Lunch Activity,WeightTraining,Weight Training,Workout,False,,,"Tue, 6/16/2020",1592307495,2020-06-16T18:38:15+0000,Tue,0.0,0.0,kilometers,km,1:41:15,6075,1:41:15,6075,True,,False,False,0,m,0.0,,https://www.strava.com/activities/3627983612,https://www.strava.com/activities/3627983612?utm_content=1464505&utm_medium=referral&utm_source=twitter,went for a 0 kilometer Weight Training.,True,False,,705.0,30,False,False,False,False,everyone,2020-06-16 11:38:15,1900-01-01 11:37:15-00:01,0.0006392360229859804,1.6875,1.6875,0.0
100,4091038708,Afternoon Ride,Ride,Ride,Ride,False,,,"Sun, 9/20/2020",1600612100,2020-09-20T02:28:20+0000,Sun,20.68,20682.0,kilometers,km,40:27,2427,58:57,3537,False,https://d3o5xota0a1fcr.cloudfront.net/v6/maps/OLBIMJ5AO4VJOLENC2TPKZGTU2KEZLOVI5JNZBSYF4JANXG2R56DAMRLRVULJ5TRYRD3STRPLT3IJK4QGRFYJHPKCAV5UUTQ,True,False,219,m,219.0,,https://www.strava.com/activities/4091038708,https://www.strava.com/activities/4091038708?utm_content=1464505&utm_medium=referral&utm_source=twitter,went for a 20.6 kilometer Ride.,True,False,,669.0,,False,False,False,False,everyone,2020-09-20 14:28:20,1900-01-01 14:27:20-00:01,0.0002553787370842756,0.9825,0.6741666666666667,20.682
101,4067825930,Afternoon Ride,Ride,Ride,Ride,False,,,"Wed, 9/16/2020",1600277644,2020-09-16T05:34:04+0000,Wed,31.74,31746.0,kilometers,km,1:04:50,3890,1:10:32,4232,False,https://d3o5xota0a1fcr.cloudfront.net/v6/maps/T2SRNFWJ3YNRD5BTS7OQ3537DUQWQIIRCJKVNVNTF6FBTP3KDGLLJZMIABFDHS25NUACZOOSUVXQZFMLEM3GC72AE6XSFYLK,True,False,343,m,343.0,,https://www.strava.com/activities/4067825930,https://www.strava.com/activities/4067825930?utm_content=1464505&utm_medium=referral&utm_source=twitter,went for a 31.7 kilometer Ride.,True,False,,964.0,,False,False,False,False,everyone,2020-09-16 17:34:04,1900-01-01 17:33:04-00:01,0.00040932150278443847,1.1755555555555555,1.0805555555555555,31.746
102,4051703139,Morning Run,Run,Run,Run,False,,,"Sun, 9/13/2020",1599994263,2020-09-12T22:51:03+0000,Sun,15.69,15698.0,kilometers,km,2:07:20,7640,2:24:51,8691,False,https://d3o5xota0a1fcr.cloudfront.net/v6/maps/NLTDR6K7QJH6BHQWVVN5LLRRJO7WMAXBAVVVT4WYDLLFQG3C2NDK6X7QLTOAUWTJTL5OUNU7M5CIJADHQMMNYRUAAUS3PGGY,True,False,598,m,598.0,,https://www.strava.com/activities/4051703139,https://www.strava.com/activities/4051703139?utm_content=1464505&utm_medium=referral&utm_source=twitter,went for a 15.6 kilometer Run.,True,False,,1619.0,,False,False,False,False,everyone,2020-09-13 10:51:03,1900-01-01 10:50:03-00:01,0.0008039116404301054,2.4141666666666666,2.1222222222222222,15.698
103,4050049498,Afternoon Ride,Ride,Ride,Ride,False,,,"Sat, 9/12/2020",1599916810,2020-09-12T01:20:10+0000,Sat,31.39,31395.0,kilometers,km,2:08:50,7730,3:16:24,11784,False,https://d3o5xota0a1fcr.cloudfront.net/v6/maps/KPH7ND4SK73BPODSNSTQDVXUJTDMENWINRELTIPV2JIAL5VE3QED3WD5QDYVMXL6QQ4ZP3JAPDW3ZCUVMSI6LTTCVK34DZU6,True,False,"1,018",m,1018.0,,https://www.strava.com/activities/4050049498,https://www.strava.com/activities/4050049498?utm_content=1464505&utm_medium=referral&utm_source=twitter,went for a 31.3 kilometer Ride.,True,False,,2035.0,,False,False,False,False,everyone,2020-09-12 13:20:10,1900-01-01 13:19:10-00:01,0.0008133818037336013,3.2733333333333334,2.147222222222222,31.395
104,4030089866,Afternoon Ride,Ride,Ride,Ride,False,,,"Tue, 9/8/2020",1599586124,2020-09-08T05:28:44+0000,Tue,24.97,24972.0,kilometers,km,1:04:37,3877,1:14:22,4462,False,https://d3o5xota0a1fcr.cloudfront.net/v6/maps/ULIK732Y6MIXGQKCK5HKLXIZ2L25B6KYHGULFSESABRTKQK4HLED5RMYB3ZH6UX4JNJQG3ZYJBSV7ZB3I6YF76GWJF6YGHNT,True,False,562,m,562.0,,https://www.strava.com/activities/4030089866,https://www.strava.com/activities/4030089866?utm_content=1464505&utm_medium=referral&utm_source=twitter,went for a 24.9 kilometer Ride.,True,False,,944.0,,False,False,False,False,everyone,2020-09-08 17:28:44,1900-01-01 17:27:44-00:01,0.0004079535903072668,1.2394444444444443,1.0769444444444445,24.972
105,4013201070,Morning Ride,Ride,Ride,Ride,False,,,"Sat, 9/5/2020",1599299823,2020-09-04T21:57:03+0000,Sat,78.49,78498.0,kilometers,km,3:51:42,13902,5:58:43,21523,False,https://d3o5xota0a1fcr.cloudfront.net/v6/maps/PLGQREIOIZBCUOISD4U7PDPNCA6WCI62HPOZ32OB7KFTZUMWCWPPQXT2MFRGLN4X5ABWENYJWTCXRKS3ZGUFJYWA4Q3QEGSM,True,False,"1,909",m,1909.0,,https://www.strava.com/activities/4013201070,https://www.strava.com/activities/4013201070?utm_content=1464505&utm_medium=referral&utm_source=twitter,went for a 78.4 kilometer Ride.,True,False,,3426.0,,False,False,False,False,everyone,2020-09-05 09:57:03,1900-01-01 09:56:03-00:01,0.0014628245582800163,5.978611111111111,3.861666666666667,78.498
106,4002704040,Morning Ride,Ride,Ride,Ride,False,,,"Thu, 9/3/2020",1599115673,2020-09-02T18:47:53+0000,Thu,39.69,39692.0,kilometers,km,1:16:32,4592,1:34:14,5654,False,https://d3o5xota0a1fcr.cloudfront.net/v6/maps/WAV5GOULHP3R6KHCACIQ4G5FHPTTXQNDWIDX5M2XMLT6BGIBXONWSZJ5RFRU5TMHLZMDRIOL7KB4HM4XXBLKMRAJOY37AXND,True,False,233,m,233.0,,https://www.strava.com/activities/4002704040,https://www.strava.com/activities/4002704040?utm_content=1464505&utm_medium=referral&utm_source=twitter,went for a 39.6 kilometer Ride.,True,False,,1201.0,,False,False,False,False,everyone,2020-09-03 06:47:53,1900-01-01 06:46:53-00:01,0.0004831887765517073,1.5705555555555555,1.2755555555555556,39.692
107,3985877937,Morning Run,Run,Run,Run,False,,,"Sun, 8/30/2020",1598781850,2020-08-29T22:04:10+0000,Sun,15.99,15989.0,kilometers,km,3:13:29,11609,3:52:20,13940,False,https://d3o5xota0a1fcr.cloudfront.net/v6/maps/U67ABG3FR6WJ4G2JFNHLNK6Z5HU4KZUUDTWB7AIF3ZFWB5HTHQ2RWHQXWBUJF3ZIMDWE3YP6IY2ESRSG2GYT6ELRU34AQYQN,True,False,755,m,755.0,,https://www.strava.com/activities/3985877937,https://www.strava.com/activities/3985877937?utm_content=1464505&utm_medium=referral&utm_source=twitter,went for a 15.9 kilometer Run.,True,False,,2076.0,,False,False,False,False,everyone,2020-08-30 10:04:10,1900-01-01 10:03:10-00:01,0.0012215458421142792,3.8722222222222222,3.2247222222222223,15.989
108,3980145770,Lunch Ride,Ride,Ride,Ride,False,,,"Sat, 8/29/2020",1598703435,2020-08-29T00:17:15+0000,Sat,74.15,74153.0,kilometers,km,2:42:01,9721,3:02:54,10974,False,https://d3o5xota0a1fcr.cloudfront.net/v6/maps/JI5SWQWRKDR3NW4UZNNZ3V3RGQV6SRWPKE2CHZLQ2M53QGDDARL4CTBZIZ7HWAEJCG5ZL2EJHJEXE4IVEECO2PWPDI4RLZXN,True,False,994,m,994.0,,https://www.strava.com/activities/3980145770,https://www.strava.com/activities/3980145770?utm_content=1464505&utm_medium=referral&utm_source=twitter,went for a 74.1 kilometer Ride.,True,False,,2102.0,,False,False,False,False,everyone,2020-08-29 12:17:15,1900-01-01 12:16:15-00:01,0.0010228828608142742,3.0483333333333333,2.700277777777778,74.153
109,3976357060,Afternoon Ride,Ride,Ride,Ride,False,,,"Fri, 8/28/2020",1598636652,2020-08-28T05:44:12+0000,Fri,18.68,18686.0,kilometers,km,47:12,2832,57:06,3426,False,https://d3o5xota0a1fcr.cloudfront.net/v6/maps/QB62LBIKTCDSPJA7GEGK5QY76M4O2JV2LTPBAKH7JW2VLGMHL6KUYAYTLTMI5W5QKHYG5F3ZT4K5TZPD63LJLEJSWLOGIK2B,True,False,166,m,166.0,,https://www.strava.com/activities/3976357060,https://www.strava.com/activities/3976357060?utm_content=1464505&utm_medium=referral&utm_source=twitter,went for a 18.6 kilometer Ride.,True,False,,460.0,,False,False,False,False,everyone,2020-08-28 17:44:12,1900-01-01 17:43:12-00:01,0.00029799447195000766,0.9516666666666667,0.7866666666666666,18.686
110,3976342331,Afternoon Ride,Ride,Ride,Ride,False,,,"Thu, 8/27/2020",1598550641,2020-08-27T05:50:41+0000,Thu,39.11,39109.0,kilometers,km,1:17:00,4620,1:18:10,4690,False,https://d3o5xota0a1fcr.cloudfront.net/v6/maps/ELPKA2Q4K6XLVMRBVJMKTGTB7FZ2HEK2SR7NQA4JJNUKYO6YXJWTR3JE6XQVZL3CGE6W6JAKCIGSPNQZPIKXB3C4R6PP2ZXC,True,False,120,m,120.0,,https://www.strava.com/activities/3976342331,https://www.strava.com/activities/3976342331?utm_content=1464505&utm_medium=referral&utm_source=twitter,went for a 39.1 kilometer Ride.,True,False,,1116.0,,False,False,False,False,everyone,2020-08-27 17:50:41,1900-01-01 17:49:41-00:01,0.00048613504957946164,1.3027777777777778,1.2833333333333334,39.109
111,3952234371,Morning Ride,Ride,Ride,Ride,False,,,"Sun, 8/23/2020",1598179077,2020-08-22T22:37:57+0000,Sun,41.66,41660.0,kilometers,km,1:56:13,6973,2:30:23,9023,False,https://d3o5xota0a1fcr.cloudfront.net/v6/maps/HNOSMSADCLIYUFXT64YWWTWRIO22I5GY5DY7MLLVNJU6HHYNLQA2B7KOFU2X43MWP7G44IK57OR7VUORWFIUSQLIFLBYTUSA,True,False,745,m,745.0,,https://www.strava.com/activities/3952234371,https://www.strava.com/activities/3952234371?utm_content=1464505&utm_medium=referral&utm_source=twitter,went for a 41.6 kilometer Ride.,True,False,,1517.0,,False,False,False,False,everyone,2020-08-23 10:37:57,1900-01-01 10:36:57-00:01,0.0007337272079475294,2.506388888888889,1.9369444444444444,41.66
112,3947630644,Lunch Ride,Ride,Ride,Ride,False,,,"Sat, 8/22/2020",1598095747,2020-08-21T23:29:07+0000,Sat,110.17,110175.0,kilometers,km,4:20:03,15603,4:52:10,17530,False,https://d3o5xota0a1fcr.cloudfront.net/v6/maps/ALLH2QCBS3ZMTUIXHEO3TAPVS7VBIB7KQS4ZRQIFOWFQV2QZB574XAWNDNDL7ATSSCSIQO65LJP5MXHJOWYX3UM3GAK2FFW5,True,False,"1,801",m,1801.0,,https://www.strava.com/activities/3947630644,https://www.strava.com/activities/3947630644?utm_content=1464505&utm_medium=referral&utm_source=twitter,went for a 110.1 kilometer Ride.,True,False,,3369.0,,False,False,False,False,everyone,2020-08-22 11:29:07,1900-01-01 11:28:07-00:01,0.001641810644716091,4.8694444444444445,4.3341666666666665,110.175
113,3939216165,Afternoon Ride,Ride,Ride,Ride,False,,,"Thu, 8/20/2020",1597946293,2020-08-20T05:58:13+0000,Thu,35.38,35381.0,kilometers,km,1:09:48,4188,1:11:42,4302,False,https://d3o5xota0a1fcr.cloudfront.net/v6/maps/SUSX2SPFIN7PHXLBYZUHF3VNVLQ3OPP4RMI4YS24Q2RAPDFE5YJPWCJY7SWYTBHIUNDIU557O4TU4C4P6K3PE2WHGKNFBX3K,True,False,334,m,334.0,,https://www.strava.com/activities/3939216165,https://www.strava.com/activities/3939216165?utm_content=1464505&utm_medium=referral&utm_source=twitter,went for a 35.3 kilometer Ride.,True,False,,1034.0,,False,False,False,False,everyone,2020-08-20 17:58:13,1900-01-01 17:57:13-00:01,0.0004406782657226808,1.195,1.1633333333333333,35.381
114,3930131147,Afternoon Ride,Ride,Ride,Ride,False,,,"Tue, 8/18/2020",1597772704,2020-08-18T05:45:04+0000,Tue,22.12,22122.0,kilometers,km,18:00,1080,58:58,3538,False,https://d3o5xota0a1fcr.cloudfront.net/v6/maps/DVL4I4VB427BKEMTQOKFD42WUIKHE7EW4X4ULY5E4TN4REZS4II6AQPM6KVILX7QG2252SW5XTVQQWYCRG7ARJIXX4IS25YG,True,False,425,m,425.0,,https://www.strava.com/activities/3930131147,https://www.strava.com/activities/3930131147?utm_content=1464505&utm_medium=referral&utm_source=twitter,went for a 22.1 kilometer Ride.,True,False,,780.0,,False,False,False,False,everyone,2020-08-18 17:45:04,1900-01-01 17:44:04-00:01,0.00011364195964195206,0.9827777777777778,0.3,22.122
115,3919149423,Morning Ride,Ride,Ride,Ride,False,,,"Sun, 8/16/2020",1597575082,2020-08-15T22:51:22+0000,Sun,78.43,78434.0,kilometers,km,2:46:03,9963,3:06:05,11165,False,https://d3o5xota0a1fcr.cloudfront.net/v6/maps/K6JCOK7KRJIKEOAT2INXUFNKD5QPY57UG6FTTZOXLZ7KGIIGCHYOSPASTI4RMC5CBS7TSCJ6GBOSPVGJNMU5CUHBV6RD7L64,True,False,654,m,654.0,,https://www.strava.com/activities/3919149423,https://www.strava.com/activities/3919149423?utm_content=1464505&utm_medium=referral&utm_source=twitter,went for a 78.4 kilometer Ride.,True,False,,2150.0,,False,False,False,False,everyone,2020-08-16 10:51:22,1900-01-01 10:50:22-00:01,0.0010483470776970077,3.1013888888888888,2.7675,78.434
116,3914471412,Lunch Ride,Ride,Ride,Ride,False,,,"Sat, 8/15/2020",1597489492,2020-08-14T23:04:52+0000,Sat,107.31,107311.0,kilometers,km,4:08:42,14922,4:44:18,17058,False,https://d3o5xota0a1fcr.cloudfront.net/v6/maps/BYQ2BARZEGL3YKQWYTCI3VXAKIDSOA4QF7HWMM3Y6EPRKHCJWO33GXZ77GSLT3Z7PTOM4UYTYNDRETQOVRVHTJLJ5MZH2WBG,True,False,"1,635",m,1635.0,,https://www.strava.com/activities/3914471412,https://www.strava.com/activities/3914471412?utm_content=1464505&utm_medium=referral&utm_source=twitter,went for a 107.3 kilometer Ride.,True,False,,3803.0,,False,False,False,False,everyone,2020-08-15 11:04:52,1900-01-01 11:03:52-00:01,0.0015701530757196377,4.738333333333333,4.145,107.311
117,3905835757,Evening Ride,Ride,Ride,Ride,False,,,"Thu, 8/13/2020",1597342546,2020-08-13T06:15:46+0000,Thu,20.65,20653.0,kilometers,km,44:23,2663,47:37,2857,False,https://d3o5xota0a1fcr.cloudfront.net/v6/maps/JQLDPZ4CQYQ455YNYGESJIXGGIP6UOUU7HXBQQ6SFN2Z47LOWA3FARZHIFYJTXP7N2K7OSRXVFWIO27IXVQFSIXP5TOYBNK6,True,False,211,m,211.0,,https://www.strava.com/activities/3905835757,https://www.strava.com/activities/3905835757?utm_content=1464505&utm_medium=referral&utm_source=twitter,went for a 20.6 kilometer Ride.,True,False,,364.0,,False,False,False,False,everyone,2020-08-13 18:15:46,1900-01-01 18:14:46-00:01,0.00028021160974677623,0.7936111111111112,0.7397222222222222,20.653
118,3885612761,Afternoon Ride,Ride,Ride,Ride,False,,,"Sun, 8/9/2020",1596980022,2020-08-09T01:33:42+0000,Sun,43.74,43747.0,kilometers,km,1:36:55,5815,1:52:20,6740,False,https://d3o5xota0a1fcr.cloudfront.net/v6/maps/JMODHIP6U5KXQKDJ4KEQHLIERHADJYTOC2UZ6BSNHOR2NOKEMDUVXSCRGNCC4VKKWPVY7TDZGRMBUV4GGNTH47DBBXI7E736,True,False,379,m,379.0,,https://www.strava.com/activities/3885612761,https://www.strava.com/activities/3885612761?utm_content=1464505&utm_medium=referral&utm_source=twitter,went for a 43.7 kilometer Ride.,True,False,,1224.0,,False,False,False,False,everyone,2020-08-09 13:33:42,1900-01-01 13:32:42-00:01,0.0006118777734425475,1.8722222222222222,1.6152777777777778,43.747
119,3880656868,Afternoon Ride,Ride,Ride,Ride,False,,,"Sat, 8/8/2020",1596897070,2020-08-08T02:31:10+0000,Sat,40.66,40668.0,kilometers,km,1:17:29,4649,1:20:48,4848,False,https://d3o5xota0a1fcr.cloudfront.net/v6/maps/3CJPRCVZE5HCXKVRLN73LYU2Q5AKD6MEYAYROHGIO4Y5SBGXDRNZ7UVHR7VJCX6GDSNLKTOCVYEJMRLV6YA7TACMREK2MZSV,True,False,149,m,149.0,,https://www.strava.com/activities/3880656868,https://www.strava.com/activities/3880656868?utm_content=1464505&utm_medium=referral&utm_source=twitter,went for a 40.6 kilometer Ride.,True,False,,1248.0,,False,False,False,False,everyone,2020-08-08 14:31:10,1900-01-01 14:30:10-00:01,0.0004891865466439214,1.3466666666666667,1.291388888888889,40.668
120,3282202610,Lunch Ride,Ride,Ride,Ride,False,,,"Fri, 4/10/2020",1586520607,2020-04-10T00:10:07+0000,Fri,15.8,15806.0,kilometers,km,50:42,3042,1:28:07,5287,False,https://d3o5xota0a1fcr.cloudfront.net/v6/maps/TV4WMNGR3GCV46TCG43LPLU7GJZEUBEFKD4MQ3DE5SH6ARHGVNIYHQ6JKDZU6PRIJLWTCU3GLPPQVCLSVAIHREZYWKXFKSHZ,True,False,218,m,218.0,,https://www.strava.com/activities/3282202610,https://www.strava.com/activities/3282202610?utm_content=1464505&utm_medium=referral&utm_source=twitter,went for a 15.8 kilometer Ride.,True,False,,491.0,,False,False,False,False,everyone,2020-04-10 12:10:07,1900-01-01 12:09:07-00:01,0.00032009151965816496,1.468611111111111,0.845,15.806
121,3282200942,Evening Ride,Ride,Ride,Ride,False,,,"Thu, 4/9/2020",1586457755,2020-04-09T06:42:35+0000,Thu,0.2,200.0,kilometers,km,2:16,136,53:25,3205,False,https://d3o5xota0a1fcr.cloudfront.net/v6/maps/H53X6L6LC5U6VTK76MZI5DCJ3SMEBN27HMIMQSH2PAIGHD5S4FC4QKMSDWQCNUDY52GIFIYB644EVAL2JAMLCFUSU2ZCCS6K,True,False,4,m,4.0,,https://www.strava.com/activities/3282200942,https://www.strava.com/activities/3282200942?utm_content=1464505&utm_medium=referral&utm_source=twitter,went for a 0.2 kilometer Ride.,True,False,,695.0,,False,False,False,False,everyone,2020-04-09 18:42:35,1900-01-01 18:41:35-00:01,1.431046899194952e-05,0.8902777777777777,0.03777777777777778,0.2
122,3265229850,Afternoon Run,Run,Run,Run,False,,,"Tue, 4/7/2020",1586281651,2020-04-07T05:47:31+0000,Tue,16.3,16306.0,kilometers,km,1:16:47,4607,1:21:43,4903,False,https://d3o5xota0a1fcr.cloudfront.net/v6/maps/3H2SYSKN66OW5P723JZTXZQIPMUFVKY5TVRWW5WJV7KBLHJMSN7VUL3VIKA6NXHCNNJ52B6HWHODXJMKMKEP4JKTN3UKWS6H,True,False,108,m,108.0,,https://www.strava.com/activities/3265229850,https://www.strava.com/activities/3265229850?utm_content=1464505&utm_medium=referral&utm_source=twitter,went for a 16.3 kilometer Run.,True,False,,1350.0,,False,False,False,False,everyone,2020-04-07 17:47:31,1900-01-01 17:46:31-00:01,0.00048476713710228996,1.3619444444444444,1.2797222222222222,16.306
123,3256476209,Afternoon Ride,Ride,Ride,Ride,False,,,"Sun, 4/5/2020",1586097141,2020-04-05T02:32:21+0000,Sun,48.06,48061.0,kilometers,km,1:37:12,5832,1:40:02,6002,False,https://d3o5xota0a1fcr.cloudfront.net/v6/maps/NLHIEFVC5SANYVFN56DGDG4XW3CEJXW4UDSEHZKF4APPXRSW5ZL47JYSE6QEC2ELG3V2UVVVBDWXUW2VNYMUT455CLVNIQCW,True,False,615,m,615.0,,https://www.strava.com/activities/3256476209,https://www.strava.com/activities/3256476209?utm_content=1464505&utm_medium=referral&utm_source=twitter,went for a 48.0 kilometer Ride.,True,False,,1258.0,,False,False,False,False,everyone,2020-04-05 14:32:21,1900-01-01 14:31:21-00:01,0.0006136665820665411,1.6672222222222222,1.62,48.061
124,3248777472,Evening Run,Run,Run,Run,False,,,"Fri, 4/3/2020",1585939926,2020-04-03T05:52:06+0000,Fri,9.99,9997.0,kilometers,km,47:58,2878,50:43,3043,False,https://d3o5xota0a1fcr.cloudfront.net/v6/maps/NAXOC65WP6KSH6HRDAUAIFCCGCZPGI73DBQDMICQQQAZKN6S46K2H4LKAFX2TO2JUKNQVRJFQYPARO7XDOSTRHKE2W65XOK6,True,False,97,m,97.0,,https://www.strava.com/activities/3248777472,https://www.strava.com/activities/3248777472?utm_content=1464505&utm_medium=referral&utm_source=twitter,went for a 9.9 kilometer Run.,True,False,,851.0,,False,False,False,False,everyone,2020-04-03 18:52:06,1900-01-01 18:51:06-00:01,0.00030283477763846115,0.8452777777777778,0.7994444444444444,9.997
125,3241001595,Afternoon Ride,Ride,Ride,Ride,False,,,"Wed, 4/1/2020",1585763776,2020-04-01T04:56:16+0000,Wed,19.69,19689.0,kilometers,km,1:03:53,3833,1:11:20,4280,False,https://d3o5xota0a1fcr.cloudfront.net/v6/maps/XUJI5MJMRFEFAGY4TPQVJMGJ7SN34UMXTCCZRY5Q5ZR5WP3MXKRJ5332OJW3HYXQN6XCU7BI5ENC4JVLMJETYM4UGF565ZK7,True,False,326,m,326.0,,https://www.strava.com/activities/3241001595,https://www.strava.com/activities/3241001595?utm_content=1464505&utm_medium=referral&utm_source=twitter,went for a 19.6 kilometer Ride.,True,False,,887.0,,False,False,False,False,everyone,2020-04-01 17:56:16,1900-01-01 17:55:16-00:01,0.0004033237326922243,1.1888888888888889,1.0647222222222221,19.689
126,3237139064,Evening Run,Run,Run,Run,False,,,"Tue, 3/31/2020",1585679785,2020-03-31T05:36:25+0000,Tue,14.37,14369.0,kilometers,km,1:07:15,4035,1:14:14,4454,False,https://d3o5xota0a1fcr.cloudfront.net/v6/maps/L2FZACIUPGJO3NXA2F4BMLZIPDFJTNJRCMGQNIRM46VNBTMSCX4XSSQBMTR2VNRU3RXDFVZECKJE7HC4DAEQWUEVSIV5JA5Y,True,False,109,m,109.0,,https://www.strava.com/activities/3237139064,https://www.strava.com/activities/3237139064?utm_content=1464505&utm_medium=referral&utm_source=twitter,went for a 14.3 kilometer Run.,True,False,,1166.0,,False,False,False,False,everyone,2020-03-31 18:36:25,1900-01-01 18:35:25-00:01,0.0004245789881067376,1.2372222222222222,1.1208333333333333,14.369
127,3233690308,Afternoon Ride,Ride,Ride,Ride,False,,,"Mon, 3/30/2020",1585589419,2020-03-30T04:30:19+0000,Mon,23.91,23913.0,kilometers,km,1:01:57,3717,1:11:48,4308,False,https://d3o5xota0a1fcr.cloudfront.net/v6/maps/MPOZEYBKG22TMFETNE6RTYIHT2FX7LMAUCGBKEKVBNUEPZDQ2CMJNEXVFGM4I4KESBS65P6I64THZY6I3XGMTMGY7FDH6QSV,True,False,285,m,285.0,,https://www.strava.com/activities/3233690308,https://www.strava.com/activities/3233690308?utm_content=1464505&utm_medium=referral&utm_source=twitter,went for a 23.9 kilometer Ride.,True,False,,804.0,,False,False,False,False,everyone,2020-03-30 17:30:19,1900-01-01 17:29:19-00:01,0.00039111774443438503,1.1966666666666668,1.0325,23.913
128,3229585875,Lunch Run,Run,Run,Run,False,,,"Sun, 3/29/2020",1585483598,2020-03-28T23:06:38+0000,Sun,11.06,11063.0,kilometers,km,55:00,3300,59:54,3594,False,https://d3o5xota0a1fcr.cloudfront.net/v6/maps/JM53LYYQUBWDKAQRJQ5MXNQGCMSZ4CLB5M3E2SCWHSUAFVVDHGFIRCUCAILKL4EP7NJAHW5Z4CIWMKNNZMH6CY2TVMPAN7QA,True,False,223,m,223.0,,https://www.strava.com/activities/3229585875,https://www.strava.com/activities/3229585875?utm_content=1464505&utm_medium=referral&utm_source=twitter,went for a 11.0 kilometer Run.,True,False,,1048.0,,False,False,False,False,everyone,2020-03-29 12:06:38,1900-01-01 12:05:38-00:01,0.00034723932112818687,0.9983333333333333,0.9166666666666666,11.063
129,3229193303,Morning Ride,Ride,Ride,Ride,False,,,"Sat, 3/28/2020",1585391786,2020-03-27T21:36:26+0000,Sat,30.59,30593.0,kilometers,km,1:00:05,3605,1:02:44,3764,False,https://d3o5xota0a1fcr.cloudfront.net/v6/maps/DOW2T2M4FCXQJ6Z2HVOLDTENZXQLPRVN6JQESFI5U2VXXE77AHPMKXJQW6Y3GJ245RQVQV55G6NXUV52VGFIEKG46LHBDLJI,True,False,407,m,407.0,,https://www.strava.com/activities/3229193303,https://www.strava.com/activities/3229193303?utm_content=1464505&utm_medium=referral&utm_source=twitter,went for a 30.5 kilometer Ride.,True,False,,906.0,,False,False,False,False,everyone,2020-03-28 10:36:26,1900-01-01 10:35:26-00:01,0.00037933265232336776,1.0455555555555556,1.0013888888888889,30.593
130,3229190808,Afternoon Run,Run,Run,Run,False,,,"Sat, 3/21/2020",1584799815,2020-03-21T01:10:15+0000,Sat,4.87,4874.0,kilometers,km,24:19,1459,24:46,1486,False,https://d3o5xota0a1fcr.cloudfront.net/v6/maps/SN5PESO6AWDJJ3LP56SJ6PUU52DEYJAQ3I3NMJMAY5RWPN7CGLGEBOL6Z2M3OZ7MMCBC2VXGOSVVK2IKKOJX6WCD2N6XVTXU,True,False,61,m,61.0,,https://www.strava.com/activities/3229190808,https://www.strava.com/activities/3229190808?utm_content=1464505&utm_medium=referral&utm_source=twitter,went for a 4.8 kilometer Run.,True,False,,410.0,,False,False,False,False,everyone,2020-03-21 14:10:15,1900-01-01 14:09:15-00:01,0.0001535218695533408,0.4127777777777778,0.4052777777777778,4.874
131,3184121579,Morning Ride,Ride,Ride,Ride,False,,,"Sun, 3/15/2020",1584268874,2020-03-14T21:41:14+0000,Sun,37.1,37101.0,kilometers,km,3:11:45,11505,4:03:49,14629,False,https://d3o5xota0a1fcr.cloudfront.net/v6/maps/IEQTMZ7BEVCLZR4AZCS5XQEYRDHWHWVBIXOWEBWPGN2N5YGDFHPW2Q6RQH6FEOG27I6DIXPSQZTMATDI4YRKJQJYLSRA5CCK,True,False,"1,449",m,1449.0,,https://www.strava.com/activities/3184121579,https://www.strava.com/activities/3184121579?utm_content=1464505&utm_medium=referral&utm_source=twitter,went for a 37.1 kilometer Ride.,True,False,,2411.0,,False,False,False,False,everyone,2020-03-15 10:41:14,1900-01-01 10:40:14-00:01,0.001210602542296906,4.063611111111111,3.1958333333333333,37.101
132,3181163315,Lunch Ride,Ride,Ride,Ride,False,,,"Sat, 3/14/2020",1584189399,2020-03-13T23:36:39+0000,Sat,36.55,36550.0,kilometers,km,3:13:17,11597,4:42:07,16927,False,https://d3o5xota0a1fcr.cloudfront.net/v6/maps/2RGNMHIFYZQUV5GKQFCC2I6WLG2JHZY2TK4NKUNCGTM4WVERVJCQFPTUGT6PTZEGJVO4T4UV3JBZ6S5ZGZWQ4VNASMFT64JN,True,False,"1,137",m,1137.0,,https://www.strava.com/activities/3181163315,https://www.strava.com/activities/3181163315?utm_content=1464505&utm_medium=referral&utm_source=twitter,went for a 36.5 kilometer Ride.,True,False,,2426.0,,False,False,False,False,everyone,2020-03-14 12:36:39,1900-01-01 12:35:39-00:01,0.001220283153673813,4.701944444444444,3.221388888888889,36.55
133,3178783057,Afternoon Ride,Ride,Ride,Ride,False,,,"Fri, 3/13/2020",1584121838,2020-03-13T04:50:38+0000,Fri,16.01,16015.2,kilometers,km,32:55,1975,34:49,2089,False,https://d3o5xota0a1fcr.cloudfront.net/v6/maps/RB4WUCYS3I4Z7A7W7NN3BPHYM2XSIITUW2HWUQA4YI3SOVL72HOBLHT54EPRJOZKGOUM2JPSHGCQIQJHFIP6NOBLAHYD24EZ,True,False,130,m,130.448,,https://www.strava.com/activities/3178783057,https://www.strava.com/activities/3178783057?utm_content=1464505&utm_medium=referral&utm_source=twitter,went for a 16.0 kilometer Ride.,False,False,,415.9241638183594,10,False,False,False,False,everyone,2020-03-13 17:50:38,1900-01-01 17:49:38-00:01,0.00020781747249338457,0.5802777777777778,0.5486111111111112,16.0152
134,3178893029,Morning Ride,Ride,Ride,Ride,False,,,"Fri, 3/13/2020",1584087697,2020-03-12T19:21:37+0000,Fri,15.02,15020.0,kilometers,km,29:52,1792,31:50,1910,False,https://d3o5xota0a1fcr.cloudfront.net/v6/maps/43I45SOZJ2RDYK5W3TNDEMZZJFWCLCIP2PUQJRAUHPKOXLNAKDXYRRFXSQOXTQWOSSDNH3RRA3GLYJ6PIURX2IU7A2QSVGYW,True,False,107,m,107.0,,https://www.strava.com/activities/3178893029,https://www.strava.com/activities/3178893029?utm_content=1464505&utm_medium=referral&utm_source=twitter,went for a 15.0 kilometer Ride.,True,False,,202.0,,False,False,False,False,everyone,2020-03-13 08:21:37,1900-01-01 08:20:37-00:01,0.000188561473776276,0.5305555555555556,0.49777777777777776,15.02
135,3176209235,Evening Run,Run,Run,Run,False,,,"Thu, 3/12/2020",1584040666,2020-03-12T06:17:46+0000,Thu,2.97,2974.0,kilometers,km,20:19,1219,21:01,1261,False,https://d3o5xota0a1fcr.cloudfront.net/v6/maps/QNXYC5YOTS7FFMLG6HAKQ7BS3Y7TH2HJPVMTWDZAAUPJCUHOPVP7TZK5PF2NIULMQGIKNFLYUMDVVLZR5F3NSH6JNH3M7XEY,True,False,155,m,155.0,,https://www.strava.com/activities/3176209235,https://www.strava.com/activities/3176209235?utm_content=1464505&utm_medium=referral&utm_source=twitter,went for a 2.9 kilometer Run.,True,False,,365.0,,False,False,False,False,everyone,2020-03-12 19:17:46,1900-01-01 19:16:46-00:01,0.00012826810074401812,0.3502777777777778,0.3386111111111111,2.974
136,3176208482,Night Activity,WeightTraining,Weight Training,Workout,False,,,"Sun, 3/8/2020",1583709273,2020-03-09T06:14:33+0000,Sun,0.0,0.0,kilometers,km,1:40:32,6032,1:40:32,6032,True,,False,False,0,m,0.0,,https://www.strava.com/activities/3176208482,https://www.strava.com/activities/3176208482?utm_content=1464505&utm_medium=referral&utm_source=twitter,went for a 0 kilometer Weight Training.,True,False,,688.0,30,False,False,False,False,everyone,2020-03-08 23:14:33,1900-01-01 23:13:33-00:01,0.0006347113894076434,1.6755555555555555,1.6755555555555555,0.0
137,3163385904,Morning Run,Run,Run,Run,False,,,"Sun, 3/8/2020",1583659806,2020-03-07T20:30:06+0000,Sun,8.4,8401.0,kilometers,km,34:46,2086,34:46,2086,False,https://d3o5xota0a1fcr.cloudfront.net/v6/maps/ISJSVJXGQVVJWN6LR7Y4ZCEJAVANFGUOMZ6KANBZSG5AQZQXNREH75OVTXX7KX3PHMDE6UPL3BJO2S3GTHZMJWAIKBNMQ4NW,True,False,12,m,12.0,,https://www.strava.com/activities/3163385904,https://www.strava.com/activities/3163385904?utm_content=1464505&utm_medium=referral&utm_source=twitter,went for a 8.4 kilometer Run.,True,False,,719.0,,False,False,False,False,everyone,2020-03-08 09:30:06,1900-01-01 09:29:06-00:01,0.0002194973405676963,0.5794444444444444,0.5794444444444444,8.401
138,3160455897,Afternoon Ride,Ride,Ride,Ride,False,,,"Sat, 3/7/2020",1583586320,2020-03-07T00:05:20+0000,Sat,35.2,35208.0,kilometers,km,1:17:46,4666,1:22:50,4970,False,https://d3o5xota0a1fcr.cloudfront.net/v6/maps/JDIBXID5YLQBXL34JAM7G3SCIHBWUYSNIZXKR42PQFENXQGJTEHRIRPNEZ727ALBS4RFRONDNKWMIFFMQ76DCQ4KJUUM6GUW,True,False,344,m,344.0,,https://www.strava.com/activities/3160455897,https://www.strava.com/activities/3160455897?utm_content=1464505&utm_medium=referral&utm_source=twitter,went for a 35.2 kilometer Ride.,True,False,,808.0,,False,False,False,False,everyone,2020-03-07 13:05:20,1900-01-01 13:04:20-00:01,0.0004909753552679152,1.3805555555555555,1.2961111111111112,35.208
139,3158313525,Evening Run,Run,Run,Run,False,,,"Fri, 3/6/2020",1583524740,2020-03-06T06:59:00+0000,Fri,4.53,4530.0,kilometers,km,23:00,1380,23:41,1421,False,https://d3o5xota0a1fcr.cloudfront.net/v6/maps/YZHWEOZJQOO2XCAM323RMXWPM5NNTOFQGVNDVWPULL4NCDEKDYGN6QFFO4LMLFBHZFATJV6QL7QSVBGH2FYAXIGIAXHFFNPV,True,False,63,m,63.0,,https://www.strava.com/activities/3158313525,https://www.strava.com/activities/3158313525?utm_content=1464505&utm_medium=referral&utm_source=twitter,went for a 4.5 kilometer Run.,True,False,,382.0,,False,False,False,False,everyone,2020-03-06 19:59:00,1900-01-01 19:58:00-00:01,0.0001452091706536054,0.3947222222222222,0.38333333333333336,4.53
140,2771741523,Afternoon Ride,Ride,Ride,Ride,False,,,"Sun, 10/6/2019",1570368875,2019-10-06T00:34:35+0000,Sun,15.33,15332.0,kilometers,km,40:29,2429,47:47,2867,False,https://d3o5xota0a1fcr.cloudfront.net/v6/maps/ACHQWK5PBHVAAKQBO2OTF3ZQJNW2DZXYTDEN3HT3RRZOIHDU6M5VMPZRSH6OPY6POYXJ4OJEVPUDHQMQ3VDSBZJZWZT3IADR,True,False,188,m,188.0,,https://www.strava.com/activities/2771741523,https://www.strava.com/activities/2771741523?utm_content=1464505&utm_medium=referral&utm_source=twitter,went for a 15.3 kilometer Ride.,True,False,,320.0,,False,False,False,False,everyone,2019-10-06 13:34:35,1900-01-01 13:33:35-00:01,0.0002555891851576866,0.7963888888888889,0.6747222222222222,15.332
141,2763348869,Lunch Ride,Ride,Ride,Ride,False,,,"Sat, 10/5/2019",1570275040,2019-10-04T22:30:40+0000,Sat,89.22,89220.0,kilometers,km,3:05:15,11115,3:52:17,13937,False,https://d3o5xota0a1fcr.cloudfront.net/v6/maps/4Y56RF6HWF7D67BRAB4WZGIZQKEDHKY6SNRFNWPIKKLKYQOGAINH24QQDNL3B7DIBVETI3HENWVJE45BDKYKJY7J4ZSIXBS3,True,False,738,m,738.0,,https://www.strava.com/activities/2763348869,https://www.strava.com/activities/2763348869?utm_content=1464505&utm_medium=referral&utm_source=twitter,went for a 89.2 kilometer Ride.,True,False,,2594.0,,False,False,False,False,everyone,2019-10-05 11:30:40,1900-01-01 11:29:40-00:01,0.0011695651679817568,3.8713888888888888,3.0875,89.22
142,2761568600,Evening Ride,Ride,Ride,Ride,False,,,"Fri, 10/4/2019",1570221307,2019-10-04T07:35:07+0000,Fri,15.54,15548.0,kilometers,km,29:34,1774,30:07,1807,False,https://d3o5xota0a1fcr.cloudfront.net/v6/maps/ULBPNJWXSGWPZ2BDMNOOVDOTMBF5GLCLH3YYZGZ2JY67E3YVIUMW53UDLDZPU4YCAKHLNPM4222VRPICDPTOIJTFVS2XL3U5,True,False,124,m,124.0,,https://www.strava.com/activities/2761568600,https://www.strava.com/activities/2761568600?utm_content=1464505&utm_medium=referral&utm_source=twitter,went for a 15.5 kilometer Ride.,True,False,,279.0,,False,False,False,False,everyone,2019-10-04 20:35:07,1900-01-01 20:34:07-00:01,0.00018666744111557683,0.5019444444444444,0.49277777777777776,15.548
143,2761386064,Morning Ride,Ride,Ride,Ride,False,,,"Fri, 10/4/2019",1570176232,2019-10-03T19:03:52+0000,Fri,23.75,23749.0,kilometers,km,49:09,2949,54:46,3286,False,https://d3o5xota0a1fcr.cloudfront.net/v6/maps/R22HLZZRZDSF7Q7OCFVVDTQTBUCWYAD3JB4XTJCPV2PQT36MSXWJJMNG433444ZTHUGJIGMM5S4ZF4K64YY3JOGAXINPDLSB,True,False,235,m,235.0,,https://www.strava.com/activities/2761386064,https://www.strava.com/activities/2761386064?utm_content=1464505&utm_medium=referral&utm_source=twitter,went for a 23.7 kilometer Ride.,True,False,,695.0,,False,False,False,False,everyone,2019-10-04 08:03:52,1900-01-01 08:02:52-00:01,0.00031030568424455243,0.9127777777777778,0.8191666666666667,23.749
144,2758944461,Night Activity,WeightTraining,Weight Training,Workout,False,,,"Wed, 10/2/2019",1570056236,2019-10-03T05:43:56+0000,Wed,0.0,0.0,kilometers,km,1:01:57,3717,1:01:57,3717,True,,False,False,0,m,0.0,,https://www.strava.com/activities/2758944461,https://www.strava.com/activities/2758944461?utm_content=1464505&utm_medium=referral&utm_source=twitter,went for a 0 kilometer Weight Training.,True,False,,669.0,30,False,False,False,False,everyone,2019-10-02 22:43:56,1900-01-01 22:42:56-00:01,0.00039111774443438503,1.0325,1.0325,0.0
145,2753568772,Afternoon Ride,Ride,Ride,Ride,False,,,"Tue, 10/1/2019",1569950408,2019-10-01T04:20:08+0000,Tue,16.18,16184.0,kilometers,km,1:03:47,3827,1:19:55,4795,False,https://d3o5xota0a1fcr.cloudfront.net/v6/maps/W7BDQFWBBPCOSDQQQAY736JZNL3BTKMYGGKNGP235XEEMJ6FQDSOMHXO27IB2OEPS3EWXSU4OSBW7IPZCYILDOFGMHIWIZX4,True,False,395,m,395.0,,https://www.strava.com/activities/2753568772,https://www.strava.com/activities/2753568772?utm_content=1464505&utm_medium=referral&utm_source=twitter,went for a 16.1 kilometer Ride.,True,False,,471.0,,False,False,False,False,everyone,2019-10-01 17:20:08,1900-01-01 17:19:08-00:01,0.00040269238847199124,1.3319444444444444,1.0630555555555556,16.184
146,2747970570,Ooo Wee,Ride,Ride,Ride,False,,,"Sun, 9/29/2019",1569755717,2019-09-28T22:15:17+0000,Sun,74.2,74208.0,kilometers,km,12:09,729,4:05:14,14714,False,https://d3o5xota0a1fcr.cloudfront.net/v6/maps/Q5G5OQTVD33PBLML4YBCHSFZTKQ4ANV75ZP4DY2MHYAVZAGFZIYUJAMCJBLPIZUS2VNPYQF4Q76FTUTHIE2PPJMMQNCP6VEB,True,False,"1,430",m,1430.0,,https://www.strava.com/activities/2747970570,https://www.strava.com/activities/2747970570?utm_content=1464505&utm_medium=referral&utm_source=twitter,went for a 74.2 kilometer Ride.,True,False,,2423.0,10,False,False,False,False,everyone,2019-09-29 11:15:17,1900-01-01 11:14:17-00:01,7.670832275831764e-05,4.0872222222222225,0.2025,74.208
147,2747624156,Lunch Ride,Ride,Ride,Ride,False,,,"Sat, 9/28/2019",1569669586,2019-09-27T23:19:46+0000,Sat,29.55,29558.0,kilometers,km,10:44,644,2:06:20,7580,False,https://d3o5xota0a1fcr.cloudfront.net/v6/maps/6DZ6QGITXK5DYT2PQYOFC6GDLWQEWLBENAP4UFKJVPDCOZ2XLLCQTSFYL2IXNYS4A7YPYYGZIYJ22SQUZIL2OXQ4MQIFGKNZ,True,False,504,m,504.0,,https://www.strava.com/activities/2747624156,https://www.strava.com/activities/2747624156?utm_content=1464505&utm_medium=referral&utm_source=twitter,went for a 29.5 kilometer Ride.,True,False,,561.0,,False,False,False,False,everyone,2019-09-28 11:19:46,1900-01-01 11:18:46-00:01,6.776427963834919e-05,2.1055555555555556,0.17888888888888888,29.558
148,2740995383,Afternoon Ride,Ride,Ride,Ride,False,,,"Thu, 9/26/2019",1569514972,2019-09-26T04:22:52+0000,Thu,20.44,20447.0,kilometers,km,1:43:02,6182,1:57:39,7059,False,https://d3o5xota0a1fcr.cloudfront.net/v6/maps/I2O2JUS2Y35NJYUJVRXM5GSPG3455CVECPG6QO6L45Z3HGHWSQJKNNTO3IY4GNSGAQXAZ7FXOSVI33YRXBSDJZIOEOYNZ32E,True,False,832,m,832.0,,https://www.strava.com/activities/2740995383,https://www.strava.com/activities/2740995383?utm_content=1464505&utm_medium=referral&utm_source=twitter,went for a 20.4 kilometer Ride.,True,False,,1090.0,,False,False,False,False,everyone,2019-09-26 16:22:52,1900-01-01 16:21:52-00:01,0.00065049499491347,1.9608333333333334,1.7172222222222222,20.447
150,2735216145,Evening Ride,Ride,Ride,Ride,False,,,"Tue, 9/24/2019",1569348559,2019-09-24T06:09:19+0000,Tue,17.23,17233.0,kilometers,km,37:44,2264,41:32,2492,False,https://d3o5xota0a1fcr.cloudfront.net/v6/maps/Y4W3S6GWXVNOGODOY5VVOKBA5QQQYUG4INWAY3S3OCW4UHTV53SMZG2QRQURFW4XH6KHEWFBES5K2MW4XU3Y5HTQ7PM57B24,True,False,159,m,159.0,,https://www.strava.com/activities/2735216145,https://www.strava.com/activities/2735216145?utm_content=1464505&utm_medium=referral&utm_source=twitter,went for a 17.2 kilometer Ride.,True,False,,259.0,,False,False,False,False,everyone,2019-09-24 18:09:19,1900-01-01 18:08:19-00:01,0.0002382272191012773,0.6922222222222222,0.6288888888888889,17.233
151,2729210584,Sweet As,Ride,Ride,Ride,False,,,"Sun, 9/22/2019",1569149206,2019-09-21T22:46:46+0000,Sun,21.57,21577.0,kilometers,km,1:30:29,5429,1:41:50,6110,False,https://d3o5xota0a1fcr.cloudfront.net/v6/maps/LKGS563CZLWX7CASFHGKZICXF3N4I32DG3E7T6WDS4ZFHXBTBW5BKINKWVWYEDM7L2BRRHCTCLZ2DDXWR46U72FP2YHIRPRL,True,False,580,m,580.0,,https://www.strava.com/activities/2729210584,https://www.strava.com/activities/2729210584?utm_content=1464505&utm_medium=referral&utm_source=twitter,went for a 21.5 kilometer Ride.,True,False,,1300.0,10,False,False,False,False,everyone,2019-09-22 10:46:46,1900-01-01 10:45:46-00:01,0.0005712612952742201,1.6972222222222222,1.5080555555555555,21.577
152,2725975879,Morning Ride,Ride,Ride,Ride,False,,,"Sat, 9/21/2019",1569050369,2019-09-20T19:19:29+0000,Sat,54.61,54617.0,kilometers,km,1:58:59,7139,2:23:38,8618,False,https://d3o5xota0a1fcr.cloudfront.net/v6/maps/2FHVIJ6AJ73YT3HUM6OA4VY3CSXKP2MZA26AQYEEZVXYRUJA2TBXCP5EDDA3LACPGCJ346K7ZW3FFAMOJI6HHPM4VMLKSQ26,True,False,383,m,383.0,,https://www.strava.com/activities/2725975879,https://www.strava.com/activities/2725975879?utm_content=1464505&utm_medium=referral&utm_source=twitter,went for a 54.6 kilometer Ride.,True,False,,1381.0,,False,False,False,False,everyone,2019-09-21 07:19:29,1900-01-01 07:18:29-00:01,0.0007511943980406442,2.3938888888888887,1.9830555555555556,54.617
153,2728951118,Night Activity,WeightTraining,Weight Training,Workout,False,,,"Thu, 9/19/2019",1568860385,2019-09-19T09:33:05+0000,Thu,0.0,0.0,kilometers,km,1:16:15,4575,1:16:15,4575,True,,False,False,0,m,0.0,,https://www.strava.com/activities/2728951118,https://www.strava.com/activities/2728951118?utm_content=1464505&utm_medium=referral&utm_source=twitter,went for a 0 kilometer Weight Training.,True,False,,748.0,30,False,False,False,False,everyone,2019-09-19 02:33:05,1900-01-01 02:32:05-00:01,0.0004813999679277136,1.2708333333333333,1.2708333333333333,0.0
