id,name,type,display_type,activity_type_display_name,private,bike_id,athlete_gear_id,start_date,start_date_local_raw,start_time,start_day,distance,distance_raw,distance_raw_km,long_unit,short_unit,moving_time,moving_time_raw,elapsed_time,elapsed_time_raw,trainer,static_map,has_latlng,commute,elevation_gain,elevation_unit,elevation_gain_raw,description,activity_url,activity_url_for_twitter,twitter_msg,is_new,is_changing_type,suffer_score,calories,workout_type,flagged,hide_power,hide_heartrate,leaderboard_opt_out,visibility
4747286929,Morning Activity,AlpineSki,Alpine Ski,Alpine Ski,FALSE,,,"Sat, 2/6/2021",1612605178,2021-02-06T16:52:58+0000,Sat,17.23,17238,17.238,kilometers,km,3:17:12,11832,5:46:28,20788,FALSE,https://d3o5xota0a1fcr.cloudfront.net/v6/maps/Q3A4ZMSNSVGCKLIY54VSRUGS6X5ST6V6M6DL3NR5YOXVW7O6E7KB56EQTCRISIIWYLY5ALNYT4GFNML6IIYAVUDXKRA2QFAE,TRUE,FALSE,"1,220",m,1220,,https://www.strava.com/activities/4747286929,https://www.strava.com/activities/4747286929?utm_content=1464505&utm_medium=referral&utm_source=twitter,went for a 17.2 kilometer Alpine Ski.,TRUE,FALSE,,3342,,FALSE,FALSE,FALSE,FALSE,everyone
4713874507,Lunch Activity,NordicSki,Nordic Ski,Nordic Ski,FALSE,,,"Sun, 1/31/2021",1612095043,2021-01-31T19:10:43+0000,Sun,14.47,14469,14.469,kilometers,km,55:28:00,3328,59:15:00,3555,FALSE,https://d3o5xota0a1fcr.cloudfront.net/v6/maps/YSBSVFNMT4IA4XVG3WMDCFV24UBBXPBQGIJJZMLTZDAN2SLIHD4SBNB3G4YFD4TJWENLGGMHUYNOY5XV6J6TH7Y6DOCLMIIA,TRUE,FALSE,179,m,179,,https://www.strava.com/activities/4713874507,https://www.strava.com/activities/4713874507?utm_content=1464505&utm_medium=referral&utm_source=twitter,went for a 14.4 kilometer Nordic Ski.,TRUE,FALSE,,784,,FALSE,FALSE,FALSE,FALSE,everyone
4701021399,Morning Run,Run,Run,Run,FALSE,,,"Fri, 1/29/2021",1611914545,2021-01-29T17:02:25+0000,Fri,10.15,10154,10.154,kilometers,km,50:18:00,3018,53:41:00,3221,FALSE,https://d3o5xota0a1fcr.cloudfront.net/v6/maps/SMJ6SYZOCUVDD22OKKI2N2YNEGSDZUKKN4SJG4ATEM3LMS4Z4JHKASOJ7L6LJYGPUJKCXGYFIX7AXHDSWX64NOW45IKTPOHT,TRUE,FALSE,69,m,69,,https://www.strava.com/activities/4701021399,https://www.strava.com/activities/4701021399?utm_content=1464505&utm_medium=referral&utm_source=twitter,went for a 10.1 kilometer Run.,TRUE,FALSE,,791,,FALSE,FALSE,FALSE,FALSE,everyone
4701018710,Morning Run,Run,Run,Run,FALSE,,,"Thu, 1/28/2021",1611828259,2021-01-28T17:04:19+0000,Thu,7.88,7879,7.879,kilometers,km,37:33:00,2253,44:54:00,2694,FALSE,https://d3o5xota0a1fcr.cloudfront.net/v6/maps/OTKPMVF65FTLBEUBY2DD2BWLVY7RV3DD6WZFRBCCJOKYJFK7HONZ7M3D2D6HI532RROL6P5FKSE23SXUKKIEBOQZWIG47ZJG,TRUE,FALSE,19,m,19,,https://www.strava.com/activities/4701018710,https://www.strava.com/activities/4701018710?utm_content=1464505&utm_medium=referral&utm_source=twitter,went for a 7.8 kilometer Run.,TRUE,FALSE,,782,,FALSE,FALSE,FALSE,FALSE,everyone
4685704460,Morning Run,Run,Run,Run,FALSE,,,"Tue, 1/26/2021",1611656560,2021-01-26T17:22:40+0000,Tue,10.02,10024,10.024,kilometers,km,48:17:00,2897,51:38:00,3098,FALSE,https://d3o5xota0a1fcr.cloudfront.net/v6/maps/FAAZXVMAOA3PEBFJ4MBHVFPG327US4EF2UHXZ7BFSCP7K56KUDZLPWNQPPHH3P3U52LBRI4X6AZWGKDRN7UWX5LXXIPWQ22L,TRUE,FALSE,54,m,54,,https://www.strava.com/activities/4685704460,https://www.strava.com/activities/4685704460?utm_content=1464505&utm_medium=referral&utm_source=twitter,went for a 10.0 kilometer Run.,TRUE,FALSE,,943,,FALSE,FALSE,FALSE,FALSE,everyone
4676079794,Lunch Run,Run,Run,Run,FALSE,,,"Sun, 1/24/2021",1611486966,2021-01-24T18:16:06+0000,Sun,9.94,9948,9.948,kilometers,km,54:00:00,3240,57:36:00,3456,FALSE,https://d3o5xota0a1fcr.cloudfront.net/v6/maps/Q4BKS6ZQBPVEIZXOF4LNLGE2OD7HD3GXZZ2IH5RSPMJBR5QN5YKFWPA7E6LUG5IHBE3L4WTKGZKWE2EA42FMARY3OBO3WCTS,TRUE,FALSE,220,m,220,,https://www.strava.com/activities/4676079794,https://www.strava.com/activities/4676079794?utm_content=1464505&utm_medium=referral&utm_source=twitter,went for a 9.9 kilometer Run.,TRUE,FALSE,,1018,,FALSE,FALSE,FALSE,FALSE,everyone
4676077663,Morning Activity,AlpineSki,Alpine Ski,Alpine Ski,FALSE,,,"Fri, 1/22/2021",1611309362,2021-01-22T16:56:02+0000,Fri,46.76,46761,46.761,kilometers,km,2:48:40,10120,5:05:29,18329,FALSE,https://d3o5xota0a1fcr.cloudfront.net/v6/maps/WJ44XZWQY3NOTATKYRS6MQQW5NLFYLIF56X5BWUNLZN2CWDLJVSHTUZ2GSECRD7CNNFH2AFGVYNIDMPKXYGCJKVK4YJF6KYK,TRUE,FALSE,"4,287",m,4287.42,,https://www.strava.com/activities/4676077663,https://www.strava.com/activities/4676077663?utm_content=1464505&utm_medium=referral&utm_source=twitter,went for a 46.7 kilometer Alpine Ski.,TRUE,FALSE,,1208,,FALSE,FALSE,FALSE,FALSE,everyone
4648027998,Morning Run,Run,Run,Run,FALSE,,,"Tue, 1/19/2021",1611050513,2021-01-19T17:01:53+0000,Tue,5.5,5505,5.505,kilometers,km,25:41:00,1541,27:59:00,1679,FALSE,https://d3o5xota0a1fcr.cloudfront.net/v6/maps/NN657R3PWT64FDFTGVBQKEPLY4JHNQGMY7ARQJ5JXFWLN3LPOTG57JUI4I43VT3BMPEIAYZH464ZG2YYRYT4CR67NMJZLQAE,TRUE,FALSE,34,m,34,,https://www.strava.com/activities/4648027998,https://www.strava.com/activities/4648027998?utm_content=1464505&utm_medium=referral&utm_source=twitter,went for a 5.5 kilometer Run.,TRUE,FALSE,,563,,FALSE,FALSE,FALSE,FALSE,everyone
4638182806,Lunch Run,Run,Run,Run,FALSE,,,"Sun, 1/17/2021",1610882873,2021-01-17T18:27:53+0000,Sun,8.49,8497,8.497,kilometers,km,44:40:00,2680,45:10:00,2710,FALSE,https://d3o5xota0a1fcr.cloudfront.net/v6/maps/UMJUVXDNVCTKFIVN6QBEH35RI374E7VOLDTL57S5KXZXNJXCNB4RNSEBYZ4A5QEIZJ7GWEESF6UDAVYVRLESUBZ2AV7ZYOVK,TRUE,FALSE,47,m,47,,https://www.strava.com/activities/4638182806,https://www.strava.com/activities/4638182806?utm_content=1464505&utm_medium=referral&utm_source=twitter,went for a 8.4 kilometer Run.,TRUE,FALSE,,728,,FALSE,FALSE,FALSE,FALSE,everyone
4638181474,Morning Run,Run,Run,Run,FALSE,,,"Thu, 1/14/2021",1610621025,2021-01-14T17:43:45+0000,Thu,2.51,2517,2.517,kilometers,km,12:27,747,18:00,1080,FALSE,https://d3o5xota0a1fcr.cloudfront.net/v6/maps/TBJV4WUP5OIELMDSAV6K55T3IJOMNQ6GI7GBNRF5OOSXBTJ4ZTJA2T4CUXQAFYU5AKOYFCPXDZBA7FBGQACVQXPWTS5Z4WHY,TRUE,FALSE,16,m,16,,https://www.strava.com/activities/4638181474,https://www.strava.com/activities/4638181474?utm_content=1464505&utm_medium=referral&utm_source=twitter,went for a 2.5 kilometer Run.,TRUE,FALSE,,126,,FALSE,FALSE,FALSE,FALSE,everyone
4579032900,Morning Run,Run,Run,Run,FALSE,,,"Wed, 1/6/2021",1609927508,2021-01-06T17:05:08+0000,Wed,8.35,8355,8.355,kilometers,km,43:12:00,2592,48:03:00,2883,FALSE,https://d3o5xota0a1fcr.cloudfront.net/v6/maps/GZBGWIXTKX3PJIYQQSZO5URJYSVHY4APACSSX3AWGVBNH3CSADGJMQ65Y5Z5LOJ5YOJI42BFLMTTE7KW4WRMOFSDJN6FEQ6G,TRUE,FALSE,111,m,111,,https://www.strava.com/activities/4579032900,https://www.strava.com/activities/4579032900?utm_content=1464505&utm_medium=referral&utm_source=twitter,went for a 8.3 kilometer Run.,TRUE,FALSE,,942,,FALSE,FALSE,FALSE,FALSE,everyone
4569184553,Night Run,Run,Run,Run,FALSE,,,"Mon, 1/4/2021",1609797999,2021-01-05T05:06:39+0000,Mon,6.22,6221,6.221,kilometers,km,29:40:00,1780,30:51:00,1851,FALSE,https://d3o5xota0a1fcr.cloudfront.net/v6/maps/SMNIRCOO5W4SIWXXPVUJUDBQAKPAUHJVYYPDIH6TJR3SJDOVTBAVVA3FZRFQGBDMZP36CWL74CIRWVZCP4WXXF7RFRCGJU7L,TRUE,FALSE,19,m,19,,https://www.strava.com/activities/4569184553,https://www.strava.com/activities/4569184553?utm_content=1464505&utm_medium=referral&utm_source=twitter,went for a 6.2 kilometer Run.,TRUE,FALSE,,590,,FALSE,FALSE,FALSE,FALSE,everyone
4557384427,Morning Activity,AlpineSki,Alpine Ski,Alpine Ski,FALSE,,,"Sat, 1/2/2021",1609577388,2021-01-02T15:49:48+0000,Sat,59.32,59324,59.324,kilometers,km,4:30:07,16207,7:04:21,25461,FALSE,https://d3o5xota0a1fcr.cloudfront.net/v6/maps/ZBVRCBEDS2VIGT7SVKNKA5YYSCPRCNU5RXYVLNJQBFR6AH2I23XLVJKH2C2CS2IIDOYJ2LVY6M3E64VURWR7GXMLIBZ4ZGYP,TRUE,FALSE,"6,561",m,6561.42,,https://www.strava.com/activities/4557384427,https://www.strava.com/activities/4557384427?utm_content=1464505&utm_medium=referral&utm_source=twitter,went for a 59.3 kilometer Alpine Ski.,TRUE,FALSE,,1545,,FALSE,FALSE,FALSE,FALSE,everyone
4546936493,Lunch Run,Run,Run,Run,FALSE,,,"Thu, 12/31/2020",1609418221,2020-12-31T19:37:01+0000,Thu,6.67,6672,6.672,kilometers,km,1:26:30,5190,1:31:24,5484,FALSE,https://d3o5xota0a1fcr.cloudfront.net/v6/maps/IJVNNSHZ6N6N66BSPWGJ2XTVX3ROWWLOPP75KNXGYINHOAATDDPO376ID3YGMDCEJSJQOQWFNRZUHPJEIMNWKEONDR2ICTDS,TRUE,FALSE,3,m,3,,https://www.strava.com/activities/4546936493,https://www.strava.com/activities/4546936493?utm_content=1464505&utm_medium=referral&utm_source=twitter,went for a 6.6 kilometer Run.,TRUE,FALSE,,834,,FALSE,FALSE,FALSE,FALSE,everyone
4536355851,Lunch Activity,NordicSki,Nordic Ski,Nordic Ski,FALSE,,,"Tue, 12/29/2020",1609242943,2020-12-29T18:55:43+0000,Tue,19.07,19073,19.073,kilometers,km,1:30:57,5457,2:24:41,8681,FALSE,https://d3o5xota0a1fcr.cloudfront.net/v6/maps/NUZLWIMHFJIITFCGHQUPNL36VRG5KK2C3HXHYGXK2P5UPJVTUPJU75K2AJOWDQCC2WY7RNTBNL2SQBSZJD23TN3HHJFTXEDD,TRUE,FALSE,244,m,244,,https://www.strava.com/activities/4536355851,https://www.strava.com/activities/4536355851?utm_content=1464505&utm_medium=referral&utm_source=twitter,went for a 19.0 kilometer Nordic Ski.,TRUE,FALSE,,215,,FALSE,FALSE,FALSE,FALSE,everyone
4521467660,Chasing a Ball,Run,Run,Run,FALSE,,,"Sat, 12/26/2020",1608983330,2020-12-26T19:48:50+0000,Sat,2.39,2393,2.393,kilometers,km,6:46,406,8:02,482,FALSE,https://d3o5xota0a1fcr.cloudfront.net/v6/maps/26DBHGDK6R2TAQV6PCA7BAFT4VTYN5OEAFAQJTH7IK5TV6BEAVFIZBJK5AVCNKRACM7KFSWLU4FKPOE56SV4JVJELGBXLIVB,TRUE,FALSE,22,m,22,,https://www.strava.com/activities/4521467660,https://www.strava.com/activities/4521467660?utm_content=1464505&utm_medium=referral&utm_source=twitter,went for a 2.3 kilometer Run.,TRUE,FALSE,,69,0,FALSE,FALSE,FALSE,FALSE,everyone
4493460403,Lunch Activity,NordicSki,Nordic Ski,Nordic Ski,FALSE,,,"Sat, 12/19/2020",1608376441,2020-12-19T18:14:01+0000,Sat,6.32,6321,6.321,kilometers,km,28:56:00,1736,43:26:00,2606,FALSE,https://d3o5xota0a1fcr.cloudfront.net/v6/maps/CTKP64GPJYVRIN2I6WQUQWVJOC5ORQTIF2ZPCD2WKOB5OO7JWO4T4AHAOHFZ3UQUPW2BJFK4657YZDSYVKG3NMH57CE54TTC,TRUE,FALSE,85,m,85,,https://www.strava.com/activities/4493460403,https://www.strava.com/activities/4493460403?utm_content=1464505&utm_medium=referral&utm_source=twitter,went for a 6.3 kilometer Nordic Ski.,TRUE,FALSE,,314,,FALSE,FALSE,FALSE,FALSE,everyone
4485678571,Morning Run,Run,Run,Run,FALSE,,,"Thu, 12/17/2020",1608200473,2020-12-17T17:21:13+0000,Thu,9.17,9171,9.171,kilometers,km,54:08:00,3248,1:00:58,3658,FALSE,https://d3o5xota0a1fcr.cloudfront.net/v6/maps/TV6GH74FN7YUE2QP7LN6XS6SBTXY3ODYELKGRNSZZAH4AU7JKOI752Z3YMSOSS47H6GXTWZYNXZWTURZONVCTQYYXYS5NAUG,TRUE,FALSE,132,m,132,,https://www.strava.com/activities/4485678571,https://www.strava.com/activities/4485678571?utm_content=1464505&utm_medium=referral&utm_source=twitter,went for a 9.1 kilometer Run.,TRUE,FALSE,,902,,FALSE,FALSE,FALSE,FALSE,everyone
4478276378,Evening Ride,Ride,Ride,Ride,FALSE,,,"Tue, 12/15/2020",1608055618,2020-12-16T02:06:58+0000,Tue,0,0,0,kilometers,km,1:04:43,3883,1:04:43,3883,TRUE,,FALSE,FALSE,0,m,0,,https://www.strava.com/activities/4478276378,https://www.strava.com/activities/4478276378?utm_content=1464505&utm_medium=referral&utm_source=twitter,went for a 0 kilometer Ride.,TRUE,FALSE,,846,,FALSE,FALSE,FALSE,FALSE,everyone
4469971487,Evening Ride,Ride,Ride,Ride,FALSE,,,"Sun, 12/13/2020",1607884475,2020-12-14T02:34:35+0000,Sun,0,0,0,kilometers,km,1:03:22,3802,1:03:22,3802,TRUE,,FALSE,FALSE,0,m,0,,https://www.strava.com/activities/4469971487,https://www.strava.com/activities/4469971487?utm_content=1464505&utm_medium=referral&utm_source=twitter,went for a 0 kilometer Ride.,TRUE,FALSE,,865,,FALSE,FALSE,FALSE,FALSE,everyone
4235128879,Afternoon Ride,Ride,Ride,Ride,FALSE,,,"Sat, 10/24/2020",1603551167,2020-10-24T01:52:47+0000,Sat,21.59,21592,21.592,kilometers,km,1:09:39,4179,2:10:10,7810,FALSE,https://d3o5xota0a1fcr.cloudfront.net/v6/maps/NLPV4BK5Q3I66O23F4NCOCXRZUFPNCXIEC3RXDXRSQF7CYWFYPPY7PBEILS3KLJWJPNYG2R4JDBMV4UJTJ6FGTTQJ2ISSSA6,TRUE,FALSE,205,m,205,,https://www.strava.com/activities/4235128879,https://www.strava.com/activities/4235128879?utm_content=1464505&utm_medium=referral&utm_source=twitter,went for a 21.5 kilometer Ride.,TRUE,FALSE,,1266,,FALSE,FALSE,FALSE,FALSE,everyone
4223321822,Evening Ride,Ride,Ride,Ride,FALSE,,,"Wed, 10/21/2020",1603307496,2020-10-21T06:11:36+0000,Wed,17.36,17367,17.367,kilometers,km,36:00:00,2160,38:35:00,2315,FALSE,https://d3o5xota0a1fcr.cloudfront.net/v6/maps/FBG7ORL6YLZMSUHYXMUI5DMHXYVDKPDBNTBBJHI6TOYIV6KYWOFAHZMGB2DCYSKV6YBH3T3JGX4V5RRL56MSS2FCR53D6ORP,TRUE,FALSE,193,m,193,,https://www.strava.com/activities/4223321822,https://www.strava.com/activities/4223321822?utm_content=1464505&utm_medium=referral&utm_source=twitter,went for a 17.3 kilometer Ride.,TRUE,FALSE,,479,,FALSE,FALSE,FALSE,FALSE,everyone
4209473818,Afternoon Ride,Ride,Ride,Ride,FALSE,,,"Sun, 10/18/2020",1603028879,2020-10-18T00:47:59+0000,Sun,74.89,74895,74.895,kilometers,km,2:34:41,9281,3:03:29,11009,FALSE,https://d3o5xota0a1fcr.cloudfront.net/v6/maps/ZCTQA7CIP7WZO7TWS4KL5CPQO7KCZST6FZMFCWUB4IW7TUQZLISH7TZBZN6LSTZ7CUCWHBQQ5DYXT2RHCQ3PUQH5U4QISYQC,TRUE,FALSE,838,m,838,,https://www.strava.com/activities/4209473818,https://www.strava.com/activities/4209473818?utm_content=1464505&utm_medium=referral&utm_source=twitter,went for a 74.8 kilometer Ride.,TRUE,FALSE,,1953,,FALSE,FALSE,FALSE,FALSE,everyone
4204615801,Afternoon Ride,Ride,Ride,Ride,FALSE,,,"Sat, 10/17/2020",1602941731,2020-10-17T00:35:31+0000,Sat,33.4,33407,33.407,kilometers,km,2:32:29,9149,2:54:33,10473,FALSE,https://d3o5xota0a1fcr.cloudfront.net/v6/maps/WZQZHLATXRIHLP6LRYZCZ7J2MLWNSF46R4BQZQEXZZD54EYTDFA3PZ4A5HMGIWRG7GUNE3FITCVWQ2FWZVSFFJPSHFPSBT4A,TRUE,FALSE,"1,414",m,1414,,https://www.strava.com/activities/4204615801,https://www.strava.com/activities/4204615801?utm_content=1464505&utm_medium=referral&utm_source=twitter,went for a 33.4 kilometer Ride.,TRUE,FALSE,,2513,,FALSE,FALSE,FALSE,FALSE,everyone
4191102269,Morning Ride,Ride,Ride,Ride,FALSE,,,"Wed, 10/14/2020",1602655310,2020-10-13T17:01:50+0000,Wed,42.52,42527,42.527,kilometers,km,1:30:52,5452,2:20:58,8458,FALSE,https://d3o5xota0a1fcr.cloudfront.net/v6/maps/AEEZLBW5Y5TEFUQPZVNCSERHAVHSS7H5J7J6W3BDQ5VNQO56ZUQWXV774AGJMIWHX6QWSVROCWXUAWYSAPGE5HYWQTWCKVFG,TRUE,FALSE,356,m,356,,https://www.strava.com/activities/4191102269,https://www.strava.com/activities/4191102269?utm_content=1464505&utm_medium=referral&utm_source=twitter,went for a 42.5 kilometer Ride.,TRUE,FALSE,,1324,,FALSE,FALSE,FALSE,FALSE,everyone
4188768586,Night Activity,WeightTraining,Weight Training,Workout,FALSE,,,"Mon, 10/12/2020",1602538147,2020-10-13T04:29:07+0000,Mon,0,0,0,kilometers,km,2:23:55,8635,2:23:55,8635,TRUE,,FALSE,FALSE,0,m,0,,https://www.strava.com/activities/4188768586,https://www.strava.com/activities/4188768586?utm_content=1464505&utm_medium=referral&utm_source=twitter,went for a 0 kilometer Weight Training.,TRUE,FALSE,,1156,30,FALSE,FALSE,FALSE,FALSE,everyone
4178748301,Afternoon Ride,Ride,Ride,Ride,FALSE,,,"Sun, 10/11/2020",1602422077,2020-10-11T00:14:37+0000,Sun,36.19,36197,36.197,kilometers,km,2:03:13,7393,2:18:23,8303,FALSE,https://d3o5xota0a1fcr.cloudfront.net/v6/maps/DGEG6KMN7QRPRB6FHYGSDAGUUIGS737BV2A6S2GVJJFX6U2J7OB4RU4UCE3X7E7UV7QJZJUAWUFPWOZ2CF5WECINKFU7J4MD,TRUE,FALSE,892,m,892,,https://www.strava.com/activities/4178748301,https://www.strava.com/activities/4178748301?utm_content=1464505&utm_medium=referral&utm_source=twitter,went for a 36.1 kilometer Ride.,TRUE,FALSE,,1550,,FALSE,FALSE,FALSE,FALSE,everyone
4173546532,Morning Ride,Ride,Ride,Ride,FALSE,,,"Sat, 10/10/2020",1602316536,2020-10-09T18:55:36+0000,Sat,94.88,94886.3,94.8863,kilometers,km,3:15:00,11700,3:40:38,13238,FALSE,https://d3o5xota0a1fcr.cloudfront.net/v6/maps/QBMZ5RGDVVJ4ADWECV7LYC4FQFRHEK6YP26LUBLIG5VWGAWKDLKUATIEOZK7ENPIURWFJOL32XGEZ72BABMQPH7Z5KN7MZF7,TRUE,FALSE,868,m,867.543,,https://www.strava.com/activities/4173546532,https://www.strava.com/activities/4173546532?utm_content=1464505&utm_medium=referral&utm_source=twitter,went for a 94.8 kilometer Ride.,FALSE,FALSE,,2971.787842,10,FALSE,FALSE,FALSE,FALSE,everyone
4164815543,"Group Ride Three-peat Complete, Oof",Ride,Ride,Ride,FALSE,,,"Thu, 10/8/2020",1602137194,2020-10-07T17:06:34+0000,Thu,48.17,48171,48.171,kilometers,km,1:34:46,5686,2:21:21,8481,FALSE,https://d3o5xota0a1fcr.cloudfront.net/v6/maps/OD27TZ7SVI4NU6FAI2GOAJC6ZHFHATEELBD3NMFKXPSZIKYWCWCEM2TYFAYUEKXRANCJ6BUKIKGJNFUVUUIPZO4NYKFGA5IS,TRUE,FALSE,442,m,442,,https://www.strava.com/activities/4164815543,https://www.strava.com/activities/4164815543?utm_content=1464505&utm_medium=referral&utm_source=twitter,went for a 48.1 kilometer Ride.,TRUE,FALSE,,1357,10,FALSE,FALSE,FALSE,FALSE,everyone
4160340697,Morning Ride,Ride,Ride,Ride,FALSE,,,"Wed, 10/7/2020",1602050741,2020-10-06T17:05:41+0000,Wed,41.27,41277,41.277,kilometers,km,1:25:43,5143,2:03:53,7433,FALSE,https://d3o5xota0a1fcr.cloudfront.net/v6/maps/XZSNVOXP4ZIWCU5C2M2JHYBAUFP4MSJNAYJO5JNWGXZALRII2ODY2FFDV3KDH5HJXNDKXOOPZJN5HLAMO7YBCINDX7NRJS2L,TRUE,FALSE,381,m,381,,https://www.strava.com/activities/4160340697,https://www.strava.com/activities/4160340697?utm_content=1464505&utm_medium=referral&utm_source=twitter,went for a 41.2 kilometer Ride.,TRUE,FALSE,,1230,,FALSE,FALSE,FALSE,FALSE,everyone
4155660155,Morning Ride,Ride,Ride,Ride,FALSE,,,"Tue, 10/6/2020",1601964430,2020-10-05T17:07:10+0000,Tue,47.53,47536,47.536,kilometers,km,1:30:14,5414,1:40:34,6034,FALSE,https://d3o5xota0a1fcr.cloudfront.net/v6/maps/MFEL65KBJ2TFVOXM3MJLZKJVHLVHVKRW6UKULGJRQ6YO4SS4KX7QAGRXMOWR62AP2HEIQWV4DFGE4KOR65IQHYKYDCT3VZTM,TRUE,FALSE,394,m,394,,https://www.strava.com/activities/4155660155,https://www.strava.com/activities/4155660155?utm_content=1464505&utm_medium=referral&utm_source=twitter,went for a 47.5 kilometer Ride.,TRUE,FALSE,,1208,,FALSE,FALSE,FALSE,FALSE,everyone
4155643524,Lunch Ride,Ride,Ride,Ride,FALSE,,,"Sun, 10/4/2020",1601815833,2020-10-03T23:50:33+0000,Sun,22.44,22444,22.444,kilometers,km,49:15:00,2955,52:48:00,3168,FALSE,https://d3o5xota0a1fcr.cloudfront.net/v6/maps/PZ2VHB4FQ6U3UGUG3G2OFMQAKWLXWN6CBM52WX2776FIQL6PDOFT6CT3BHJQIMQNQDTX2NXGTJKNNSX5IRZ3ZWQAUGCVSMI5,TRUE,FALSE,195,m,195,,https://www.strava.com/activities/4155643524,https://www.strava.com/activities/4155643524?utm_content=1464505&utm_medium=referral&utm_source=twitter,went for a 22.4 kilometer Ride.,TRUE,FALSE,,561,,FALSE,FALSE,FALSE,FALSE,everyone
4155641723,Morning Ride,Ride,Ride,Ride,FALSE,,,"Sat, 10/3/2020",1601711535,2020-10-02T18:52:15+0000,Sat,90.51,90510,90.51,kilometers,km,2:54:53,10493,3:21:47,12107,FALSE,https://d3o5xota0a1fcr.cloudfront.net/v6/maps/HXWNK7PHTSANDF2TN36XSMITGVOXZK4T57U3ASYBEZU4GXX2HIWHBWCXYM757F62SBD4G6YNVBN5XF55ARSS6RQE4UQGZJOD,TRUE,FALSE,756,m,756,,https://www.strava.com/activities/4155641723,https://www.strava.com/activities/4155641723?utm_content=1464505&utm_medium=referral&utm_source=twitter,went for a 90.5 kilometer Ride.,TRUE,FALSE,,2317,,FALSE,FALSE,FALSE,FALSE,everyone
4134543766,Morning Ride,Ride,Ride,Ride,FALSE,,,"Thu, 10/1/2020",1601532419,2020-09-30T17:06:59+0000,Thu,48.14,48146,48.146,kilometers,km,1:35:18,5718,1:40:01,6001,FALSE,https://d3o5xota0a1fcr.cloudfront.net/v6/maps/GMY4ZGLHDX2LHPZVVXFBFK7P4Q26P7RE3Y7ZD7VW2WLXBC4VB4OAPA6SPXAPAKTB3KRZZWWRD46MJEJY2LLR4SPDUO72N72F,TRUE,FALSE,482,m,482,,https://www.strava.com/activities/4134543766,https://www.strava.com/activities/4134543766?utm_content=1464505&utm_medium=referral&utm_source=twitter,went for a 48.1 kilometer Ride.,TRUE,FALSE,,1254,,FALSE,FALSE,FALSE,FALSE,everyone
4134533613,Afternoon Ride,Ride,Ride,Ride,FALSE,,,"Wed, 9/30/2020",1601486399,2020-09-30T04:19:59+0000,Wed,14.1,14105,14.105,kilometers,km,32:13:00,1933,50:06:00,3006,FALSE,https://d3o5xota0a1fcr.cloudfront.net/v6/maps/HFBJQ3DEWU5MU4NEFS5U7WYMMG2LJHIII3BMMKZNOSOXBDOOG4LBSVDI537H2KZGJ3X7ZNUGCIIKYITSLVUTB4NECBG6DDN2,TRUE,FALSE,165,m,165,,https://www.strava.com/activities/4134533613,https://www.strava.com/activities/4134533613?utm_content=1464505&utm_medium=referral&utm_source=twitter,went for a 14.1 kilometer Ride.,TRUE,FALSE,,568,,FALSE,FALSE,FALSE,FALSE,everyone
4119746266,Afternoon Activity,WeightTraining,Weight Training,Workout,FALSE,,,"Sat, 9/26/2020",1601132072,2020-09-26T21:54:32+0000,Sat,0,0,0,kilometers,km,2:47:50,10070,2:47:50,10070,TRUE,,FALSE,FALSE,0,m,0,,https://www.strava.com/activities/4119746266,https://www.strava.com/activities/4119746266?utm_content=1464505&utm_medium=referral&utm_source=twitter,went for a 0 kilometer Weight Training.,TRUE,FALSE,,1081,30,FALSE,FALSE,FALSE,FALSE,everyone
4112485835,Lunch Ride,Ride,Ride,Ride,FALSE,,,"Sat, 9/26/2020",1601124378,2020-09-26T00:46:18+0000,Sat,30.43,30438,30.438,kilometers,km,2:13:45,8025,2:28:48,8928,FALSE,https://d3o5xota0a1fcr.cloudfront.net/v6/maps/LSOW4BJPNTLCC224PHKMNSXDMRARC6MTLYSHCPIGE7DTWNJSFULSQFX46MNGSZKERR6U4HZJWFJIGZQ4DQ67ORRKJPN7XOVB,TRUE,FALSE,"1,277",m,1277,,https://www.strava.com/activities/4112485835,https://www.strava.com/activities/4112485835?utm_content=1464505&utm_medium=referral&utm_source=twitter,went for a 30.4 kilometer Ride.,TRUE,FALSE,,2121,,FALSE,FALSE,FALSE,FALSE,everyone
4110238985,Afternoon Ride,Ride,Ride,Ride,FALSE,,,"Fri, 9/25/2020",1601054390,2020-09-25T05:19:50+0000,Fri,18.84,18844,18.844,kilometers,km,54:06:00,3246,1:28:00,5280,FALSE,https://d3o5xota0a1fcr.cloudfront.net/v6/maps/XKUC72E4WP3NI45DNJB6MTRYOYL7LT45X4YD7SIBYE2WKDGGTE32SQQTJL5JQBHLY25W6A7MGCR4JMUEGVNRMDSVY7M53IOC,TRUE,FALSE,199,m,199,,https://www.strava.com/activities/4110238985,https://www.strava.com/activities/4110238985?utm_content=1464505&utm_medium=referral&utm_source=twitter,went for a 18.8 kilometer Ride.,TRUE,FALSE,,918,,FALSE,FALSE,FALSE,FALSE,everyone
4101569899,Night Activity,WeightTraining,Weight Training,Workout,FALSE,,,"Tue, 9/22/2020",1600816657,2020-09-23T06:17:37+0000,Tue,0,0,0,kilometers,km,1:30:34,5434,1:30:34,5434,TRUE,,FALSE,FALSE,0,m,0,,https://www.strava.com/activities/4101569899,https://www.strava.com/activities/4101569899?utm_content=1464505&utm_medium=referral&utm_source=twitter,went for a 0 kilometer Weight Training.,TRUE,FALSE,,635,30,FALSE,FALSE,FALSE,FALSE,everyone
4094341133,Morning Ride,Ride,Ride,Ride,FALSE,,,"Tue, 9/22/2020",1600756580,2020-09-21T18:36:20+0000,Tue,30.63,30631,30.631,kilometers,km,1:03:41,3821,1:25:41,5141,FALSE,https://d3o5xota0a1fcr.cloudfront.net/v6/maps/4ZHXRR3WZ3HMKZMIFBRVDMILZ67BUZY2JRV5C6HMCCC3CTJ4VOBUWBCLKIQBMOO5K7REDQBQOMAV2TJR6HZ2CVB3CE6HXON7,TRUE,FALSE,296,m,296,,https://www.strava.com/activities/4094341133,https://www.strava.com/activities/4094341133?utm_content=1464505&utm_medium=referral&utm_source=twitter,went for a 30.6 kilometer Ride.,TRUE,FALSE,,918,,FALSE,FALSE,FALSE,FALSE,everyone
4459617818,Lunch Run,Run,Run,Run,FALSE,,,"Fri, 12/11/2020",1607686935,2020-12-11T18:42:15+0000,Fri,6.34,6346,6.346,kilometers,km,30:27:00,1827,31:29:00,1889,FALSE,https://d3o5xota0a1fcr.cloudfront.net/v6/maps/GR3E37JAOPSE3RPMRRM2MAM5HLZOVEKDQPUDH37RY35DD6QTQXREWBF4NCP7NYFICOVHG42FG3O7QOY4WRSQKCK57IF62P6L,TRUE,FALSE,31,m,31,,https://www.strava.com/activities/4459617818,https://www.strava.com/activities/4459617818?utm_content=1464505&utm_medium=referral&utm_source=twitter,went for a 6.3 kilometer Run.,TRUE,FALSE,,802,,FALSE,FALSE,FALSE,FALSE,everyone
4425639665,Night Activity,WeightTraining,Weight Training,Workout,FALSE,,,"Wed, 12/2/2020",1606953523,2020-12-03T07:58:43+0000,Wed,0,0,0,kilometers,km,1:02:35,3755,1:02:35,3755,TRUE,,FALSE,FALSE,0,m,0,,https://www.strava.com/activities/4425639665,https://www.strava.com/activities/4425639665?utm_content=1464505&utm_medium=referral&utm_source=twitter,went for a 0 kilometer Weight Training.,TRUE,FALSE,,532,30,FALSE,FALSE,FALSE,FALSE,everyone
4416614985,Afternoon Ride,Ride,Ride,Ride,FALSE,,,"Tue, 12/1/2020",1606843785,2020-12-01T04:29:45+0000,Tue,7.07,7073,7.073,kilometers,km,37:39:00,2259,1:36:03,5763,FALSE,https://d3o5xota0a1fcr.cloudfront.net/v6/maps/2DFBVCMMRRCTCADXNIZGJ2M6UKH3MYQA4INION4NNPMKKPJS7XZUO6D7MZEETY2IBJCLCBCK73XOCD2SQYO5UVUFQTQB3MP5,TRUE,FALSE,214,m,214,,https://www.strava.com/activities/4416614985,https://www.strava.com/activities/4416614985?utm_content=1464505&utm_medium=referral&utm_source=twitter,went for a 7.0 kilometer Ride.,TRUE,FALSE,,649,,FALSE,FALSE,FALSE,FALSE,everyone
4414587717,Night Activity,WeightTraining,Weight Training,Workout,FALSE,,,"Sun, 11/29/2020",1606690915,2020-11-30T07:01:55+0000,Sun,0,0,0,kilometers,km,1:29:06,5346,1:29:06,5346,TRUE,,FALSE,FALSE,0,m,0,,https://www.strava.com/activities/4414587717,https://www.strava.com/activities/4414587717?utm_content=1464505&utm_medium=referral&utm_source=twitter,went for a 0 kilometer Weight Training.,TRUE,FALSE,,706,30,FALSE,FALSE,FALSE,FALSE,everyone
4399874692,Morning Ride,Ride,Ride,Ride,FALSE,,,"Sat, 11/28/2020",1606559933,2020-11-27T21:38:53+0000,Sat,82.86,82863,82.863,kilometers,km,3:33:48,12828,3:48:08,13688,FALSE,https://d3o5xota0a1fcr.cloudfront.net/v6/maps/RNTLPZHFG6IWRPNLCHM7HCA6ZE42GE7G4PKPLXUQFPW4C2Z25WQMDKV32TGEKQW636Z3YIL4IJBCDC2UBZTI37VWGQYNWO3Z,TRUE,FALSE,"1,677",m,1677,,https://www.strava.com/activities/4399874692,https://www.strava.com/activities/4399874692?utm_content=1464505&utm_medium=referral&utm_source=twitter,went for a 82.8 kilometer Ride.,TRUE,FALSE,,3018,,FALSE,FALSE,FALSE,FALSE,everyone
4399863566,Morning Run,Run,Run,Run,FALSE,,,"Sun, 11/22/2020",1606035767,2020-11-21T20:02:47+0000,Sun,10.9,10907,10.907,kilometers,km,2:03:41,7421,2:59:49,10789,FALSE,https://d3o5xota0a1fcr.cloudfront.net/v6/maps/5FGBXFFRZLNQPWPVJS6OIIBTAMIRSZLRMQFPOQDU6RJE7WEGBBTA3CE4NQYUDYLT557VSVRIOJJNAPGMUCYEC37BSEHFR2H2,TRUE,FALSE,173,m,173,,https://www.strava.com/activities/4399863566,https://www.strava.com/activities/4399863566?utm_content=1464505&utm_medium=referral&utm_source=twitter,went for a 10.9 kilometer Run.,TRUE,FALSE,,2266,,FALSE,FALSE,FALSE,FALSE,everyone
4399860871,Morning Run,Run,Run,Run,FALSE,,,"Sat, 11/21/2020",1605954336,2020-11-20T21:25:36+0000,Sat,19.63,19634,19.634,kilometers,km,6:12:06,22326,6:16:39,22599,FALSE,https://d3o5xota0a1fcr.cloudfront.net/v6/maps/GK4GC5I74NSUWGFEKVZRHKNL2PFRSYKWZ4NX7JGTPU2YFLIO2VTCNJQ5EK4L7KVMMX4WYY4NYYHLJ6VIJ5D6XKGACVQBGQRN,TRUE,FALSE,"1,234",m,1234,,https://www.strava.com/activities/4399860871,https://www.strava.com/activities/4399860871?utm_content=1464505&utm_medium=referral&utm_source=twitter,went for a 19.6 kilometer Run.,TRUE,FALSE,,3062,,FALSE,FALSE,FALSE,FALSE,everyone
4358730647,Evening Ride,Ride,Ride,Ride,FALSE,,,"Thu, 11/19/2020",1605812510,2020-11-19T06:01:50+0000,Thu,21.41,21409,21.409,kilometers,km,42:54:00,2574,47:01:00,2821,FALSE,https://d3o5xota0a1fcr.cloudfront.net/v6/maps/ZTS3AG2GSL5M3BU6QBIERX4I3YVS5C62WB537NT22NOK5QSN37LMAQ6RBEFVSKKT23TCOBYMX3RE7F4KLH5GNQA3OQVRI7LE,TRUE,FALSE,246,m,246,,https://www.strava.com/activities/4358730647,https://www.strava.com/activities/4358730647?utm_content=1464505&utm_medium=referral&utm_source=twitter,went for a 21.4 kilometer Ride.,TRUE,FALSE,,259,,FALSE,FALSE,FALSE,FALSE,everyone
4341666244,Lunch Ride,Ride,Ride,Ride,FALSE,,,"Sun, 11/15/2020",1605443359,2020-11-14T23:29:19+0000,Sun,16.51,16509,16.509,kilometers,km,31:01:00,1861,32:57:00,1977,FALSE,https://d3o5xota0a1fcr.cloudfront.net/v6/maps/C4JHTSTKU27WH4KXOBDAVZTH6UO2OIPI2GWLP6O4EZG465LTKN6KUADYT75KCHZPMF7KKJBBJF2CWAI2T5IK2UFUY7OIZQUB,TRUE,FALSE,205,m,205,,https://www.strava.com/activities/4341666244,https://www.strava.com/activities/4341666244?utm_content=1464505&utm_medium=referral&utm_source=twitter,went for a 16.5 kilometer Ride.,TRUE,FALSE,,484,,FALSE,FALSE,FALSE,FALSE,everyone
4333907736,Lunch Ride,Ride,Ride,Ride,FALSE,,,"Sat, 11/14/2020",1605354825,2020-11-13T22:53:45+0000,Sat,35.72,35729,35.729,kilometers,km,1:24:48,5088,1:49:15,6555,FALSE,https://d3o5xota0a1fcr.cloudfront.net/v6/maps/HH5XLOAK42MDE3H3LN36W5ARQ5PTPDSCLDASICAQMKIL54HM7JBB74JJFOAD2MTXYU7DVCTWOTAGRR3WZBFXUNEYKC7T3RP7,TRUE,FALSE,434,m,434,,https://www.strava.com/activities/4333907736,https://www.strava.com/activities/4333907736?utm_content=1464505&utm_medium=referral&utm_source=twitter,went for a 35.7 kilometer Ride.,TRUE,FALSE,,1051,,FALSE,FALSE,FALSE,FALSE,everyone
4328680062,Morning Ride,Ride,Ride,Ride,FALSE,,,"Fri, 11/13/2020",1605244792,2020-11-12T16:19:52+0000,Fri,71.76,71765,71.765,kilometers,km,2:26:23,8783,3:20:43,12043,FALSE,https://d3o5xota0a1fcr.cloudfront.net/v6/maps/3BQBUVXGSRQCXZPWDHRFBTWIE6UNQ7M74PWUYEH3AVZMXBHUYDQKB5OFFVZ3FT6LN4XEUILMGZ6EIZFRQHR2WFPKD5UV4K5R,TRUE,FALSE,"1,013",m,1013,,https://www.strava.com/activities/4328680062,https://www.strava.com/activities/4328680062?utm_content=1464505&utm_medium=referral&utm_source=twitter,went for a 71.7 kilometer Ride.,TRUE,FALSE,,2150,,FALSE,FALSE,FALSE,FALSE,everyone
4326817819,Afternoon Ride,Ride,Ride,Ride,FALSE,,,"Thu, 11/12/2020",1605202754,2020-11-12T04:39:14+0000,Thu,19.85,19850,19.85,kilometers,km,1:35:35,5735,2:41:27,9687,FALSE,https://d3o5xota0a1fcr.cloudfront.net/v6/maps/Y7L3JSQPAAA45LEOHXLSAMFXJFG4LZV7WJICOMDVVZMBFUCNFSJURQ4KKVQMCVHQCGMCCRWVA2CKVZ2L7WO7JCULUI2VWLN6,TRUE,FALSE,774,m,774,,https://www.strava.com/activities/4326817819,https://www.strava.com/activities/4326817819?utm_content=1464505&utm_medium=referral&utm_source=twitter,went for a 19.8 kilometer Ride.,TRUE,FALSE,,1317,,FALSE,FALSE,FALSE,FALSE,everyone
4320890393,Evening Activity,WeightTraining,Weight Training,Workout,FALSE,,,"Tue, 11/10/2020",1605041952,2020-11-11T04:59:12+0000,Tue,0,0,0,kilometers,km,1:27:36,5256,1:27:36,5256,TRUE,,FALSE,FALSE,0,m,0,,https://www.strava.com/activities/4320890393,https://www.strava.com/activities/4320890393?utm_content=1464505&utm_medium=referral&utm_source=twitter,went for a 0 kilometer Weight Training.,TRUE,FALSE,,812,30,FALSE,FALSE,FALSE,FALSE,everyone
4313797156,Evening Ride,Ride,Ride,Ride,FALSE,,,"Mon, 11/9/2020",1604948438,2020-11-09T06:00:38+0000,Mon,10.09,10091,10.091,kilometers,km,40:21:00,2421,1:02:42,3762,FALSE,https://d3o5xota0a1fcr.cloudfront.net/v6/maps/LXTVY2WRD3RNSC5QTF43FAAUV5ZS6BDIKQEJRA6ISA7U54V7CL63YSWF5QXZCXAY2X2F44S4S6OMECGNDSNG3WY73RLCWE3K,TRUE,FALSE,298,m,298,,https://www.strava.com/activities/4313797156,https://www.strava.com/activities/4313797156?utm_content=1464505&utm_medium=referral&utm_source=twitter,went for a 10.0 kilometer Ride.,TRUE,FALSE,,417,,TRUE,FALSE,FALSE,FALSE,everyone
4308925883,Morning Run,Run,Run,Run,FALSE,,,"Sat, 11/7/2020",1604744027,2020-11-06T21:13:47+0000,Sat,15.55,15551,15.551,kilometers,km,2:55:40,10540,5:06:56,18416,FALSE,https://d3o5xota0a1fcr.cloudfront.net/v6/maps/ISF4XLQVZ76KQKBJMYWOJL2FSXOILQYLVHQ4T7XM6U7SBMOO6ITNU43HQYOTMUL6S3776FJPVPJ7BJHTXVTFMRAZYU7A62FQ,TRUE,FALSE,746,m,746,,https://www.strava.com/activities/4308925883,https://www.strava.com/activities/4308925883?utm_content=1464505&utm_medium=referral&utm_source=twitter,went for a 15.5 kilometer Run.,TRUE,FALSE,,2413,,FALSE,FALSE,FALSE,FALSE,everyone
4295464252,Night Activity,WeightTraining,Weight Training,Workout,FALSE,,,"Thu, 11/5/2020",1604610695,2020-11-06T05:11:35+0000,Thu,0,0,0,kilometers,km,1:05:50,3950,1:05:50,3950,TRUE,,FALSE,FALSE,0,m,0,,https://www.strava.com/activities/4295464252,https://www.strava.com/activities/4295464252?utm_content=1464505&utm_medium=referral&utm_source=twitter,went for a 0 kilometer Weight Training.,TRUE,FALSE,,598,30,FALSE,FALSE,FALSE,FALSE,everyone
4279894343,Afternoon Ride,Ride,Ride,Ride,FALSE,,,"Tue, 11/3/2020",1604423813,2020-11-03T04:16:53+0000,Tue,6.54,6540,6.54,kilometers,km,6:53,413,2:18:52,8332,FALSE,https://d3o5xota0a1fcr.cloudfront.net/v6/maps/F6M3ZJXKI2ES4E4PW2HNOV4TDZJSYXLCPIZXK3TFZMOJLIKXMXYWRAABIFTHJ3HLMSQX7LFBBYZWKURH473T6G4DO6HTR6HI,TRUE,FALSE,279,m,279,,https://www.strava.com/activities/4279894343,https://www.strava.com/activities/4279894343?utm_content=1464505&utm_medium=referral&utm_source=twitter,went for a 6.5 kilometer Ride.,TRUE,FALSE,,418,,TRUE,FALSE,FALSE,FALSE,everyone
4270514324,Afternoon Ride,Ride,Ride,Ride,FALSE,,,"Sun, 11/1/2020",1604238724,2020-11-01T00:52:04+0000,Sun,22.83,22838,22.838,kilometers,km,48:53:00,2933,1:09:33,4173,FALSE,https://d3o5xota0a1fcr.cloudfront.net/v6/maps/N3CZB67WGVQBHPWHNTEYT2MU6AZ7HPQCWQDG4KA6BLJXYV27OGSJZJXTE345F6U4DXGYCOYQDOPXYYJUVMVKZ65334OT2JXP,TRUE,FALSE,199,m,199,,https://www.strava.com/activities/4270514324,https://www.strava.com/activities/4270514324?utm_content=1464505&utm_medium=referral&utm_source=twitter,went for a 22.8 kilometer Ride.,TRUE,FALSE,,278,,FALSE,FALSE,FALSE,FALSE,everyone
4264157965,Lunch Run,Run,Run,Run,FALSE,,,"Sat, 10/31/2020",1604145670,2020-10-30T23:01:10+0000,Sat,6.53,6531,6.531,kilometers,km,33:09:00,1989,35:42:00,2142,FALSE,https://d3o5xota0a1fcr.cloudfront.net/v6/maps/PTUT2VROC6VHOTKNB63M6425VUPUQ7ZRV6UD5CPURT5VQW7YHK7EV3QK4BGNTBM2SYGO5KN273LJQRZZXO3MJSE7I2YFAB77,TRUE,FALSE,118,m,118,,https://www.strava.com/activities/4264157965,https://www.strava.com/activities/4264157965?utm_content=1464505&utm_medium=referral&utm_source=twitter,went for a 6.5 kilometer Run.,TRUE,FALSE,,386,,FALSE,FALSE,FALSE,FALSE,everyone
4239709026,Whaka 91.5? Don’t know where the trails went ,Ride,Ride,Ride,FALSE,,,"Sun, 10/25/2020",1603612078,2020-10-24T18:47:58+0000,Sun,91.48,91488,91.488,kilometers,km,5:56:30,21390,5:57:35,21455,FALSE,https://d3o5xota0a1fcr.cloudfront.net/v6/maps/L3FUD3VOKWV2IO6HINPPIYKH5WWGQY4SP7O5AXIWAGSBXYLB2WP3L7TWN7KNMBIU7CHK3U7NOFY7JPUQKGB243T5LOOJZGBP,TRUE,FALSE,"2,622",m,2622,,https://www.strava.com/activities/4239709026,https://www.strava.com/activities/4239709026?utm_content=1464505&utm_medium=referral&utm_source=twitter,went for a 91.4 kilometer Ride.,TRUE,FALSE,,4859,10,FALSE,FALSE,FALSE,FALSE,everyone
3610837065,Lunch Ride,Ride,Ride,Ride,FALSE,,,"Sun, 6/14/2020",1592139285,2020-06-14T00:54:45+0000,Sun,21.25,21255,21.255,kilometers,km,49:10:00,2950,1:08:07,4087,FALSE,https://d3o5xota0a1fcr.cloudfront.net/v6/maps/BNKXXRELYPIP5P7PW2IHLREIZRJ77U2ZF7HU5GS3LZTSQFUWVVNNWIHNVXYXJ7RRY2KQMSPVCPHH4NA5XQ74KVHDT2XVYUWK,TRUE,FALSE,429,m,429,,https://www.strava.com/activities/3610837065,https://www.strava.com/activities/3610837065?utm_content=1464505&utm_medium=referral&utm_source=twitter,went for a 21.2 kilometer Ride.,TRUE,FALSE,,847,,FALSE,FALSE,FALSE,FALSE,everyone
3622254652,Lunch Activity,WeightTraining,Weight Training,Workout,FALSE,,,"Sun, 6/14/2020",1592137111,2020-06-14T19:18:31+0000,Sun,0,0,0,kilometers,km,1:41:40,6100,1:41:40,6100,TRUE,,FALSE,FALSE,0,m,0,,https://www.strava.com/activities/3622254652,https://www.strava.com/activities/3622254652?utm_content=1464505&utm_medium=referral&utm_source=twitter,went for a 0 kilometer Weight Training.,TRUE,FALSE,,597,30,FALSE,FALSE,FALSE,FALSE,everyone
3605508623,MJ Inspired Three-peat ,Run,Run,Run,FALSE,,,"Sat, 6/13/2020",1592051438,2020-06-13T00:30:38+0000,Sat,10.53,10538,10.538,kilometers,km,1:18:41,4721,1:34:02,5642,FALSE,https://d3o5xota0a1fcr.cloudfront.net/v6/maps/DYU6UKTRJ56CKUOBKZCIKF7TO5PVL364FQWR2ENN6AYCOK7ZI4OJF2VGTT7Q5YMO7BKWEWFEMUBXF2ZZSYFHAA6VU4Z3HLWT,TRUE,FALSE,661,m,661,,https://www.strava.com/activities/3605508623,https://www.strava.com/activities/3605508623?utm_content=1464505&utm_medium=referral&utm_source=twitter,went for a 10.5 kilometer Run.,TRUE,FALSE,,1349,0,FALSE,FALSE,FALSE,FALSE,everyone
3598458999,Night Activity,WeightTraining,Weight Training,Workout,FALSE,,,"Wed, 6/10/2020",1591829951,2020-06-11T05:59:11+0000,Wed,0,0,0,kilometers,km,1:21:37,4897,1:21:37,4897,TRUE,,FALSE,FALSE,0,m,0,,https://www.strava.com/activities/3598458999,https://www.strava.com/activities/3598458999?utm_content=1464505&utm_medium=referral&utm_source=twitter,went for a 0 kilometer Weight Training.,TRUE,FALSE,,693,30,FALSE,FALSE,FALSE,FALSE,everyone
3586671015,Night Run,Run,Run,Run,FALSE,,,"Mon, 6/8/2020",1591659295,2020-06-09T06:34:55+0000,Mon,10.17,10170,10.17,kilometers,km,54:43:00,3283,1:00:40,3640,TRUE,,FALSE,FALSE,0,m,0,,https://www.strava.com/activities/3586671015,https://www.strava.com/activities/3586671015?utm_content=1464505&utm_medium=referral&utm_source=twitter,went for a 10.1 kilometer Run.,TRUE,FALSE,,878,,FALSE,FALSE,FALSE,FALSE,everyone
3581630292,Night Activity,WeightTraining,Weight Training,Workout,FALSE,,,"Sun, 6/7/2020",1591568305,2020-06-08T05:18:25+0000,Sun,0,0,0,kilometers,km,1:24:41,5081,1:24:41,5081,TRUE,,FALSE,FALSE,0,m,0,,https://www.strava.com/activities/3581630292,https://www.strava.com/activities/3581630292?utm_content=1464505&utm_medium=referral&utm_source=twitter,went for a 0 kilometer Weight Training.,TRUE,FALSE,,649,30,FALSE,FALSE,FALSE,FALSE,everyone
3575310634,Hardest 3hr 3km ride 🤷‍♂️ Thanks Suunto,Ride,Ride,Ride,FALSE,,,"Sun, 6/7/2020",1591525922,2020-06-06T22:32:02+0000,Sun,2.98,2984,2.984,kilometers,km,18:14,1094,3:28:27,12507,FALSE,https://d3o5xota0a1fcr.cloudfront.net/v6/maps/4KKXGFNPJ3ONGNXT6CPRY2TVND6GNMDFLEYMLYEHKBU4KJX64B3DEJQVAV46UFHYN4GNIC4VJG5JVJVTIKNPWR76EATLBLDR,TRUE,FALSE,926,m,926,,https://www.strava.com/activities/3575310634,https://www.strava.com/activities/3575310634?utm_content=1464505&utm_medium=referral&utm_source=twitter,went for a 2.9 kilometer Ride.,TRUE,FALSE,,1209,10,FALSE,FALSE,FALSE,FALSE,everyone
3573628334,Morning Ride,Ride,Ride,Ride,FALSE,,,"Sat, 6/6/2020",1591430364,2020-06-05T19:59:24+0000,Sat,55.35,55354,55.354,kilometers,km,2:20:21,8421,3:12:45,11565,FALSE,https://d3o5xota0a1fcr.cloudfront.net/v6/maps/Z6GPCT6C3FSVIQEXL5AEP2OALTNVD2RF7I5WPOGDZ5QXXWTXJZYORYROG5O6ITRDNNMPM6QQDFO5KDFSY2PP3M2DSZUGYNFA,TRUE,FALSE,492,m,492,,https://www.strava.com/activities/3573628334,https://www.strava.com/activities/3573628334?utm_content=1464505&utm_medium=referral&utm_source=twitter,went for a 55.3 kilometer Ride.,TRUE,FALSE,,1628,,FALSE,FALSE,FALSE,FALSE,everyone
3568952924,Night Activity,WeightTraining,Weight Training,Workout,FALSE,,,"Thu, 6/4/2020",1591309733,2020-06-05T05:28:53+0000,Thu,0,0,0,kilometers,km,1:26:06,5166,1:26:06,5166,TRUE,,FALSE,FALSE,0,m,0,,https://www.strava.com/activities/3568952924,https://www.strava.com/activities/3568952924?utm_content=1464505&utm_medium=referral&utm_source=twitter,went for a 0 kilometer Weight Training.,TRUE,FALSE,,730,30,FALSE,FALSE,FALSE,FALSE,everyone
3561886583,Evening Run,Run,Run,Run,FALSE,,,"Thu, 6/4/2020",1591303279,2020-06-04T08:41:19+0000,Thu,4.38,4383,4.383,kilometers,km,22:06,1326,22:12,1332,FALSE,https://d3o5xota0a1fcr.cloudfront.net/v6/maps/5O2Y6GBZFUHOLWRN7SSB3X2NFFPM2J56UFGSPGETTNRCR36DGKBDU5V454OQVDILFQJVOAAVIXSAQD6LWQNZUDVPHKLZIJA2,TRUE,FALSE,99,m,99,,https://www.strava.com/activities/3561886583,https://www.strava.com/activities/3561886583?utm_content=1464505&utm_medium=referral&utm_source=twitter,went for a 4.3 kilometer Run.,TRUE,FALSE,,369,,FALSE,FALSE,FALSE,FALSE,everyone
3546719005,Afternoon Ride,Ride,Ride,Ride,FALSE,,,"Mon, 6/1/2020",1591021742,2020-06-01T02:29:02+0000,Mon,35.48,35480,35.48,kilometers,km,1:27:12,5232,1:38:03,5883,FALSE,https://d3o5xota0a1fcr.cloudfront.net/v6/maps/RAVGR3U6P3XYQNBCPL3VBEZHKODPWGZJT2H7PFWXRRP4RPPJM4JGMCQQE7FBRWTPCJHMU23ZIAU3YASI3QSAFIN22GPCYA5U,TRUE,FALSE,693,m,693,,https://www.strava.com/activities/3546719005,https://www.strava.com/activities/3546719005?utm_content=1464505&utm_medium=referral&utm_source=twitter,went for a 35.4 kilometer Ride.,TRUE,FALSE,,1379,,FALSE,FALSE,FALSE,FALSE,everyone
3539121531,Morning Run,Run,Run,Run,FALSE,,,"Sun, 5/31/2020",1590922727,2020-05-30T22:58:47+0000,Sun,25.18,25179,25.179,kilometers,km,2:59:27,10767,3:36:21,12981,FALSE,https://d3o5xota0a1fcr.cloudfront.net/v6/maps/AN6IG34L2QYQOP4PXF34672DPW2QCR4DYF2NAEJUS2XXYVLSLPUIOTKDP2XNTTRJXPAJJ3NNGU43YQJFJ6CBMFX5PSM4FONV,TRUE,FALSE,951,m,951,,https://www.strava.com/activities/3539121531,https://www.strava.com/activities/3539121531?utm_content=1464505&utm_medium=referral&utm_source=twitter,went for a 25.1 kilometer Run.,TRUE,FALSE,,2857,0,FALSE,FALSE,FALSE,FALSE,everyone
3527428322,Lunch Activity,WeightTraining,Weight Training,Workout,FALSE,,,"Wed, 5/27/2020",1590581620,2020-05-27T19:13:40+0000,Wed,0,0,0,kilometers,km,1:31:34,5494,1:31:34,5494,TRUE,,FALSE,FALSE,0,m,0,,https://www.strava.com/activities/3527428322,https://www.strava.com/activities/3527428322?utm_content=1464505&utm_medium=referral&utm_source=twitter,went for a 0 kilometer Weight Training.,TRUE,FALSE,,1199,30,FALSE,FALSE,FALSE,FALSE,everyone
3512319229,Lunch Run,Run,Run,Run,FALSE,,,"Tue, 5/26/2020",1590497902,2020-05-26T00:58:22+0000,Tue,9.26,9265,9.265,kilometers,km,46:21:00,2781,50:55:00,3055,FALSE,https://d3o5xota0a1fcr.cloudfront.net/v6/maps/XDRKCPY76CXBYPXA5MQN24RY2OSZXN4CHDHO4NJNRFSQJR6CSLQGERZ5QM4OC2ADFBJFLK7Z5V3A2X6NNALYCQITPYR3KQ7K,TRUE,FALSE,113,m,113,,https://www.strava.com/activities/3512319229,https://www.strava.com/activities/3512319229?utm_content=1464505&utm_medium=referral&utm_source=twitter,went for a 9.2 kilometer Run.,TRUE,FALSE,,826,,FALSE,FALSE,FALSE,FALSE,everyone
3514244875,Night Activity,WeightTraining,Weight Training,Workout,FALSE,,,"Tue, 5/26/2020",1590457969,2020-05-26T08:52:49+0000,Tue,0,0,0,kilometers,km,1:14:08,4448,1:14:08,4448,TRUE,,FALSE,FALSE,0,m,0,,https://www.strava.com/activities/3514244875,https://www.strava.com/activities/3514244875?utm_content=1464505&utm_medium=referral&utm_source=twitter,went for a 0 kilometer Weight Training.,TRUE,FALSE,,578,30,FALSE,FALSE,FALSE,FALSE,everyone
3501066939,Lunch Run,Run,Run,Run,FALSE,,,"Sun, 5/24/2020",1590321090,2020-05-23T23:51:30+0000,Sun,11.46,11461,11.461,kilometers,km,53:18:00,3198,57:42:00,3462,FALSE,https://d3o5xota0a1fcr.cloudfront.net/v6/maps/P3VHNZOGIQBIRCZHHCS4EXQTMCJIWVB6KLLPYSHHSX65ERQSWGQTVV2WW3LMGBXJIKUKOTTDQMGCT4UEPQKPULNNPZBYG5UP,TRUE,FALSE,181,m,181,,https://www.strava.com/activities/3501066939,https://www.strava.com/activities/3501066939?utm_content=1464505&utm_medium=referral&utm_source=twitter,went for a 11.4 kilometer Run.,TRUE,FALSE,,991,,FALSE,FALSE,FALSE,FALSE,everyone
3496006674,Morning Ride,Ride,Ride,Ride,FALSE,,,"Sat, 5/23/2020",1590227994,2020-05-22T21:59:54+0000,Sat,88.38,88379,88.379,kilometers,km,3:06:26,11186,3:27:17,12437,FALSE,https://d3o5xota0a1fcr.cloudfront.net/v6/maps/UIFKQFEBFCNKGKTBSISNH4TM5HLMW4F7UGS7ZLKJFHOKDUBUNWLYRAB627OCRWCTRQI7HXH7LG2JVDQF46QH5OPS4WSR2IY7,TRUE,FALSE,"1,004",m,1004,,https://www.strava.com/activities/3496006674,https://www.strava.com/activities/3496006674?utm_content=1464505&utm_medium=referral&utm_source=twitter,went for a 88.3 kilometer Ride.,TRUE,FALSE,,2364,10,FALSE,FALSE,FALSE,FALSE,everyone
3492670988,Night Activity,WeightTraining,Weight Training,Workout,FALSE,,,"Fri, 5/22/2020",1590105613,2020-05-22T07:00:13+0000,Fri,0,0,0,kilometers,km,1:36:34,5794,1:36:34,5794,TRUE,,FALSE,FALSE,0,m,0,,https://www.strava.com/activities/3492670988,https://www.strava.com/activities/3492670988?utm_content=1464505&utm_medium=referral&utm_source=twitter,went for a 0 kilometer Weight Training.,TRUE,FALSE,,793,30,FALSE,FALSE,FALSE,FALSE,everyone
3486808325,Evening Run,Run,Run,Run,FALSE,,,"Thu, 5/21/2020",1590093046,2020-05-21T08:30:46+0000,Thu,10.42,10420,10.42,kilometers,km,49:47:00,2987,52:28:00,3148,FALSE,https://d3o5xota0a1fcr.cloudfront.net/v6/maps/YETIDSJ7HXTOJ37KCPB574KFBLT7H4LA7B7SV2RD2TRWFYNO27KP3AGFVH6AOJB7N7X5OCZ66A7ABRNQANLKIK5WQSMJ3A2Q,TRUE,FALSE,117,m,117,,https://www.strava.com/activities/3486808325,https://www.strava.com/activities/3486808325?utm_content=1464505&utm_medium=referral&utm_source=twitter,went for a 10.4 kilometer Run.,TRUE,FALSE,,874,,FALSE,FALSE,FALSE,FALSE,everyone
3479183853,Morning Run,Run,Run,Run,FALSE,,,"Wed, 5/20/2020",1589960824,2020-05-19T19:47:04+0000,Wed,4.77,4770,4.77,kilometers,km,22:11,1331,22:24,1344,FALSE,https://d3o5xota0a1fcr.cloudfront.net/v6/maps/7DDLNIFYZXT2EXMIDTGD3WUT76PRRTBHLI6NJZ2342E2EOE42ZVM5CMCUXRL6J2RXI3BJ5BC7K7N65CVYVXROFYQ36L2UVAU,TRUE,FALSE,63,m,63,,https://www.strava.com/activities/3479183853,https://www.strava.com/activities/3479183853?utm_content=1464505&utm_medium=referral&utm_source=twitter,went for a 4.7 kilometer Run.,TRUE,FALSE,,427,,FALSE,FALSE,FALSE,FALSE,everyone
3861966019,Night Activity,WeightTraining,Weight Training,Workout,FALSE,,,"Tue, 8/4/2020",1596502169,2020-08-04T07:49:29+0000,Tue,0,0,0,kilometers,km,1:15:10,4510,1:15:10,4510,TRUE,,FALSE,FALSE,0,m,0,,https://www.strava.com/activities/3861966019,https://www.strava.com/activities/3861966019?utm_content=1464505&utm_medium=referral&utm_source=twitter,went for a 0 kilometer Weight Training.,TRUE,FALSE,,588,30,FALSE,FALSE,FALSE,FALSE,everyone
3845892002,Lunch Ride,Ride,Ride,Ride,FALSE,,,"Sat, 8/1/2020",1596280055,2020-07-31T23:07:35+0000,Sat,60.56,60566,60.566,kilometers,km,2:13:19,7999,2:29:34,8974,FALSE,https://d3o5xota0a1fcr.cloudfront.net/v6/maps/4UY542EHR7PESZJYSFND4RVZ4P5RK2VDUVQZLO6N6XILAA65FHJV5JVS64FUREBE2AH24723RJCOZPHASTWRA4XY6DACNMPI,TRUE,FALSE,883,m,883,,https://www.strava.com/activities/3845892002,https://www.strava.com/activities/3845892002?utm_content=1464505&utm_medium=referral&utm_source=twitter,went for a 60.5 kilometer Ride.,TRUE,FALSE,,1346,,FALSE,FALSE,FALSE,FALSE,everyone
3825505190,Morning Run,Run,Run,Run,FALSE,,,"Tue, 7/28/2020",1595924303,2020-07-27T20:18:23+0000,Tue,7.38,7379,7.379,kilometers,km,4:27:25,16045,4:32:53,16373,FALSE,https://d3o5xota0a1fcr.cloudfront.net/v6/maps/7OWGECW2LVDMIR37XTRDF6HO5DUKXDN23OJCYKK5RMDIWE4ISPK75F6MS5HV4PPDKE77DQQAZOZH3DJKRFLSXMJ7H2VAV6PA,TRUE,FALSE,714,m,714,,https://www.strava.com/activities/3825505190,https://www.strava.com/activities/3825505190?utm_content=1464505&utm_medium=referral&utm_source=twitter,went for a 7.3 kilometer Run.,TRUE,FALSE,,1630,,FALSE,FALSE,FALSE,FALSE,everyone
3809845390,Lunch Run,Run,Run,Run,FALSE,,,"Sat, 7/25/2020",1595679582,2020-07-25T00:19:42+0000,Sat,5.46,5465,5.465,kilometers,km,1:06:13,3973,1:18:38,4718,FALSE,https://d3o5xota0a1fcr.cloudfront.net/v6/maps/FBX37APXGMNFWEA7KWWY6ZHECTGEF67FJQAZANGSXDUWV3JNURYCX3HAWLUJJ44SD6ZBC35LIDMQUCZ7J4SCAX23JQ2KOM3O,TRUE,FALSE,399,m,399,,https://www.strava.com/activities/3809845390,https://www.strava.com/activities/3809845390?utm_content=1464505&utm_medium=referral&utm_source=twitter,went for a 5.4 kilometer Run.,TRUE,FALSE,,704,,FALSE,FALSE,FALSE,FALSE,everyone
3795428006,Night Activity,WeightTraining,Weight Training,Workout,FALSE,,,"Tue, 7/21/2020",1595289765,2020-07-21T07:02:45+0000,Tue,0,0,0,kilometers,km,2:20:29,8429,2:20:29,8429,TRUE,,FALSE,FALSE,0,m,0,,https://www.strava.com/activities/3795428006,https://www.strava.com/activities/3795428006?utm_content=1464505&utm_medium=referral&utm_source=twitter,went for a 0 kilometer Weight Training.,TRUE,FALSE,,625,30,FALSE,FALSE,FALSE,FALSE,everyone
3782692850,Morning Run,Run,Run,Run,FALSE,,,"Sun, 7/19/2020",1595149245,2020-07-18T21:00:45+0000,Sun,20.54,20542,20.542,kilometers,km,1:53:04,6784,1:53:09,6789,FALSE,https://d3o5xota0a1fcr.cloudfront.net/v6/maps/NZIEWQSAHWZM5BWFWABM74MXUAS2AQCIXQKL4CDCZVUQNO5C3WD63MKMQTGV5ARMM5FOCBPP32LEIHJP2KXDNAKWKHUU6G2U,TRUE,FALSE,470,m,470,,https://www.strava.com/activities/3782692850,https://www.strava.com/activities/3782692850?utm_content=1464505&utm_medium=referral&utm_source=twitter,went for a 20.5 kilometer Run.,TRUE,FALSE,,2152,,FALSE,FALSE,FALSE,FALSE,everyone
3781003961,Afternoon Ride,Ride,Ride,Ride,FALSE,,,"Sat, 7/18/2020",1595080154,2020-07-18T01:49:14+0000,Sat,14.78,14782,14.782,kilometers,km,33:13:00,1993,36:03:00,2163,FALSE,https://d3o5xota0a1fcr.cloudfront.net/v6/maps/2GL5TW6VWI4HJT44XZRMBO6N3TPI2QBJULKAVDN3SLMKVTCQSRWSVRA736TIWCKI5HWD5ZOHD7HEUIYHM5FKKQW73DCILP6J,TRUE,FALSE,148,m,148,,https://www.strava.com/activities/3781003961,https://www.strava.com/activities/3781003961?utm_content=1464505&utm_medium=referral&utm_source=twitter,went for a 14.7 kilometer Ride.,TRUE,FALSE,,254,,FALSE,FALSE,FALSE,FALSE,everyone
3759523014,Tuesday Tune Up,Run,Run,Run,FALSE,,,"Tue, 7/14/2020",1594752629,2020-07-14T06:50:29+0000,Tue,9.32,9325,9.325,kilometers,km,45:41:00,2741,50:30:00,3030,FALSE,https://d3o5xota0a1fcr.cloudfront.net/v6/maps/R2D5SGDQ6DU6OPD6I66VATF5G2TZEWOTXHID7XR5L4DQLXLU2H7P3IZFPDGIHXY6MWATXC4DRHVZFJT7FK6AM6WZ55M6N4NH,TRUE,FALSE,227,m,227,,https://www.strava.com/activities/3759523014,https://www.strava.com/activities/3759523014?utm_content=1464505&utm_medium=referral&utm_source=twitter,went for a 9.3 kilometer Run.,TRUE,FALSE,,1017,0,FALSE,FALSE,FALSE,FALSE,everyone
3748880995,Afternoon Ride,Ride,Ride,Ride,FALSE,,,"Sun, 7/12/2020",1594560608,2020-07-12T01:30:08+0000,Sun,44.5,44508,44.508,kilometers,km,1:36:49,5809,1:46:09,6369,FALSE,https://d3o5xota0a1fcr.cloudfront.net/v6/maps/XJI6CIWLMMCYH6JT35WFGOSE5J5KM2ATBLI6FFFJVZHYBUMLZCNXI45SSYKMZE2IMYMDD553WUXSVHNO4FBRUCP35BCZVZYN,TRUE,FALSE,442,m,442,,https://www.strava.com/activities/3748880995,https://www.strava.com/activities/3748880995?utm_content=1464505&utm_medium=referral&utm_source=twitter,went for a 44.5 kilometer Ride.,TRUE,FALSE,,1221,,FALSE,FALSE,FALSE,FALSE,everyone
3744188324,Lunch Run,Run,Run,Run,FALSE,,,"Sat, 7/11/2020",1594469835,2020-07-11T00:17:15+0000,Sat,17.02,17028,17.028,kilometers,km,1:19:27,4767,1:29:23,5363,FALSE,https://d3o5xota0a1fcr.cloudfront.net/v6/maps/IMRP73WRW2YO77CZMMSOHNI4FZCPEY5CMOFUGMNP2NB36OPGKGNJTK2AH75GKH4WY5YGK5PRIGYTSRFQMOYBYZWRIOJDIXDD,TRUE,FALSE,131,m,131,,https://www.strava.com/activities/3744188324,https://www.strava.com/activities/3744188324?utm_content=1464505&utm_medium=referral&utm_source=twitter,went for a 17.0 kilometer Run.,TRUE,FALSE,,1355,,FALSE,FALSE,FALSE,FALSE,everyone
3714883904,Morning Ride,Ride,Ride,Ride,FALSE,,,"Sun, 7/5/2020",1593944336,2020-07-04T22:18:56+0000,Sun,42.14,42140,42.14,kilometers,km,1:36:09,5769,2:17:57,8277,FALSE,https://d3o5xota0a1fcr.cloudfront.net/v6/maps/WJIWEQVNSMELGLKPYX5DSPKLFZ5FXQAUGDJU6XFDMLH5LESP7R24RK7I6G3YPWTB5OSPGJ5ZOWOTUC4WCL6VEU5TLLLQ6YVD,TRUE,FALSE,527,m,527,,https://www.strava.com/activities/3714883904,https://www.strava.com/activities/3714883904?utm_content=1464505&utm_medium=referral&utm_source=twitter,went for a 42.1 kilometer Ride.,TRUE,FALSE,,708,,FALSE,FALSE,FALSE,FALSE,everyone
3710157456,Afternoon Ride,Ride,Ride,Ride,FALSE,,,"Sat, 7/4/2020",1593882269,2020-07-04T05:04:29+0000,Sat,15.63,15637,15.637,kilometers,km,37:00:00,2220,44:20:00,2660,FALSE,https://d3o5xota0a1fcr.cloudfront.net/v6/maps/YQPN7OUKCS44IVKE2VBCLSSBQL7JT5Y4GW3ZLLCZSZ3YTP6LPK4XBYPSKL7GUHZKKUNBM7NXV5LJRMF64PGWGEUS2VB44T5I,TRUE,FALSE,212,m,212,,https://www.strava.com/activities/3710157456,https://www.strava.com/activities/3710157456?utm_content=1464505&utm_medium=referral&utm_source=twitter,went for a 15.6 kilometer Ride.,TRUE,FALSE,,323,,FALSE,FALSE,FALSE,FALSE,everyone
3687120509,Night Activity,WeightTraining,Weight Training,Workout,FALSE,,,"Sun, 6/28/2020",1593387816,2020-06-29T06:43:36+0000,Sun,0,0,0,kilometers,km,1:31:19,5479,1:31:19,5479,TRUE,,FALSE,FALSE,0,m,0,,https://www.strava.com/activities/3687120509,https://www.strava.com/activities/3687120509?utm_content=1464505&utm_medium=referral&utm_source=twitter,went for a 0 kilometer Weight Training.,TRUE,FALSE,,724,30,FALSE,FALSE,FALSE,FALSE,everyone
3685726030,Afternoon Ride,Ride,Ride,Ride,FALSE,,,"Sun, 6/28/2020",1593363043,2020-06-28T04:50:43+0000,Sun,19.81,19814,19.814,kilometers,km,40:44:00,2444,42:39:00,2559,FALSE,https://d3o5xota0a1fcr.cloudfront.net/v6/maps/IRM2SXCPFRWPCOM3HXASBGDSEDDH5W7SD2IV4SKOE3PEGTJIO2QR6ARQ5SXG7WQYPAVIWPW7T2CFNWNKFLZ364MRUVM5B6NS,TRUE,FALSE,771,m,771,,https://www.strava.com/activities/3685726030,https://www.strava.com/activities/3685726030?utm_content=1464505&utm_medium=referral&utm_source=twitter,went for a 19.8 kilometer Ride.,TRUE,FALSE,,270,,FALSE,FALSE,FALSE,FALSE,everyone
3662770192,Night Activity,WeightTraining,Weight Training,Workout,FALSE,,,"Tue, 6/23/2020",1592952533,2020-06-24T05:48:53+0000,Tue,0,0,0,kilometers,km,1:48:53,6533,1:48:53,6533,TRUE,,FALSE,FALSE,0,m,0,,https://www.strava.com/activities/3662770192,https://www.strava.com/activities/3662770192?utm_content=1464505&utm_medium=referral&utm_source=twitter,went for a 0 kilometer Weight Training.,TRUE,FALSE,,875,30,FALSE,FALSE,FALSE,FALSE,everyone
3657399757,Evening Run,Run,Run,Run,FALSE,,,"Tue, 6/23/2020",1592938174,2020-06-23T06:49:34+0000,Tue,14.02,14027,14.027,kilometers,km,1:06:22,3982,1:19:13,4753,FALSE,https://d3o5xota0a1fcr.cloudfront.net/v6/maps/DJNSIHJX55DL6L76WYJNF4ACVESYZMFA5EHJVJGCNT6TZCWHLYBBIWHTFM3JBKPCDSGWXG4A6CVKGOZVZG4LXTKUMAVOUWVI,TRUE,FALSE,146,m,146,,https://www.strava.com/activities/3657399757,https://www.strava.com/activities/3657399757?utm_content=1464505&utm_medium=referral&utm_source=twitter,went for a 14.0 kilometer Run.,TRUE,FALSE,,1146,,FALSE,FALSE,FALSE,FALSE,everyone
3651841577,Afternoon Activity,WeightTraining,Weight Training,Workout,FALSE,,,"Sat, 6/20/2020",1592672249,2020-06-20T23:57:29+0000,Sat,0,0,0,kilometers,km,1:40:18,6018,1:40:18,6018,TRUE,,FALSE,FALSE,0,m,0,,https://www.strava.com/activities/3651841577,https://www.strava.com/activities/3651841577?utm_content=1464505&utm_medium=referral&utm_source=twitter,went for a 0 kilometer Weight Training.,TRUE,FALSE,,696,30,FALSE,FALSE,FALSE,FALSE,everyone
3640825242,Lunch Run,Run,Run,Run,FALSE,,,"Sat, 6/20/2020",1592654374,2020-06-19T23:59:34+0000,Sat,17.1,17108,17.108,kilometers,km,1:19:40,4780,1:26:10,5170,FALSE,https://d3o5xota0a1fcr.cloudfront.net/v6/maps/JQ25UM2MN3THCHKPT52KJCO6HUIV32O2J6MYFGRD552SIORQRXVMJZB5H5LKFYYCN3OMVZZTVTB6EAN4N7MX7U2HJFSERX7B,TRUE,FALSE,257,m,257,,https://www.strava.com/activities/3640825242,https://www.strava.com/activities/3640825242?utm_content=1464505&utm_medium=referral&utm_source=twitter,went for a 17.1 kilometer Run.,TRUE,FALSE,,1402,,FALSE,FALSE,FALSE,FALSE,everyone
3622264558,Evening Run,Run,Run,Run,FALSE,,,"Tue, 6/16/2020",1592331494,2020-06-16T06:18:14+0000,Tue,11,11005,11.005,kilometers,km,49:35:00,2975,55:08:00,3308,FALSE,https://d3o5xota0a1fcr.cloudfront.net/v6/maps/K5Z52ULVXSVVUPL24B2VX6WQNPU4L7Q4PVDTE242CQV465CFGNCNP54OT6YDV73WPDMH6OOHZNWE2W57YHSTVMODNLEAD723,TRUE,FALSE,120,m,120,,https://www.strava.com/activities/3622264558,https://www.strava.com/activities/3622264558?utm_content=1464505&utm_medium=referral&utm_source=twitter,went for a 11.0 kilometer Run.,TRUE,FALSE,,892,,FALSE,FALSE,FALSE,FALSE,everyone
3627983612,Lunch Activity,WeightTraining,Weight Training,Workout,FALSE,,,"Tue, 6/16/2020",1592307495,2020-06-16T18:38:15+0000,Tue,0,0,0,kilometers,km,1:41:15,6075,1:41:15,6075,TRUE,,FALSE,FALSE,0,m,0,,https://www.strava.com/activities/3627983612,https://www.strava.com/activities/3627983612?utm_content=1464505&utm_medium=referral&utm_source=twitter,went for a 0 kilometer Weight Training.,TRUE,FALSE,,705,30,FALSE,FALSE,FALSE,FALSE,everyone
4091038708,Afternoon Ride,Ride,Ride,Ride,FALSE,,,"Sun, 9/20/2020",1600612100,2020-09-20T02:28:20+0000,Sun,20.68,20682,20.682,kilometers,km,40:27:00,2427,58:57:00,3537,FALSE,https://d3o5xota0a1fcr.cloudfront.net/v6/maps/OLBIMJ5AO4VJOLENC2TPKZGTU2KEZLOVI5JNZBSYF4JANXG2R56DAMRLRVULJ5TRYRD3STRPLT3IJK4QGRFYJHPKCAV5UUTQ,TRUE,FALSE,219,m,219,,https://www.strava.com/activities/4091038708,https://www.strava.com/activities/4091038708?utm_content=1464505&utm_medium=referral&utm_source=twitter,went for a 20.6 kilometer Ride.,TRUE,FALSE,,669,,FALSE,FALSE,FALSE,FALSE,everyone
4067825930,Afternoon Ride,Ride,Ride,Ride,FALSE,,,"Wed, 9/16/2020",1600277644,2020-09-16T05:34:04+0000,Wed,31.74,31746,31.746,kilometers,km,1:04:50,3890,1:10:32,4232,FALSE,https://d3o5xota0a1fcr.cloudfront.net/v6/maps/T2SRNFWJ3YNRD5BTS7OQ3537DUQWQIIRCJKVNVNTF6FBTP3KDGLLJZMIABFDHS25NUACZOOSUVXQZFMLEM3GC72AE6XSFYLK,TRUE,FALSE,343,m,343,,https://www.strava.com/activities/4067825930,https://www.strava.com/activities/4067825930?utm_content=1464505&utm_medium=referral&utm_source=twitter,went for a 31.7 kilometer Ride.,TRUE,FALSE,,964,,FALSE,FALSE,FALSE,FALSE,everyone
4051703139,Morning Run,Run,Run,Run,FALSE,,,"Sun, 9/13/2020",1599994263,2020-09-12T22:51:03+0000,Sun,15.69,15698,15.698,kilometers,km,2:07:20,7640,2:24:51,8691,FALSE,https://d3o5xota0a1fcr.cloudfront.net/v6/maps/NLTDR6K7QJH6BHQWVVN5LLRRJO7WMAXBAVVVT4WYDLLFQG3C2NDK6X7QLTOAUWTJTL5OUNU7M5CIJADHQMMNYRUAAUS3PGGY,TRUE,FALSE,598,m,598,,https://www.strava.com/activities/4051703139,https://www.strava.com/activities/4051703139?utm_content=1464505&utm_medium=referral&utm_source=twitter,went for a 15.6 kilometer Run.,TRUE,FALSE,,1619,,FALSE,FALSE,FALSE,FALSE,everyone
4050049498,Afternoon Ride,Ride,Ride,Ride,FALSE,,,"Sat, 9/12/2020",1599916810,2020-09-12T01:20:10+0000,Sat,31.39,31395,31.395,kilometers,km,2:08:50,7730,3:16:24,11784,FALSE,https://d3o5xota0a1fcr.cloudfront.net/v6/maps/KPH7ND4SK73BPODSNSTQDVXUJTDMENWINRELTIPV2JIAL5VE3QED3WD5QDYVMXL6QQ4ZP3JAPDW3ZCUVMSI6LTTCVK34DZU6,TRUE,FALSE,"1,018",m,1018,,https://www.strava.com/activities/4050049498,https://www.strava.com/activities/4050049498?utm_content=1464505&utm_medium=referral&utm_source=twitter,went for a 31.3 kilometer Ride.,TRUE,FALSE,,2035,,FALSE,FALSE,FALSE,FALSE,everyone
4030089866,Afternoon Ride,Ride,Ride,Ride,FALSE,,,"Tue, 9/8/2020",1599586124,2020-09-08T05:28:44+0000,Tue,24.97,24972,24.972,kilometers,km,1:04:37,3877,1:14:22,4462,FALSE,https://d3o5xota0a1fcr.cloudfront.net/v6/maps/ULIK732Y6MIXGQKCK5HKLXIZ2L25B6KYHGULFSESABRTKQK4HLED5RMYB3ZH6UX4JNJQG3ZYJBSV7ZB3I6YF76GWJF6YGHNT,TRUE,FALSE,562,m,562,,https://www.strava.com/activities/4030089866,https://www.strava.com/activities/4030089866?utm_content=1464505&utm_medium=referral&utm_source=twitter,went for a 24.9 kilometer Ride.,TRUE,FALSE,,944,,FALSE,FALSE,FALSE,FALSE,everyone
4013201070,Morning Ride,Ride,Ride,Ride,FALSE,,,"Sat, 9/5/2020",1599299823,2020-09-04T21:57:03+0000,Sat,78.49,78498,78.498,kilometers,km,3:51:42,13902,5:58:43,21523,FALSE,https://d3o5xota0a1fcr.cloudfront.net/v6/maps/PLGQREIOIZBCUOISD4U7PDPNCA6WCI62HPOZ32OB7KFTZUMWCWPPQXT2MFRGLN4X5ABWENYJWTCXRKS3ZGUFJYWA4Q3QEGSM,TRUE,FALSE,"1,909",m,1909,,https://www.strava.com/activities/4013201070,https://www.strava.com/activities/4013201070?utm_content=1464505&utm_medium=referral&utm_source=twitter,went for a 78.4 kilometer Ride.,TRUE,FALSE,,3426,,FALSE,FALSE,FALSE,FALSE,everyone
4002704040,Morning Ride,Ride,Ride,Ride,FALSE,,,"Thu, 9/3/2020",1599115673,2020-09-02T18:47:53+0000,Thu,39.69,39692,39.692,kilometers,km,1:16:32,4592,1:34:14,5654,FALSE,https://d3o5xota0a1fcr.cloudfront.net/v6/maps/WAV5GOULHP3R6KHCACIQ4G5FHPTTXQNDWIDX5M2XMLT6BGIBXONWSZJ5RFRU5TMHLZMDRIOL7KB4HM4XXBLKMRAJOY37AXND,TRUE,FALSE,233,m,233,,https://www.strava.com/activities/4002704040,https://www.strava.com/activities/4002704040?utm_content=1464505&utm_medium=referral&utm_source=twitter,went for a 39.6 kilometer Ride.,TRUE,FALSE,,1201,,FALSE,FALSE,FALSE,FALSE,everyone
3985877937,Morning Run,Run,Run,Run,FALSE,,,"Sun, 8/30/2020",1598781850,2020-08-29T22:04:10+0000,Sun,15.99,15989,15.989,kilometers,km,3:13:29,11609,3:52:20,13940,FALSE,https://d3o5xota0a1fcr.cloudfront.net/v6/maps/U67ABG3FR6WJ4G2JFNHLNK6Z5HU4KZUUDTWB7AIF3ZFWB5HTHQ2RWHQXWBUJF3ZIMDWE3YP6IY2ESRSG2GYT6ELRU34AQYQN,TRUE,FALSE,755,m,755,,https://www.strava.com/activities/3985877937,https://www.strava.com/activities/3985877937?utm_content=1464505&utm_medium=referral&utm_source=twitter,went for a 15.9 kilometer Run.,TRUE,FALSE,,2076,,FALSE,FALSE,FALSE,FALSE,everyone
3980145770,Lunch Ride,Ride,Ride,Ride,FALSE,,,"Sat, 8/29/2020",1598703435,2020-08-29T00:17:15+0000,Sat,74.15,74153,74.153,kilometers,km,2:42:01,9721,3:02:54,10974,FALSE,https://d3o5xota0a1fcr.cloudfront.net/v6/maps/JI5SWQWRKDR3NW4UZNNZ3V3RGQV6SRWPKE2CHZLQ2M53QGDDARL4CTBZIZ7HWAEJCG5ZL2EJHJEXE4IVEECO2PWPDI4RLZXN,TRUE,FALSE,994,m,994,,https://www.strava.com/activities/3980145770,https://www.strava.com/activities/3980145770?utm_content=1464505&utm_medium=referral&utm_source=twitter,went for a 74.1 kilometer Ride.,TRUE,FALSE,,2102,,FALSE,FALSE,FALSE,FALSE,everyone
3976357060,Afternoon Ride,Ride,Ride,Ride,FALSE,,,"Fri, 8/28/2020",1598636652,2020-08-28T05:44:12+0000,Fri,18.68,18686,18.686,kilometers,km,47:12:00,2832,57:06:00,3426,FALSE,https://d3o5xota0a1fcr.cloudfront.net/v6/maps/QB62LBIKTCDSPJA7GEGK5QY76M4O2JV2LTPBAKH7JW2VLGMHL6KUYAYTLTMI5W5QKHYG5F3ZT4K5TZPD63LJLEJSWLOGIK2B,TRUE,FALSE,166,m,166,,https://www.strava.com/activities/3976357060,https://www.strava.com/activities/3976357060?utm_content=1464505&utm_medium=referral&utm_source=twitter,went for a 18.6 kilometer Ride.,TRUE,FALSE,,460,,FALSE,FALSE,FALSE,FALSE,everyone
3976342331,Afternoon Ride,Ride,Ride,Ride,FALSE,,,"Thu, 8/27/2020",1598550641,2020-08-27T05:50:41+0000,Thu,39.11,39109,39.109,kilometers,km,1:17:00,4620,1:18:10,4690,FALSE,https://d3o5xota0a1fcr.cloudfront.net/v6/maps/ELPKA2Q4K6XLVMRBVJMKTGTB7FZ2HEK2SR7NQA4JJNUKYO6YXJWTR3JE6XQVZL3CGE6W6JAKCIGSPNQZPIKXB3C4R6PP2ZXC,TRUE,FALSE,120,m,120,,https://www.strava.com/activities/3976342331,https://www.strava.com/activities/3976342331?utm_content=1464505&utm_medium=referral&utm_source=twitter,went for a 39.1 kilometer Ride.,TRUE,FALSE,,1116,,FALSE,FALSE,FALSE,FALSE,everyone
3952234371,Morning Ride,Ride,Ride,Ride,FALSE,,,"Sun, 8/23/2020",1598179077,2020-08-22T22:37:57+0000,Sun,41.66,41660,41.66,kilometers,km,1:56:13,6973,2:30:23,9023,FALSE,https://d3o5xota0a1fcr.cloudfront.net/v6/maps/HNOSMSADCLIYUFXT64YWWTWRIO22I5GY5DY7MLLVNJU6HHYNLQA2B7KOFU2X43MWP7G44IK57OR7VUORWFIUSQLIFLBYTUSA,TRUE,FALSE,745,m,745,,https://www.strava.com/activities/3952234371,https://www.strava.com/activities/3952234371?utm_content=1464505&utm_medium=referral&utm_source=twitter,went for a 41.6 kilometer Ride.,TRUE,FALSE,,1517,,FALSE,FALSE,FALSE,FALSE,everyone
3947630644,Lunch Ride,Ride,Ride,Ride,FALSE,,,"Sat, 8/22/2020",1598095747,2020-08-21T23:29:07+0000,Sat,110.17,110175,110.175,kilometers,km,4:20:03,15603,4:52:10,17530,FALSE,https://d3o5xota0a1fcr.cloudfront.net/v6/maps/ALLH2QCBS3ZMTUIXHEO3TAPVS7VBIB7KQS4ZRQIFOWFQV2QZB574XAWNDNDL7ATSSCSIQO65LJP5MXHJOWYX3UM3GAK2FFW5,TRUE,FALSE,"1,801",m,1801,,https://www.strava.com/activities/3947630644,https://www.strava.com/activities/3947630644?utm_content=1464505&utm_medium=referral&utm_source=twitter,went for a 110.1 kilometer Ride.,TRUE,FALSE,,3369,,FALSE,FALSE,FALSE,FALSE,everyone
3939216165,Afternoon Ride,Ride,Ride,Ride,FALSE,,,"Thu, 8/20/2020",1597946293,2020-08-20T05:58:13+0000,Thu,35.38,35381,35.381,kilometers,km,1:09:48,4188,1:11:42,4302,FALSE,https://d3o5xota0a1fcr.cloudfront.net/v6/maps/SUSX2SPFIN7PHXLBYZUHF3VNVLQ3OPP4RMI4YS24Q2RAPDFE5YJPWCJY7SWYTBHIUNDIU557O4TU4C4P6K3PE2WHGKNFBX3K,TRUE,FALSE,334,m,334,,https://www.strava.com/activities/3939216165,https://www.strava.com/activities/3939216165?utm_content=1464505&utm_medium=referral&utm_source=twitter,went for a 35.3 kilometer Ride.,TRUE,FALSE,,1034,,FALSE,FALSE,FALSE,FALSE,everyone
3930131147,Afternoon Ride,Ride,Ride,Ride,FALSE,,,"Tue, 8/18/2020",1597772704,2020-08-18T05:45:04+0000,Tue,22.12,22122,22.122,kilometers,km,18:00,1080,58:58:00,3538,FALSE,https://d3o5xota0a1fcr.cloudfront.net/v6/maps/DVL4I4VB427BKEMTQOKFD42WUIKHE7EW4X4ULY5E4TN4REZS4II6AQPM6KVILX7QG2252SW5XTVQQWYCRG7ARJIXX4IS25YG,TRUE,FALSE,425,m,425,,https://www.strava.com/activities/3930131147,https://www.strava.com/activities/3930131147?utm_content=1464505&utm_medium=referral&utm_source=twitter,went for a 22.1 kilometer Ride.,TRUE,FALSE,,780,,FALSE,FALSE,FALSE,FALSE,everyone
3919149423,Morning Ride,Ride,Ride,Ride,FALSE,,,"Sun, 8/16/2020",1597575082,2020-08-15T22:51:22+0000,Sun,78.43,78434,78.434,kilometers,km,2:46:03,9963,3:06:05,11165,FALSE,https://d3o5xota0a1fcr.cloudfront.net/v6/maps/K6JCOK7KRJIKEOAT2INXUFNKD5QPY57UG6FTTZOXLZ7KGIIGCHYOSPASTI4RMC5CBS7TSCJ6GBOSPVGJNMU5CUHBV6RD7L64,TRUE,FALSE,654,m,654,,https://www.strava.com/activities/3919149423,https://www.strava.com/activities/3919149423?utm_content=1464505&utm_medium=referral&utm_source=twitter,went for a 78.4 kilometer Ride.,TRUE,FALSE,,2150,,FALSE,FALSE,FALSE,FALSE,everyone
3914471412,Lunch Ride,Ride,Ride,Ride,FALSE,,,"Sat, 8/15/2020",1597489492,2020-08-14T23:04:52+0000,Sat,107.31,107311,107.311,kilometers,km,4:08:42,14922,4:44:18,17058,FALSE,https://d3o5xota0a1fcr.cloudfront.net/v6/maps/BYQ2BARZEGL3YKQWYTCI3VXAKIDSOA4QF7HWMM3Y6EPRKHCJWO33GXZ77GSLT3Z7PTOM4UYTYNDRETQOVRVHTJLJ5MZH2WBG,TRUE,FALSE,"1,635",m,1635,,https://www.strava.com/activities/3914471412,https://www.strava.com/activities/3914471412?utm_content=1464505&utm_medium=referral&utm_source=twitter,went for a 107.3 kilometer Ride.,TRUE,FALSE,,3803,,FALSE,FALSE,FALSE,FALSE,everyone
3905835757,Evening Ride,Ride,Ride,Ride,FALSE,,,"Thu, 8/13/2020",1597342546,2020-08-13T06:15:46+0000,Thu,20.65,20653,20.653,kilometers,km,44:23:00,2663,47:37:00,2857,FALSE,https://d3o5xota0a1fcr.cloudfront.net/v6/maps/JQLDPZ4CQYQ455YNYGESJIXGGIP6UOUU7HXBQQ6SFN2Z47LOWA3FARZHIFYJTXP7N2K7OSRXVFWIO27IXVQFSIXP5TOYBNK6,TRUE,FALSE,211,m,211,,https://www.strava.com/activities/3905835757,https://www.strava.com/activities/3905835757?utm_content=1464505&utm_medium=referral&utm_source=twitter,went for a 20.6 kilometer Ride.,TRUE,FALSE,,364,,FALSE,FALSE,FALSE,FALSE,everyone
3885612761,Afternoon Ride,Ride,Ride,Ride,FALSE,,,"Sun, 8/9/2020",1596980022,2020-08-09T01:33:42+0000,Sun,43.74,43747,43.747,kilometers,km,1:36:55,5815,1:52:20,6740,FALSE,https://d3o5xota0a1fcr.cloudfront.net/v6/maps/JMODHIP6U5KXQKDJ4KEQHLIERHADJYTOC2UZ6BSNHOR2NOKEMDUVXSCRGNCC4VKKWPVY7TDZGRMBUV4GGNTH47DBBXI7E736,TRUE,FALSE,379,m,379,,https://www.strava.com/activities/3885612761,https://www.strava.com/activities/3885612761?utm_content=1464505&utm_medium=referral&utm_source=twitter,went for a 43.7 kilometer Ride.,TRUE,FALSE,,1224,,FALSE,FALSE,FALSE,FALSE,everyone
3880656868,Afternoon Ride,Ride,Ride,Ride,FALSE,,,"Sat, 8/8/2020",1596897070,2020-08-08T02:31:10+0000,Sat,40.66,40668,40.668,kilometers,km,1:17:29,4649,1:20:48,4848,FALSE,https://d3o5xota0a1fcr.cloudfront.net/v6/maps/3CJPRCVZE5HCXKVRLN73LYU2Q5AKD6MEYAYROHGIO4Y5SBGXDRNZ7UVHR7VJCX6GDSNLKTOCVYEJMRLV6YA7TACMREK2MZSV,TRUE,FALSE,149,m,149,,https://www.strava.com/activities/3880656868,https://www.strava.com/activities/3880656868?utm_content=1464505&utm_medium=referral&utm_source=twitter,went for a 40.6 kilometer Ride.,TRUE,FALSE,,1248,,FALSE,FALSE,FALSE,FALSE,everyone
3282202610,Lunch Ride,Ride,Ride,Ride,FALSE,,,"Fri, 4/10/2020",1586520607,2020-04-10T00:10:07+0000,Fri,15.8,15806,15.806,kilometers,km,50:42:00,3042,1:28:07,5287,FALSE,https://d3o5xota0a1fcr.cloudfront.net/v6/maps/TV4WMNGR3GCV46TCG43LPLU7GJZEUBEFKD4MQ3DE5SH6ARHGVNIYHQ6JKDZU6PRIJLWTCU3GLPPQVCLSVAIHREZYWKXFKSHZ,TRUE,FALSE,218,m,218,,https://www.strava.com/activities/3282202610,https://www.strava.com/activities/3282202610?utm_content=1464505&utm_medium=referral&utm_source=twitter,went for a 15.8 kilometer Ride.,TRUE,FALSE,,491,,FALSE,FALSE,FALSE,FALSE,everyone
3282200942,Evening Ride,Ride,Ride,Ride,FALSE,,,"Thu, 4/9/2020",1586457755,2020-04-09T06:42:35+0000,Thu,0.2,200,0.2,kilometers,km,2:16,136,53:25:00,3205,FALSE,https://d3o5xota0a1fcr.cloudfront.net/v6/maps/H53X6L6LC5U6VTK76MZI5DCJ3SMEBN27HMIMQSH2PAIGHD5S4FC4QKMSDWQCNUDY52GIFIYB644EVAL2JAMLCFUSU2ZCCS6K,TRUE,FALSE,4,m,4,,https://www.strava.com/activities/3282200942,https://www.strava.com/activities/3282200942?utm_content=1464505&utm_medium=referral&utm_source=twitter,went for a 0.2 kilometer Ride.,TRUE,FALSE,,695,,FALSE,FALSE,FALSE,FALSE,everyone
3265229850,Afternoon Run,Run,Run,Run,FALSE,,,"Tue, 4/7/2020",1586281651,2020-04-07T05:47:31+0000,Tue,16.3,16306,16.306,kilometers,km,1:16:47,4607,1:21:43,4903,FALSE,https://d3o5xota0a1fcr.cloudfront.net/v6/maps/3H2SYSKN66OW5P723JZTXZQIPMUFVKY5TVRWW5WJV7KBLHJMSN7VUL3VIKA6NXHCNNJ52B6HWHODXJMKMKEP4JKTN3UKWS6H,TRUE,FALSE,108,m,108,,https://www.strava.com/activities/3265229850,https://www.strava.com/activities/3265229850?utm_content=1464505&utm_medium=referral&utm_source=twitter,went for a 16.3 kilometer Run.,TRUE,FALSE,,1350,,FALSE,FALSE,FALSE,FALSE,everyone
3256476209,Afternoon Ride,Ride,Ride,Ride,FALSE,,,"Sun, 4/5/2020",1586097141,2020-04-05T02:32:21+0000,Sun,48.06,48061,48.061,kilometers,km,1:37:12,5832,1:40:02,6002,FALSE,https://d3o5xota0a1fcr.cloudfront.net/v6/maps/NLHIEFVC5SANYVFN56DGDG4XW3CEJXW4UDSEHZKF4APPXRSW5ZL47JYSE6QEC2ELG3V2UVVVBDWXUW2VNYMUT455CLVNIQCW,TRUE,FALSE,615,m,615,,https://www.strava.com/activities/3256476209,https://www.strava.com/activities/3256476209?utm_content=1464505&utm_medium=referral&utm_source=twitter,went for a 48.0 kilometer Ride.,TRUE,FALSE,,1258,,FALSE,FALSE,FALSE,FALSE,everyone
3248777472,Evening Run,Run,Run,Run,FALSE,,,"Fri, 4/3/2020",1585939926,2020-04-03T05:52:06+0000,Fri,9.99,9997,9.997,kilometers,km,47:58:00,2878,50:43:00,3043,FALSE,https://d3o5xota0a1fcr.cloudfront.net/v6/maps/NAXOC65WP6KSH6HRDAUAIFCCGCZPGI73DBQDMICQQQAZKN6S46K2H4LKAFX2TO2JUKNQVRJFQYPARO7XDOSTRHKE2W65XOK6,TRUE,FALSE,97,m,97,,https://www.strava.com/activities/3248777472,https://www.strava.com/activities/3248777472?utm_content=1464505&utm_medium=referral&utm_source=twitter,went for a 9.9 kilometer Run.,TRUE,FALSE,,851,,FALSE,FALSE,FALSE,FALSE,everyone
3241001595,Afternoon Ride,Ride,Ride,Ride,FALSE,,,"Wed, 4/1/2020",1585763776,2020-04-01T04:56:16+0000,Wed,19.69,19689,19.689,kilometers,km,1:03:53,3833,1:11:20,4280,FALSE,https://d3o5xota0a1fcr.cloudfront.net/v6/maps/XUJI5MJMRFEFAGY4TPQVJMGJ7SN34UMXTCCZRY5Q5ZR5WP3MXKRJ5332OJW3HYXQN6XCU7BI5ENC4JVLMJETYM4UGF565ZK7,TRUE,FALSE,326,m,326,,https://www.strava.com/activities/3241001595,https://www.strava.com/activities/3241001595?utm_content=1464505&utm_medium=referral&utm_source=twitter,went for a 19.6 kilometer Ride.,TRUE,FALSE,,887,,FALSE,FALSE,FALSE,FALSE,everyone
3237139064,Evening Run,Run,Run,Run,FALSE,,,"Tue, 3/31/2020",1585679785,2020-03-31T05:36:25+0000,Tue,14.37,14369,14.369,kilometers,km,1:07:15,4035,1:14:14,4454,FALSE,https://d3o5xota0a1fcr.cloudfront.net/v6/maps/L2FZACIUPGJO3NXA2F4BMLZIPDFJTNJRCMGQNIRM46VNBTMSCX4XSSQBMTR2VNRU3RXDFVZECKJE7HC4DAEQWUEVSIV5JA5Y,TRUE,FALSE,109,m,109,,https://www.strava.com/activities/3237139064,https://www.strava.com/activities/3237139064?utm_content=1464505&utm_medium=referral&utm_source=twitter,went for a 14.3 kilometer Run.,TRUE,FALSE,,1166,,FALSE,FALSE,FALSE,FALSE,everyone
3233690308,Afternoon Ride,Ride,Ride,Ride,FALSE,,,"Mon, 3/30/2020",1585589419,2020-03-30T04:30:19+0000,Mon,23.91,23913,23.913,kilometers,km,1:01:57,3717,1:11:48,4308,FALSE,https://d3o5xota0a1fcr.cloudfront.net/v6/maps/MPOZEYBKG22TMFETNE6RTYIHT2FX7LMAUCGBKEKVBNUEPZDQ2CMJNEXVFGM4I4KESBS65P6I64THZY6I3XGMTMGY7FDH6QSV,TRUE,FALSE,285,m,285,,https://www.strava.com/activities/3233690308,https://www.strava.com/activities/3233690308?utm_content=1464505&utm_medium=referral&utm_source=twitter,went for a 23.9 kilometer Ride.,TRUE,FALSE,,804,,FALSE,FALSE,FALSE,FALSE,everyone
3229585875,Lunch Run,Run,Run,Run,FALSE,,,"Sun, 3/29/2020",1585483598,2020-03-28T23:06:38+0000,Sun,11.06,11063,11.063,kilometers,km,55:00:00,3300,59:54:00,3594,FALSE,https://d3o5xota0a1fcr.cloudfront.net/v6/maps/JM53LYYQUBWDKAQRJQ5MXNQGCMSZ4CLB5M3E2SCWHSUAFVVDHGFIRCUCAILKL4EP7NJAHW5Z4CIWMKNNZMH6CY2TVMPAN7QA,TRUE,FALSE,223,m,223,,https://www.strava.com/activities/3229585875,https://www.strava.com/activities/3229585875?utm_content=1464505&utm_medium=referral&utm_source=twitter,went for a 11.0 kilometer Run.,TRUE,FALSE,,1048,,FALSE,FALSE,FALSE,FALSE,everyone
3229193303,Morning Ride,Ride,Ride,Ride,FALSE,,,"Sat, 3/28/2020",1585391786,2020-03-27T21:36:26+0000,Sat,30.59,30593,30.593,kilometers,km,1:00:05,3605,1:02:44,3764,FALSE,https://d3o5xota0a1fcr.cloudfront.net/v6/maps/DOW2T2M4FCXQJ6Z2HVOLDTENZXQLPRVN6JQESFI5U2VXXE77AHPMKXJQW6Y3GJ245RQVQV55G6NXUV52VGFIEKG46LHBDLJI,TRUE,FALSE,407,m,407,,https://www.strava.com/activities/3229193303,https://www.strava.com/activities/3229193303?utm_content=1464505&utm_medium=referral&utm_source=twitter,went for a 30.5 kilometer Ride.,TRUE,FALSE,,906,,FALSE,FALSE,FALSE,FALSE,everyone
3229190808,Afternoon Run,Run,Run,Run,FALSE,,,"Sat, 3/21/2020",1584799815,2020-03-21T01:10:15+0000,Sat,4.87,4874,4.874,kilometers,km,24:19:00,1459,24:46:00,1486,FALSE,https://d3o5xota0a1fcr.cloudfront.net/v6/maps/SN5PESO6AWDJJ3LP56SJ6PUU52DEYJAQ3I3NMJMAY5RWPN7CGLGEBOL6Z2M3OZ7MMCBC2VXGOSVVK2IKKOJX6WCD2N6XVTXU,TRUE,FALSE,61,m,61,,https://www.strava.com/activities/3229190808,https://www.strava.com/activities/3229190808?utm_content=1464505&utm_medium=referral&utm_source=twitter,went for a 4.8 kilometer Run.,TRUE,FALSE,,410,,FALSE,FALSE,FALSE,FALSE,everyone
3184121579,Morning Ride,Ride,Ride,Ride,FALSE,,,"Sun, 3/15/2020",1584268874,2020-03-14T21:41:14+0000,Sun,37.1,37101,37.101,kilometers,km,3:11:45,11505,4:03:49,14629,FALSE,https://d3o5xota0a1fcr.cloudfront.net/v6/maps/IEQTMZ7BEVCLZR4AZCS5XQEYRDHWHWVBIXOWEBWPGN2N5YGDFHPW2Q6RQH6FEOG27I6DIXPSQZTMATDI4YRKJQJYLSRA5CCK,TRUE,FALSE,"1,449",m,1449,,https://www.strava.com/activities/3184121579,https://www.strava.com/activities/3184121579?utm_content=1464505&utm_medium=referral&utm_source=twitter,went for a 37.1 kilometer Ride.,TRUE,FALSE,,2411,,FALSE,FALSE,FALSE,FALSE,everyone
3181163315,Lunch Ride,Ride,Ride,Ride,FALSE,,,"Sat, 3/14/2020",1584189399,2020-03-13T23:36:39+0000,Sat,36.55,36550,36.55,kilometers,km,3:13:17,11597,4:42:07,16927,FALSE,https://d3o5xota0a1fcr.cloudfront.net/v6/maps/2RGNMHIFYZQUV5GKQFCC2I6WLG2JHZY2TK4NKUNCGTM4WVERVJCQFPTUGT6PTZEGJVO4T4UV3JBZ6S5ZGZWQ4VNASMFT64JN,TRUE,FALSE,"1,137",m,1137,,https://www.strava.com/activities/3181163315,https://www.strava.com/activities/3181163315?utm_content=1464505&utm_medium=referral&utm_source=twitter,went for a 36.5 kilometer Ride.,TRUE,FALSE,,2426,,FALSE,FALSE,FALSE,FALSE,everyone
3178783057,Afternoon Ride,Ride,Ride,Ride,FALSE,,,"Fri, 3/13/2020",1584121838,2020-03-13T04:50:38+0000,Fri,16.01,16015.2,16.0152,kilometers,km,32:55:00,1975,34:49:00,2089,FALSE,https://d3o5xota0a1fcr.cloudfront.net/v6/maps/RB4WUCYS3I4Z7A7W7NN3BPHYM2XSIITUW2HWUQA4YI3SOVL72HOBLHT54EPRJOZKGOUM2JPSHGCQIQJHFIP6NOBLAHYD24EZ,TRUE,FALSE,130,m,130.448,,https://www.strava.com/activities/3178783057,https://www.strava.com/activities/3178783057?utm_content=1464505&utm_medium=referral&utm_source=twitter,went for a 16.0 kilometer Ride.,FALSE,FALSE,,415.9241638,10,FALSE,FALSE,FALSE,FALSE,everyone
3178893029,Morning Ride,Ride,Ride,Ride,FALSE,,,"Fri, 3/13/2020",1584087697,2020-03-12T19:21:37+0000,Fri,15.02,15020,15.02,kilometers,km,29:52:00,1792,31:50:00,1910,FALSE,https://d3o5xota0a1fcr.cloudfront.net/v6/maps/43I45SOZJ2RDYK5W3TNDEMZZJFWCLCIP2PUQJRAUHPKOXLNAKDXYRRFXSQOXTQWOSSDNH3RRA3GLYJ6PIURX2IU7A2QSVGYW,TRUE,FALSE,107,m,107,,https://www.strava.com/activities/3178893029,https://www.strava.com/activities/3178893029?utm_content=1464505&utm_medium=referral&utm_source=twitter,went for a 15.0 kilometer Ride.,TRUE,FALSE,,202,,FALSE,FALSE,FALSE,FALSE,everyone
3176209235,Evening Run,Run,Run,Run,FALSE,,,"Thu, 3/12/2020",1584040666,2020-03-12T06:17:46+0000,Thu,2.97,2974,2.974,kilometers,km,20:19,1219,21:01,1261,FALSE,https://d3o5xota0a1fcr.cloudfront.net/v6/maps/QNXYC5YOTS7FFMLG6HAKQ7BS3Y7TH2HJPVMTWDZAAUPJCUHOPVP7TZK5PF2NIULMQGIKNFLYUMDVVLZR5F3NSH6JNH3M7XEY,TRUE,FALSE,155,m,155,,https://www.strava.com/activities/3176209235,https://www.strava.com/activities/3176209235?utm_content=1464505&utm_medium=referral&utm_source=twitter,went for a 2.9 kilometer Run.,TRUE,FALSE,,365,,FALSE,FALSE,FALSE,FALSE,everyone
3176208482,Night Activity,WeightTraining,Weight Training,Workout,FALSE,,,"Sun, 3/8/2020",1583709273,2020-03-09T06:14:33+0000,Sun,0,0,0,kilometers,km,1:40:32,6032,1:40:32,6032,TRUE,,FALSE,FALSE,0,m,0,,https://www.strava.com/activities/3176208482,https://www.strava.com/activities/3176208482?utm_content=1464505&utm_medium=referral&utm_source=twitter,went for a 0 kilometer Weight Training.,TRUE,FALSE,,688,30,FALSE,FALSE,FALSE,FALSE,everyone
3163385904,Morning Run,Run,Run,Run,FALSE,,,"Sun, 3/8/2020",1583659806,2020-03-07T20:30:06+0000,Sun,8.4,8401,8.401,kilometers,km,34:46:00,2086,34:46:00,2086,FALSE,https://d3o5xota0a1fcr.cloudfront.net/v6/maps/ISJSVJXGQVVJWN6LR7Y4ZCEJAVANFGUOMZ6KANBZSG5AQZQXNREH75OVTXX7KX3PHMDE6UPL3BJO2S3GTHZMJWAIKBNMQ4NW,TRUE,FALSE,12,m,12,,https://www.strava.com/activities/3163385904,https://www.strava.com/activities/3163385904?utm_content=1464505&utm_medium=referral&utm_source=twitter,went for a 8.4 kilometer Run.,TRUE,FALSE,,719,,FALSE,FALSE,FALSE,FALSE,everyone
3160455897,Afternoon Ride,Ride,Ride,Ride,FALSE,,,"Sat, 3/7/2020",1583586320,2020-03-07T00:05:20+0000,Sat,35.2,35208,35.208,kilometers,km,1:17:46,4666,1:22:50,4970,FALSE,https://d3o5xota0a1fcr.cloudfront.net/v6/maps/JDIBXID5YLQBXL34JAM7G3SCIHBWUYSNIZXKR42PQFENXQGJTEHRIRPNEZ727ALBS4RFRONDNKWMIFFMQ76DCQ4KJUUM6GUW,TRUE,FALSE,344,m,344,,https://www.strava.com/activities/3160455897,https://www.strava.com/activities/3160455897?utm_content=1464505&utm_medium=referral&utm_source=twitter,went for a 35.2 kilometer Ride.,TRUE,FALSE,,808,,FALSE,FALSE,FALSE,FALSE,everyone
3158313525,Evening Run,Run,Run,Run,FALSE,,,"Fri, 3/6/2020",1583524740,2020-03-06T06:59:00+0000,Fri,4.53,4530,4.53,kilometers,km,23:00,1380,23:41,1421,FALSE,https://d3o5xota0a1fcr.cloudfront.net/v6/maps/YZHWEOZJQOO2XCAM323RMXWPM5NNTOFQGVNDVWPULL4NCDEKDYGN6QFFO4LMLFBHZFATJV6QL7QSVBGH2FYAXIGIAXHFFNPV,TRUE,FALSE,63,m,63,,https://www.strava.com/activities/3158313525,https://www.strava.com/activities/3158313525?utm_content=1464505&utm_medium=referral&utm_source=twitter,went for a 4.5 kilometer Run.,TRUE,FALSE,,382,,FALSE,FALSE,FALSE,FALSE,everyone
2771741523,Afternoon Ride,Ride,Ride,Ride,FALSE,,,"Sun, 10/6/2019",1570368875,2019-10-06T00:34:35+0000,Sun,15.33,15332,15.332,kilometers,km,40:29:00,2429,47:47:00,2867,FALSE,https://d3o5xota0a1fcr.cloudfront.net/v6/maps/ACHQWK5PBHVAAKQBO2OTF3ZQJNW2DZXYTDEN3HT3RRZOIHDU6M5VMPZRSH6OPY6POYXJ4OJEVPUDHQMQ3VDSBZJZWZT3IADR,TRUE,FALSE,188,m,188,,https://www.strava.com/activities/2771741523,https://www.strava.com/activities/2771741523?utm_content=1464505&utm_medium=referral&utm_source=twitter,went for a 15.3 kilometer Ride.,TRUE,FALSE,,320,,FALSE,FALSE,FALSE,FALSE,everyone
2763348869,Lunch Ride,Ride,Ride,Ride,FALSE,,,"Sat, 10/5/2019",1570275040,2019-10-04T22:30:40+0000,Sat,89.22,89220,89.22,kilometers,km,3:05:15,11115,3:52:17,13937,FALSE,https://d3o5xota0a1fcr.cloudfront.net/v6/maps/4Y56RF6HWF7D67BRAB4WZGIZQKEDHKY6SNRFNWPIKKLKYQOGAINH24QQDNL3B7DIBVETI3HENWVJE45BDKYKJY7J4ZSIXBS3,TRUE,FALSE,738,m,738,,https://www.strava.com/activities/2763348869,https://www.strava.com/activities/2763348869?utm_content=1464505&utm_medium=referral&utm_source=twitter,went for a 89.2 kilometer Ride.,TRUE,FALSE,,2594,,FALSE,FALSE,FALSE,FALSE,everyone
2761568600,Evening Ride,Ride,Ride,Ride,FALSE,,,"Fri, 10/4/2019",1570221307,2019-10-04T07:35:07+0000,Fri,15.54,15548,15.548,kilometers,km,29:34:00,1774,30:07:00,1807,FALSE,https://d3o5xota0a1fcr.cloudfront.net/v6/maps/ULBPNJWXSGWPZ2BDMNOOVDOTMBF5GLCLH3YYZGZ2JY67E3YVIUMW53UDLDZPU4YCAKHLNPM4222VRPICDPTOIJTFVS2XL3U5,TRUE,FALSE,124,m,124,,https://www.strava.com/activities/2761568600,https://www.strava.com/activities/2761568600?utm_content=1464505&utm_medium=referral&utm_source=twitter,went for a 15.5 kilometer Ride.,TRUE,FALSE,,279,,FALSE,FALSE,FALSE,FALSE,everyone
2761386064,Morning Ride,Ride,Ride,Ride,FALSE,,,"Fri, 10/4/2019",1570176232,2019-10-03T19:03:52+0000,Fri,23.75,23749,23.749,kilometers,km,49:09:00,2949,54:46:00,3286,FALSE,https://d3o5xota0a1fcr.cloudfront.net/v6/maps/R22HLZZRZDSF7Q7OCFVVDTQTBUCWYAD3JB4XTJCPV2PQT36MSXWJJMNG433444ZTHUGJIGMM5S4ZF4K64YY3JOGAXINPDLSB,TRUE,FALSE,235,m,235,,https://www.strava.com/activities/2761386064,https://www.strava.com/activities/2761386064?utm_content=1464505&utm_medium=referral&utm_source=twitter,went for a 23.7 kilometer Ride.,TRUE,FALSE,,695,,FALSE,FALSE,FALSE,FALSE,everyone
2758944461,Night Activity,WeightTraining,Weight Training,Workout,FALSE,,,"Wed, 10/2/2019",1570056236,2019-10-03T05:43:56+0000,Wed,0,0,0,kilometers,km,1:01:57,3717,1:01:57,3717,TRUE,,FALSE,FALSE,0,m,0,,https://www.strava.com/activities/2758944461,https://www.strava.com/activities/2758944461?utm_content=1464505&utm_medium=referral&utm_source=twitter,went for a 0 kilometer Weight Training.,TRUE,FALSE,,669,30,FALSE,FALSE,FALSE,FALSE,everyone
2753568772,Afternoon Ride,Ride,Ride,Ride,FALSE,,,"Tue, 10/1/2019",1569950408,2019-10-01T04:20:08+0000,Tue,16.18,16184,16.184,kilometers,km,1:03:47,3827,1:19:55,4795,FALSE,https://d3o5xota0a1fcr.cloudfront.net/v6/maps/W7BDQFWBBPCOSDQQQAY736JZNL3BTKMYGGKNGP235XEEMJ6FQDSOMHXO27IB2OEPS3EWXSU4OSBW7IPZCYILDOFGMHIWIZX4,TRUE,FALSE,395,m,395,,https://www.strava.com/activities/2753568772,https://www.strava.com/activities/2753568772?utm_content=1464505&utm_medium=referral&utm_source=twitter,went for a 16.1 kilometer Ride.,TRUE,FALSE,,471,,FALSE,FALSE,FALSE,FALSE,everyone
2747970570,Ooo Wee,Ride,Ride,Ride,FALSE,,,"Sun, 9/29/2019",1569755717,2019-09-28T22:15:17+0000,Sun,74.2,74208,74.208,kilometers,km,12:09,729,4:05:14,14714,FALSE,https://d3o5xota0a1fcr.cloudfront.net/v6/maps/Q5G5OQTVD33PBLML4YBCHSFZTKQ4ANV75ZP4DY2MHYAVZAGFZIYUJAMCJBLPIZUS2VNPYQF4Q76FTUTHIE2PPJMMQNCP6VEB,TRUE,FALSE,"1,430",m,1430,,https://www.strava.com/activities/2747970570,https://www.strava.com/activities/2747970570?utm_content=1464505&utm_medium=referral&utm_source=twitter,went for a 74.2 kilometer Ride.,TRUE,FALSE,,2423,10,FALSE,FALSE,FALSE,FALSE,everyone
2747624156,Lunch Ride,Ride,Ride,Ride,FALSE,,,"Sat, 9/28/2019",1569669586,2019-09-27T23:19:46+0000,Sat,29.55,29558,29.558,kilometers,km,10:44,644,2:06:20,7580,FALSE,https://d3o5xota0a1fcr.cloudfront.net/v6/maps/6DZ6QGITXK5DYT2PQYOFC6GDLWQEWLBENAP4UFKJVPDCOZ2XLLCQTSFYL2IXNYS4A7YPYYGZIYJ22SQUZIL2OXQ4MQIFGKNZ,TRUE,FALSE,504,m,504,,https://www.strava.com/activities/2747624156,https://www.strava.com/activities/2747624156?utm_content=1464505&utm_medium=referral&utm_source=twitter,went for a 29.5 kilometer Ride.,TRUE,FALSE,,561,,FALSE,FALSE,FALSE,FALSE,everyone
2740995383,Afternoon Ride,Ride,Ride,Ride,FALSE,,,"Thu, 9/26/2019",1569514972,2019-09-26T04:22:52+0000,Thu,20.44,20447,20.447,kilometers,km,1:43:02,6182,1:57:39,7059,FALSE,https://d3o5xota0a1fcr.cloudfront.net/v6/maps/I2O2JUS2Y35NJYUJVRXM5GSPG3455CVECPG6QO6L45Z3HGHWSQJKNNTO3IY4GNSGAQXAZ7FXOSVI33YRXBSDJZIOEOYNZ32E,TRUE,FALSE,832,m,832,,https://www.strava.com/activities/2740995383,https://www.strava.com/activities/2740995383?utm_content=1464505&utm_medium=referral&utm_source=twitter,went for a 20.4 kilometer Ride.,TRUE,FALSE,,1090,,FALSE,FALSE,FALSE,FALSE,everyone
2740990124,Evening Run,Run,Run,Run,FALSE,,,"Wed, 9/25/2019",1569442069,2019-09-25T08:07:49+0000,Wed,3.31,3310,3.31,kilometers,km,17:45,1065,19:40,1180,FALSE,https://d3o5xota0a1fcr.cloudfront.net/v6/maps/JEOWFME75UXYF7XRNS44ZWVRQJKCUKWPC3T2R6SEUBT5IVB3DN2AYY2QYJTY4ZUQMIWQLV6BPOJKPSEIKXIQV6NDEMHOGEMJ,TRUE,FALSE,22,m,22,,https://www.strava.com/activities/2740990124,https://www.strava.com/activities/2740990124?utm_content=1464505&utm_medium=referral&utm_source=twitter,went for a 3.3 kilometer Run.,TRUE,FALSE,,64,,FALSE,FALSE,FALSE,FALSE,everyone
2735216145,Evening Ride,Ride,Ride,Ride,FALSE,,,"Tue, 9/24/2019",1569348559,2019-09-24T06:09:19+0000,Tue,17.23,17233,17.233,kilometers,km,37:44:00,2264,41:32:00,2492,FALSE,https://d3o5xota0a1fcr.cloudfront.net/v6/maps/Y4W3S6GWXVNOGODOY5VVOKBA5QQQYUG4INWAY3S3OCW4UHTV53SMZG2QRQURFW4XH6KHEWFBES5K2MW4XU3Y5HTQ7PM57B24,TRUE,FALSE,159,m,159,,https://www.strava.com/activities/2735216145,https://www.strava.com/activities/2735216145?utm_content=1464505&utm_medium=referral&utm_source=twitter,went for a 17.2 kilometer Ride.,TRUE,FALSE,,259,,FALSE,FALSE,FALSE,FALSE,everyone
2729210584,Sweet As,Ride,Ride,Ride,FALSE,,,"Sun, 9/22/2019",1569149206,2019-09-21T22:46:46+0000,Sun,21.57,21577,21.577,kilometers,km,1:30:29,5429,1:41:50,6110,FALSE,https://d3o5xota0a1fcr.cloudfront.net/v6/maps/LKGS563CZLWX7CASFHGKZICXF3N4I32DG3E7T6WDS4ZFHXBTBW5BKINKWVWYEDM7L2BRRHCTCLZ2DDXWR46U72FP2YHIRPRL,TRUE,FALSE,580,m,580,,https://www.strava.com/activities/2729210584,https://www.strava.com/activities/2729210584?utm_content=1464505&utm_medium=referral&utm_source=twitter,went for a 21.5 kilometer Ride.,TRUE,FALSE,,1300,10,FALSE,FALSE,FALSE,FALSE,everyone
2725975879,Morning Ride,Ride,Ride,Ride,FALSE,,,"Sat, 9/21/2019",1569050369,2019-09-20T19:19:29+0000,Sat,54.61,54617,54.617,kilometers,km,1:58:59,7139,2:23:38,8618,FALSE,https://d3o5xota0a1fcr.cloudfront.net/v6/maps/2FHVIJ6AJ73YT3HUM6OA4VY3CSXKP2MZA26AQYEEZVXYRUJA2TBXCP5EDDA3LACPGCJ346K7ZW3FFAMOJI6HHPM4VMLKSQ26,TRUE,FALSE,383,m,383,,https://www.strava.com/activities/2725975879,https://www.strava.com/activities/2725975879?utm_content=1464505&utm_medium=referral&utm_source=twitter,went for a 54.6 kilometer Ride.,TRUE,FALSE,,1381,,FALSE,FALSE,FALSE,FALSE,everyone
2728951118,Night Activity,WeightTraining,Weight Training,Workout,FALSE,,,"Thu, 9/19/2019",1568860385,2019-09-19T09:33:05+0000,Thu,0,0,0,kilometers,km,1:16:15,4575,1:16:15,4575,TRUE,,FALSE,FALSE,0,m,0,,https://www.strava.com/activities/2728951118,https://www.strava.com/activities/2728951118?utm_content=1464505&utm_medium=referral&utm_source=twitter,went for a 0 kilometer Weight Training.,TRUE,FALSE,,748,30,FALSE,FALSE,FALSE,FALSE,everyone
2728950633,Night Activity,WeightTraining,Weight Training,Workout,FALSE,,,"Mon, 9/16/2019",1568599047,2019-09-16T08:57:27+0000,Mon,0,0,0,kilometers,km,1:41:33,6093,1:41:33,6093,TRUE,,FALSE,FALSE,0,m,0,,https://www.strava.com/activities/2728950633,https://www.strava.com/activities/2728950633?utm_content=1464505&utm_medium=referral&utm_source=twitter,went for a 0 kilometer Weight Training.,TRUE,FALSE,,717,30,FALSE,FALSE,FALSE,FALSE,everyone
2712019445,Evening Run,Run,Run,Run,FALSE,,,"Sun, 9/15/2019",1568572884,2019-09-15T06:41:24+0000,Sun,2.44,2445,2.445,kilometers,km,14:23,863,15:22,922,FALSE,https://d3o5xota0a1fcr.cloudfront.net/v6/maps/VUANI4SWUAIIHEX6EWVHA2ZTAQTPVGOJWYX5RPHYN5BLNMBY6GBML5NJSXY7BBRGTEHMVPGJAE3G23VB7CWH3JEZXA2P5YDW,TRUE,FALSE,7,m,7,,https://www.strava.com/activities/2712019445,https://www.strava.com/activities/2712019445?utm_content=1464505&utm_medium=referral&utm_source=twitter,went for a 2.4 kilometer Run.,TRUE,FALSE,,160,,FALSE,FALSE,FALSE,FALSE,everyone
2706234008,Lunch Ride,Ride,Ride,Ride,FALSE,,,"Sat, 9/14/2019",1568461195,2019-09-13T23:39:55+0000,Sat,62.98,62982.4,62.9824,kilometers,km,2:24:23,8663,3:20:48,12048,FALSE,https://d3o5xota0a1fcr.cloudfront.net/v6/maps/XZ4CVMTMIYOMKR2WYAZB7LZODZ3FS4LEQDPP7VBJQ65WDZZUUVDACFTTSB33BYASRUXRGRJWRK4OI7FYR5YRW46AU5N7LFOO,TRUE,FALSE,680,m,680,,https://www.strava.com/activities/2706234008,https://www.strava.com/activities/2706234008?utm_content=1464505&utm_medium=referral&utm_source=twitter,went for a 62.9 kilometer Ride.,TRUE,FALSE,,1845,,FALSE,FALSE,FALSE,FALSE,everyone
2728950103,Lunch Ride,Ride,Ride,Ride,FALSE,,,"Sat, 9/14/2019",1568460531,2019-09-13T23:28:51+0000,Sat,63.82,63828,63.828,kilometers,km,2:33:41,9221,3:31:55,12715,FALSE,https://d3o5xota0a1fcr.cloudfront.net/v6/maps/ZONNEA3SSOYRY2VK5SJ3VPWGO5AXCFPJQ733WULI7K7J2K7T4PWWK5CW7GGA6DIRI5HRY6WQO3ODJOKXS57IAMVWJDGLWZLN,TRUE,FALSE,809,m,809,,https://www.strava.com/activities/2728950103,https://www.strava.com/activities/2728950103?utm_content=1464505&utm_medium=referral&utm_source=twitter,went for a 63.8 kilometer Ride.,TRUE,FALSE,,2013,,FALSE,FALSE,FALSE,FALSE,everyone
2705939916,Night Activity,WeightTraining,Weight Training,Workout,FALSE,,,"Thu, 9/12/2019",1568330673,2019-09-13T06:24:33+0000,Thu,0,0,0,kilometers,km,33:00:00,1980,33:00:00,1980,TRUE,,FALSE,FALSE,0,m,0,,https://www.strava.com/activities/2705939916,https://www.strava.com/activities/2705939916?utm_content=1464505&utm_medium=referral&utm_source=twitter,went for a 0 kilometer Weight Training.,TRUE,FALSE,,329,30,FALSE,FALSE,FALSE,FALSE,everyone
2705939215,Lunch Activity,WeightTraining,Weight Training,Workout,FALSE,,,"Mon, 9/9/2019",1568028487,2019-09-09T18:28:07+0000,Mon,0,0,0,kilometers,km,1:10:01,4201,1:10:01,4201,TRUE,,FALSE,FALSE,0,m,0,,https://www.strava.com/activities/2705939215,https://www.strava.com/activities/2705939215?utm_content=1464505&utm_medium=referral&utm_source=twitter,went for a 0 kilometer Weight Training.,TRUE,FALSE,,409,30,FALSE,FALSE,FALSE,FALSE,everyone
2894599905,Morning Ride,Ride,Ride,Ride,FALSE,,,"Wed, 11/27/2019",1574833739,2019-11-26T16:48:59+0000,Wed,58.36,58365,58.365,kilometers,km,2:10:47,7847,2:32:10,9130,FALSE,https://d3o5xota0a1fcr.cloudfront.net/v6/maps/5LZ666AGFDF6IXC2GT7F25Y4JHJHTXZ62DOCKLJPI47MG66UIZAY4EPDM3L5ZDJ7SMT4TDM7KWAQZWFWDLVXAZCWEOQECARG,TRUE,FALSE,357,m,357,,https://www.strava.com/activities/2894599905,https://www.strava.com/activities/2894599905?utm_content=1464505&utm_medium=referral&utm_source=twitter,went for a 58.3 kilometer Ride.,TRUE,FALSE,,1404,,FALSE,FALSE,FALSE,FALSE,everyone
2892996534,Evening Ride,Ride,Ride,Ride,FALSE,,,"Tue, 11/26/2019",1574795252,2019-11-26T06:07:32+0000,Tue,14.21,14211,14.211,kilometers,km,30:41:00,1841,32:36:00,1956,FALSE,https://d3o5xota0a1fcr.cloudfront.net/v6/maps/EXRY7GXWCGRZKHDQGRWUE4BDM3U7GSJLNH2GH6XJ6AGA5OGPTOS4M6RH3E3ZQHXP7WUJVWQNHFBTAHWWTTFAYRFD2U3DSPPI,TRUE,FALSE,162,m,162,,https://www.strava.com/activities/2892996534,https://www.strava.com/activities/2892996534?utm_content=1464505&utm_medium=referral&utm_source=twitter,went for a 14.2 kilometer Ride.,TRUE,FALSE,,224,,FALSE,FALSE,FALSE,FALSE,everyone
2890542807,Evening Ride,Ride,Ride,Ride,FALSE,,,"Mon, 11/25/2019",1574706350,2019-11-25T05:25:50+0000,Mon,15.47,15471,15.471,kilometers,km,33:31:00,2011,36:59:00,2219,FALSE,https://d3o5xota0a1fcr.cloudfront.net/v6/maps/XVZRTHHBAERRDP2GPNMZYFPBWJBJK34K4F7ARUBHN3QWQ5LZXAZXALVD57A3KKMUCJYFHYG6UKKEEPNWSO5CYXZPKFY6AIPT,TRUE,FALSE,118,m,118,,https://www.strava.com/activities/2890542807,https://www.strava.com/activities/2890542807?utm_content=1464505&utm_medium=referral&utm_source=twitter,went for a 15.4 kilometer Ride.,TRUE,FALSE,,181,,FALSE,FALSE,FALSE,FALSE,everyone
2890482876,Morning Ride,Ride,Ride,Ride,FALSE,,,"Mon, 11/25/2019",1574670258,2019-11-24T19:24:18+0000,Mon,15.53,15536,15.536,kilometers,km,32:19:00,1939,37:17:00,2237,FALSE,https://d3o5xota0a1fcr.cloudfront.net/v6/maps/XMZBK36HX7IBBLKXZX2KZ64JOZKWHO7QMI4627ILKIRB5SJRGGWHK53R652FWUWHVT4O2GTBPWAK4N3TSRGLJVJLIJ4E54LS,TRUE,FALSE,160,m,160,,https://www.strava.com/activities/2890482876,https://www.strava.com/activities/2890482876?utm_content=1464505&utm_medium=referral&utm_source=twitter,went for a 15.5 kilometer Ride.,TRUE,FALSE,,248,,FALSE,FALSE,FALSE,FALSE,everyone
2880292022,Afternoon Ride,Ride,Ride,Ride,FALSE,,,"Thu, 11/21/2019",1574356970,2019-11-21T04:22:50+0000,Thu,20.96,20967,20.967,kilometers,km,1:43:05,6185,2:26:26,8786,FALSE,https://d3o5xota0a1fcr.cloudfront.net/v6/maps/N6C4A7CPYBFKYTFW6PBR2Z3CIJ6FMSZKMWKWV3KLOLWKBKDTNEYV3RW7M52KRDTIIXFXWPW353VMK2FS2MO3GK7EA2PJSWNO,TRUE,FALSE,852,m,852,,https://www.strava.com/activities/2880292022,https://www.strava.com/activities/2880292022?utm_content=1464505&utm_medium=referral&utm_source=twitter,went for a 20.9 kilometer Ride.,TRUE,FALSE,,1062,,FALSE,FALSE,FALSE,FALSE,everyone
2878406206,Afternoon Ride,Ride,Ride,Ride,FALSE,,,"Wed, 11/20/2019",1574270901,2019-11-20T04:28:21+0000,Wed,15.83,15834,15.834,kilometers,km,33:36:00,2016,38:57:00,2337,FALSE,https://d3o5xota0a1fcr.cloudfront.net/v6/maps/YAVUMKQ65CNCIJYG75VAEMSNJ5XZ63ZYN7QX4HNHY3F7D7MVDNYKNPJVIQSGLGPZNNWYI577NFTJXCW22JINKGNNTRZ6WQGV,TRUE,FALSE,121,m,121,,https://www.strava.com/activities/2878406206,https://www.strava.com/activities/2878406206?utm_content=1464505&utm_medium=referral&utm_source=twitter,went for a 15.8 kilometer Ride.,TRUE,FALSE,,401,,FALSE,FALSE,FALSE,FALSE,everyone
2876941633,Morning Ride,Ride,Ride,Ride,FALSE,,,"Wed, 11/20/2019",1574228688,2019-11-19T16:44:48+0000,Wed,59.83,59830,59.83,kilometers,km,1:57:07,7027,2:48:42,10122,FALSE,https://d3o5xota0a1fcr.cloudfront.net/v6/maps/2C42N52G2FFXMVZS5VHH2MVGHDYLOXKCB7WNG7Z3OCWNN54O2C45DLBQ2DX24YGQRWH5DPHIZJUDZPD7JVUTXPP5XCRJDOGE,TRUE,FALSE,451,m,451,,https://www.strava.com/activities/2876941633,https://www.strava.com/activities/2876941633?utm_content=1464505&utm_medium=referral&utm_source=twitter,went for a 59.8 kilometer Ride.,TRUE,FALSE,,1713,,FALSE,FALSE,FALSE,FALSE,everyone
2875346960,Night Activity,WeightTraining,Weight Training,Workout,TRUE,,,"Sun, 11/17/2019",1574027074,2019-11-18T05:44:34+0000,Sun,0,0,0,kilometers,km,3:49:52,13792,3:49:52,13792,TRUE,,FALSE,FALSE,0,m,0,,https://www.strava.com/activities/2875346960,https://www.strava.com/activities/2875346960?utm_content=1464505&utm_medium=referral&utm_source=twitter,went for a 0 kilometer Weight Training.,TRUE,FALSE,,802,30,FALSE,FALSE,FALSE,FALSE,only_me
2875346643,Lunch Ride,Ride,Ride,Ride,FALSE,,,"Sun, 11/17/2019",1573988559,2019-11-16T22:02:39+0000,Sun,32.62,32620,32.62,kilometers,km,3:09:35,11375,4:55:12,17712,FALSE,https://d3o5xota0a1fcr.cloudfront.net/v6/maps/YSJ3ZNSMJ3WA7VWBKDKK4YHSZULLHDOAG4YDJBLRTBC7SWHQFBBALYZ4PYV7J7NRPUIBIMTGK6JOKP5ILREU3S7NIJFKLRBM,TRUE,FALSE,"1,268",m,1268,,https://www.strava.com/activities/2875346643,https://www.strava.com/activities/2875346643?utm_content=1464505&utm_medium=referral&utm_source=twitter,went for a 32.6 kilometer Ride.,TRUE,FALSE,,2485,,FALSE,FALSE,FALSE,FALSE,everyone
2870307937,Lunch Ride,Ride,Ride,Ride,FALSE,,,"Sun, 11/17/2019",1573988439,2019-11-16T22:00:39+0000,Sun,29.63,29631,29.631,kilometers,km,2:35:52,9352,4:56:34,17794,FALSE,https://d3o5xota0a1fcr.cloudfront.net/v6/maps/3TBEN72RHOOHBTTILKRPWXWZF7RBBEAUPNOMMIHUZESNGB66EKRYGRLVENSAJVWMFTPRMMQQGVLXL52ANDQLHOVEDCFXZY37,TRUE,FALSE,"1,292",m,1292,,https://www.strava.com/activities/2870307937,https://www.strava.com/activities/2870307937?utm_content=1464505&utm_medium=referral&utm_source=twitter,went for a 29.6 kilometer Ride.,TRUE,FALSE,,1266,,FALSE,FALSE,FALSE,FALSE,everyone
2875344443,Lunch Ride,Ride,Ride,Ride,FALSE,,,"Sat, 11/16/2019",1573908068,2019-11-15T23:41:08+0000,Sat,90.14,90141,90.141,kilometers,km,3:06:54,11214,3:27:49,12469,FALSE,https://d3o5xota0a1fcr.cloudfront.net/v6/maps/MBAXB236OYE4F4OQMKX5P5CR3LJH5TLYQTXNNRJ6PSJCXTWY52VILWP6GGEI2OSIH27VLJ7YZJGNTIFHCYV354H5VBS3WC7Y,TRUE,FALSE,"1,217",m,1217,,https://www.strava.com/activities/2875344443,https://www.strava.com/activities/2875344443?utm_content=1464505&utm_medium=referral&utm_source=twitter,went for a 90.1 kilometer Ride.,TRUE,FALSE,,2320,,FALSE,FALSE,FALSE,FALSE,everyone
2870308047,Lunch Ride,Ride,Ride,Ride,FALSE,,,"Sat, 11/16/2019",1573908039,2019-11-15T23:40:39+0000,Sat,89.24,89239.3,89.2393,kilometers,km,3:05:14,11114,3:27:28,12448,FALSE,https://d3o5xota0a1fcr.cloudfront.net/v6/maps/PFVQGB35U3M6N6ODEOI64MIVDY6LRK3ODYOASQ6GNXPBPSEHUBB5OG5P3HPVBYH2JEFEQFVUD2GBL52RHQNY5QQ67RQS3OUS,TRUE,FALSE,"1,068",m,1068,,https://www.strava.com/activities/2870308047,https://www.strava.com/activities/2870308047?utm_content=1464505&utm_medium=referral&utm_source=twitter,went for a 89.2 kilometer Ride.,TRUE,FALSE,,2661,,FALSE,FALSE,FALSE,FALSE,everyone
2860409101,RIP Garmin,Ride,Ride,Ride,FALSE,,,"Wed, 11/13/2019",1573632090,2019-11-12T19:01:30+0000,Wed,12.54,12544.7,12.5447,kilometers,km,23:58,1438,26:06:00,1566,FALSE,https://d3o5xota0a1fcr.cloudfront.net/v6/maps/AOQFHZDAGJS4FX4KOW6AHMGJ63BEKD4YTZLKII7AO7UREHLWMU2VCROTNW4D6WTYNOC772ILWI7I5X4WJG6NGAE2UDKGQKJS,TRUE,FALSE,86,m,85.528,,https://www.strava.com/activities/2860409101,https://www.strava.com/activities/2860409101?utm_content=1464505&utm_medium=referral&utm_source=twitter,went for a 12.5 kilometer Ride.,FALSE,FALSE,,329.8682861,10,FALSE,FALSE,FALSE,FALSE,everyone
2853799413,Lunch Run,Run,Run,Run,FALSE,,,"Sun, 11/10/2019",1573387066,2019-11-09T22:57:46+0000,Sun,6.34,6344,6.344,kilometers,km,40:33:00,2433,53:55:00,3235,FALSE,https://d3o5xota0a1fcr.cloudfront.net/v6/maps/ZEUXWPNNTQDC3TC5LA6H3EZI63EVJJOURDE27EXIWWSYAAZPG5J3DL4VY2UGL6EO2PWARWRFM2B2LZDZD7FQZR2U4FNARZ22,TRUE,FALSE,263,m,263,,https://www.strava.com/activities/2853799413,https://www.strava.com/activities/2853799413?utm_content=1464505&utm_medium=referral&utm_source=twitter,went for a 6.3 kilometer Run.,TRUE,FALSE,,700,,FALSE,FALSE,FALSE,FALSE,everyone
2850589129,Morning Ride,Ride,Ride,Ride,TRUE,,,"Sat, 11/9/2019",1573278256,2019-11-08T16:44:16+0000,Sat,70.22,70222,70.222,kilometers,km,2:12:41,7961,2:33:58,9238,FALSE,https://d3o5xota0a1fcr.cloudfront.net/v6/maps/JZ32X3JJLZ3ROMBIKTRJUDSJW5KZTBC6626BZN3MYAVJS7ODBSGT2XNPH74ETAGC5HGS33GMVS6CN3PKHVQZQMN7COTC2SP4,TRUE,FALSE,573,m,573,,https://www.strava.com/activities/2850589129,https://www.strava.com/activities/2850589129?utm_content=1464505&utm_medium=referral&utm_source=twitter,went for a 70.2 kilometer Ride.,TRUE,FALSE,,1428,10,FALSE,FALSE,FALSE,FALSE,only_me
2850618562,Morning Ride,Ride,Ride,Ride,FALSE,,,"Sat, 11/9/2019",1573278157,2019-11-08T16:42:37+0000,Sat,77.48,77479.6,77.4796,kilometers,km,2:28:35,8915,3:39:33,13173,FALSE,https://d3o5xota0a1fcr.cloudfront.net/v6/maps/RNBVLC2ONWBSMBO5ZMCOHNMCXTGIONAETW4F5Q76EPQ75ODVGDBMGKU7BGU5CEVZIOCWXCA6BHSCXDQ73KZSBH73XPVN3LZR,TRUE,FALSE,269,m,269,,https://www.strava.com/activities/2850618562,https://www.strava.com/activities/2850618562?utm_content=1464505&utm_medium=referral&utm_source=twitter,went for a 77.4 kilometer Ride.,TRUE,FALSE,,1894,,FALSE,FALSE,FALSE,FALSE,everyone
2848340231,Morning Ride,Ride,Ride,Ride,FALSE,,,"Fri, 11/8/2019",1573191754,2019-11-07T16:42:34+0000,Fri,49.53,49538,49.538,kilometers,km,1:49:14,6554,2:23:58,8638,FALSE,https://d3o5xota0a1fcr.cloudfront.net/v6/maps/WWTVFTEEJBF2JI6GYBFDOYFSCSLZPLML2432UH375VWSG5S2ARNGLFLDC4ZXZ2UJA3RGJRCCWOHDGZUHWECBZ4ZC2Z2GETTT,TRUE,FALSE,401,m,401,,https://www.strava.com/activities/2848340231,https://www.strava.com/activities/2848340231?utm_content=1464505&utm_medium=referral&utm_source=twitter,went for a 49.5 kilometer Ride.,TRUE,FALSE,,1082,,FALSE,FALSE,FALSE,FALSE,everyone
2848336191,Evening Run,Run,Run,Run,FALSE,,,"Thu, 11/7/2019",1573155088,2019-11-07T06:31:28+0000,Thu,5.39,5397,5.397,kilometers,km,27:15:00,1635,27:53:00,1673,FALSE,https://d3o5xota0a1fcr.cloudfront.net/v6/maps/3HO2M2VT3F43QJ63C7VQADCLMHJADRN45QFVGXXNLXYKZVTMXZCRZT774A7UTVXCKQ36SXYO2ODRYUGGRVXLFXYBMYGBDQQI,TRUE,FALSE,13,m,13,,https://www.strava.com/activities/2848336191,https://www.strava.com/activities/2848336191?utm_content=1464505&utm_medium=referral&utm_source=twitter,went for a 5.3 kilometer Run.,TRUE,FALSE,,443,,FALSE,FALSE,FALSE,FALSE,everyone
2847042042,Evening Ride,Ride,Ride,Ride,FALSE,,,"Thu, 11/7/2019",1573152305,2019-11-07T05:45:05+0000,Thu,15.82,15820,15.82,kilometers,km,32:45:00,1965,34:32:00,2072,FALSE,https://d3o5xota0a1fcr.cloudfront.net/v6/maps/BC425MJO4EPGWNZSJIIBRI4FYKQADSXKJQBSDQTHCUWJDODLAMULAHYICPU3NWWUS357YKIC5TLZVAXCSDBBANFX3AAAVPIE,TRUE,FALSE,131,m,131,,https://www.strava.com/activities/2847042042,https://www.strava.com/activities/2847042042?utm_content=1464505&utm_medium=referral&utm_source=twitter,went for a 15.8 kilometer Ride.,TRUE,FALSE,,247,,FALSE,FALSE,FALSE,FALSE,everyone
2846589989,Morning Ride,Ride,Ride,Ride,FALSE,,,"Thu, 11/7/2019",1573115018,2019-11-06T19:23:38+0000,Thu,15.63,15637,15.637,kilometers,km,32:12:00,1932,36:53:00,2213,FALSE,https://d3o5xota0a1fcr.cloudfront.net/v6/maps/OKOJOT47SNEZGRGXNOEUL2U3TDNEERB3QFH2ATZBXCJ6ZXXLUBJGJMPK7TSXBM32PPXWYJ2JJDJEP6EN2TNWRLPO76JES4ZR,TRUE,FALSE,119,m,119,,https://www.strava.com/activities/2846589989,https://www.strava.com/activities/2846589989?utm_content=1464505&utm_medium=referral&utm_source=twitter,went for a 15.6 kilometer Ride.,TRUE,FALSE,,403,,FALSE,FALSE,FALSE,FALSE,everyone
2843472601,Morning Ride,Ride,Ride,Ride,FALSE,,,"Wed, 11/6/2019",1573019099,2019-11-05T16:44:59+0000,Wed,48.16,48159.5,48.1595,kilometers,km,1:37:36,5856,2:10:00,7800,FALSE,https://d3o5xota0a1fcr.cloudfront.net/v6/maps/PRFZ56V3Q3D4RPLMMGBK4OIQJJJ7D7OZJJ2FCE5S7PL4E45TBLTKDIS5SV3PAS3TLIA2CBQRYC76CZ2XNNBVXONX5FWMMTRI,TRUE,FALSE,207,m,207,,https://www.strava.com/activities/2843472601,https://www.strava.com/activities/2843472601?utm_content=1464505&utm_medium=referral&utm_source=twitter,went for a 48.1 kilometer Ride.,TRUE,FALSE,,1127,,FALSE,FALSE,FALSE,FALSE,everyone
2841957612,Afternoon Ride,Ride,Ride,Ride,FALSE,,,"Tue, 11/5/2019",1572974406,2019-11-05T04:20:06+0000,Tue,15.42,15428.2,15.4282,kilometers,km,29:17:00,1757,32:40:00,1960,FALSE,https://d3o5xota0a1fcr.cloudfront.net/v6/maps/MLOQAVDNCBVDEVP7EJ6CZNHYEZQLDSVQBNHFDM6JFJYEY6TDSE5BTZBC54SWO6XJM4T26I7KNEGMBTOGNRBD7HFR4R3X3MIW,TRUE,FALSE,119,m,119,,https://www.strava.com/activities/2841957612,https://www.strava.com/activities/2841957612?utm_content=1464505&utm_medium=referral&utm_source=twitter,went for a 15.4 kilometer Ride.,TRUE,FALSE,,419,,FALSE,FALSE,FALSE,FALSE,everyone
